NB,Change, Marker, Request, Result 
1,null,,,It appears that you have not provided any specific question or topic for discussion. Please let us know how we can assist you.
3,Delete Class ,Error : ProjectDiscovery CU : CDOProjectDiscovery.java Line : 15,The metaclass ProjectDiscovery is removed and the class ProjectDiscovery is removed also  Coevolve this java code snippet according to the described change  :   import org.eclipse.modisco.infra.discovery.benchmark.ProjectDiscovery    Give the updated java method only If there is any instruction to remove  please comment it,import org.eclipse.modisco.infra.discovery.benchmark.ProjectDiscovery     public class CoevolveJavaCode {      // Updated method after removing the metaclass and class            // Commented out the import statement for the removed class      //import org.eclipse.modisco.infra.discovery.benchmark.ProjectDiscovery             // Updated method without any reference to the removed metaclass and class      public void updatedMethod() {          // Your code here      }  }
4,Delete Class ,Error : ProjectDiscovery CU : CDOProjectDiscovery.java Line : 27,Considering a metaclass called ProjectDiscovery The class ProjectDiscovery is generated from this metaclass. Here is a change: the metaclass ProjectDiscovery is removed with all the generated classes and properties are removed.  Coevolve this java code snippet according to the described change  :    OTHER CODE DETECTED   Give the updated java method only,If the metaclass `ProjectDiscovery` is removed along with all the generated classes and properties  the corresponding Java code snippet would be updated as follows:    ```java  public void method() {      // Updated code  }  ```    Please note that without any further details or context  it is not possible to provide a more specific or accurate update to the code snippet.
5,Delete Class ,Error : DiscoveredProject CU : JavaDiscoveredProjectImpl.java Line : 26,The metaclass DiscoveredProject is removed and the class DiscoveredProject is removed also  Coevolve this java code snippet according to the described change  :   import org.eclipse.modisco.infra.discovery.benchmark.BenchmarkPackage  import org.eclipse.modisco.infra.discovery.benchmark.DiscoveredProject  import org.eclipse.modisco.infra.discovery.benchmark.Discovery    Give the updated java method only If there is any instruction to remove  please comment it,import org.eclipse.modisco.infra.discovery.benchmark.BenchmarkPackage   import org.eclipse.modisco.infra.discovery.benchmark.Discovery     // Remove import org.eclipse.modisco.infra.discovery.benchmark.DiscoveredProject     public class CoevolvedClass {      public void coevolvedMethod() {          // Remove DiscoveredProject metaclass                    // Updated code          BenchmarkPackage.eINSTANCE.getESubpackages().remove(BenchmarkPackage.eINSTANCE.getDiscovery())           BenchmarkPackage.eINSTANCE.getESubpackages().remove(BenchmarkPackage.eINSTANCE.getDiscoveredElement())           // Remove Discovery.INSTANCES.add(DISCOVERED_PROJECT_INSTANCE)       }  }
6,null,Error : JavaDiscoveredProjectImpl CU : JavaDiscoveredProjectImpl.java Line : 52,,Artificial intelligence (AI) is a branch of computer science that focuses on the development of intelligent machines that can perform tasks that would typically require human intelligence. These tasks may include speech recognition  decision-making  problem-solving  and learning.    AI is built on the concept of creating computer systems that can mimic human intelligence by analyzing large amounts of data  recognizing patterns  and making intelligent decisions based on this information. AI algorithms are designed to learn from examples or experiences and improve their performance over time.    There are different types of AI  including narrow or weak AI and general or strong AI. Narrow AI is designed to perform specific tasks and is prevalent in applications like voice assistants  image recognition systems  and recommendation engines. General AI  on the other hand  refers to AI systems that have the ability to understand  learn  and apply knowledge across a wide range of tasks  similar to human intelligence.    AI has numerous applications across various industries  including healthcare  finance  transportation  and entertainment. For example  in healthcare  AI can be used to analyze medical records and diagnostic images  assist in drug discovery  and provide personalized patient care. In finance  AI can be utilized to detect fraudulent transactions  predict market trends  and automate trading. In transportation  AI can be applied to autonomous vehicles  traffic management  and route optimization.    While AI has the potential to bring about significant advancements and benefits  there are also concerns surrounding its ethical implications  including issues related to privacy  bias  and job displacement. As AI continues to advance  it is important to ensure that it is developed and used responsibly to maximize its positive impact on society.
7,Delete Class ,Error : DiscoveredProject CU : JavaDiscoveredProjectImpl.java Line : 373,Considering a metaclass called DiscoveredProject The class DiscoveredProject is generated from this metaclass. Here is a change: the metaclass DiscoveredProject is removed with all the generated classes and properties are removed.  Coevolve this java code snippet according to the described change  :   /**   * <!-- begin-user-doc --> <!-- end-user-doc -->  * @generated  */ @Override public int eBaseStructuralFeatureID(int derivedFeatureID Class<?> baseClass){   if (baseClass == Project.class) { switch (derivedFeatureID) { case JavaBenchmarkPackage.JAVA_DISCOVERED_PROJECT__NAME:      return BenchmarkPackage.PROJECT__NAME  case JavaBenchmarkPackage.JAVA_DISCOVERED_PROJECT__TOTAL_LINES:    return BenchmarkPackage.PROJECT__TOTAL_LINES  case JavaBenchmarkPackage.JAVA_DISCOVERED_PROJECT__FILES:  return BenchmarkPackage.PROJECT__FILES  case JavaBenchmarkPackage.JAVA_DISCOVERED_PROJECT__AVERAGE_FILE_SIZE_IN_BYTES:return BenchmarkPackage.PROJECT__AVERAGE_FILE_SIZE_IN_BYTES  case JavaBenchmarkPackage.JAVA_DISCOVERED_PROJECT__AVERAGE_LINES_PER_FILE:return BenchmarkPackage.PROJECT__AVERAGE_LINES_PER_FILE  case JavaBenchmarkPackage.JAVA_DISCOVERED_PROJECT__TOTAL_SIZE_IN_BYTES:return BenchmarkPackage.PROJECT__TOTAL_SIZE_IN_BYTES  default:return -1  } } if (baseClass == DiscoveredProject.class) { switch (derivedFeatureID) { case JavaBenchmarkPackage.JAVA_DISCOVERED_PROJECT__DISCOVERIES:return BenchmarkPackage.DISCOVERED_PROJECT__DISCOVERIES  default:return -1  } } return super.eBaseStructuralFeatureID(derivedFeatureID baseClass)  }   Give the updated java method only,@Override  public int eBaseStructuralFeatureID(int derivedFeatureID  Class<?> baseClass) {      if (baseClass == Project.class) {          switch (derivedFeatureID) {              case JavaBenchmarkPackage.JAVA_DISCOVERED_PROJECT__NAME:                  return BenchmarkPackage.PROJECT__NAME               case JavaBenchmarkPackage.JAVA_DISCOVERED_PROJECT__TOTAL_LINES:                  return BenchmarkPackage.PROJECT__TOTAL_LINES               case JavaBenchmarkPackage.JAVA_DISCOVERED_PROJECT__FILES:                  return BenchmarkPackage.PROJECT__FILES               case JavaBenchmarkPackage.JAVA_DISCOVERED_PROJECT__AVERAGE_FILE_SIZE_IN_BYTES:                  return BenchmarkPackage.PROJECT__AVERAGE_FILE_SIZE_IN_BYTES               case JavaBenchmarkPackage.JAVA_DISCOVERED_PROJECT__AVERAGE_LINES_PER_FILE:                  return BenchmarkPackage.PROJECT__AVERAGE_LINES_PER_FILE               case JavaBenchmarkPackage.JAVA_DISCOVERED_PROJECT__TOTAL_SIZE_IN_BYTES:                  return BenchmarkPackage.PROJECT__TOTAL_SIZE_IN_BYTES               default:                  return -1           }      }      return super.eBaseStructuralFeatureID(derivedFeatureID  baseClass)   }
8,Extract property,Error : DISCOVERED_PROJECT__DISCOVERIES CU : JavaDiscoveredProjectImpl.java Line : 375,,There are many ways to earn money  but here are some common methods:    1. Getting a job: This can be a traditional 9-5 job with a company  or a part-time job. You can look for job openings online  in newspapers  or through networking.    2. Freelancing: If you have a skill or expertise in a particular area  you can offer your services as a freelancer. This can include writing  graphic design  web development  consulting  and more. Websites like Upwork  Freelancer  and Fiverr can help you find clients.    3. Starting a business: If you have an entrepreneurial spirit  starting your own business can be a great way to make money. This can be anything from a small local shop to an online store. It requires hard work  planning  and investment  but can be very rewarding.    4. Investing: Investing in stocks  real estate  or other assets can grow your wealth over time. However  it is important to educate yourself and understand the risks involved before getting started.    5. Renting out property or assets: If you have extra space or own assets that are not being used  you can consider renting them out. This can include renting out a spare room on Airbnb  renting out a car  or even renting out equipment or tools.    6. Online surveys and microtasks: There are many websites that pay users to complete surveys  watch videos  or complete small tasks. While the earnings may not be substantial  it can be an easy and flexible way to make some extra money.    7. Teaching or tutoring: If you have knowledge in a particular subject  you can offer your services as a tutor or teacher. This can be done online or in-person  and you can teach anything from academic subjects to music or sports.    Remember  earning money requires effort and dedication. It is important to find a method that aligns with your skills  interests  and goals.
9,Delete Class ,Error : DiscoveredProject CU : JavaDiscoveredProjectImpl.java Line : 400,Considering a metaclass called DiscoveredProject The class DiscoveredProject is generated from this metaclass. Here is a change: the metaclass DiscoveredProject is removed with all the generated classes and properties are removed.  Coevolve this java code snippet according to the described change  :   /**   * <!-- begin-user-doc --> <!-- end-user-doc -->  * @generated  */ @Override public int eDerivedStructuralFeatureID(int baseFeatureID Class<?> baseClass){   if (baseClass == Project.class) { switch (baseFeatureID) { case BenchmarkPackage.PROJECT__NAME:      return JavaBenchmarkPackage.JAVA_DISCOVERED_PROJECT__NAME  case BenchmarkPackage.PROJECT__TOTAL_LINES:    return JavaBenchmarkPackage.JAVA_DISCOVERED_PROJECT__TOTAL_LINES  case BenchmarkPackage.PROJECT__FILES:  return JavaBenchmarkPackage.JAVA_DISCOVERED_PROJECT__FILES  case BenchmarkPackage.PROJECT__AVERAGE_FILE_SIZE_IN_BYTES:return JavaBenchmarkPackage.JAVA_DISCOVERED_PROJECT__AVERAGE_FILE_SIZE_IN_BYTES  case BenchmarkPackage.PROJECT__AVERAGE_LINES_PER_FILE:return JavaBenchmarkPackage.JAVA_DISCOVERED_PROJECT__AVERAGE_LINES_PER_FILE  case BenchmarkPackage.PROJECT__TOTAL_SIZE_IN_BYTES:return JavaBenchmarkPackage.JAVA_DISCOVERED_PROJECT__TOTAL_SIZE_IN_BYTES  default:return -1  } } if (baseClass == DiscoveredProject.class) { switch (baseFeatureID) { case BenchmarkPackage.DISCOVERED_PROJECT__DISCOVERIES:return JavaBenchmarkPackage.JAVA_DISCOVERED_PROJECT__DISCOVERIES  default:return -1  } } return super.eDerivedStructuralFeatureID(baseFeatureID baseClass)  }   Give the updated java method only,@Override  public int eDerivedStructuralFeatureID(int baseFeatureID  Class<?> baseClass) {      if (baseClass == Project.class) {          switch (baseFeatureID) {              case BenchmarkPackage.PROJECT__NAME:                  return JavaBenchmarkPackage.JAVA_DISCOVERED_PROJECT__NAME               case BenchmarkPackage.PROJECT__TOTAL_LINES:                  return JavaBenchmarkPackage.JAVA_DISCOVERED_PROJECT__TOTAL_LINES               case BenchmarkPackage.PROJECT__FILES:                  return JavaBenchmarkPackage.JAVA_DISCOVERED_PROJECT__FILES               case BenchmarkPackage.PROJECT__AVERAGE_FILE_SIZE_IN_BYTES:                  return JavaBenchmarkPackage.JAVA_DISCOVERED_PROJECT__AVERAGE_FILE_SIZE_IN_BYTES               case BenchmarkPackage.PROJECT__AVERAGE_LINES_PER_FILE:                  return JavaBenchmarkPackage.JAVA_DISCOVERED_PROJECT__AVERAGE_LINES_PER_FILE               case BenchmarkPackage.PROJECT__TOTAL_SIZE_IN_BYTES:                  return JavaBenchmarkPackage.JAVA_DISCOVERED_PROJECT__TOTAL_SIZE_IN_BYTES               default:                  return -1           }      }      return super.eDerivedStructuralFeatureID(baseFeatureID  baseClass)   }
10,Extract property,Error : DISCOVERED_PROJECT__DISCOVERIES CU : JavaDiscoveredProjectImpl.java Line : 402,,It is difficult to determine the exact number of people who may have experienced déjà vu  as it is a subjective experience and not everyone may remember or recognize it when it occurs. However  surveys have shown that approximately 60-80% of people report having experienced déjà vu at some point in their lives.
11,Delete Class ,Error : ProjectDiscovery CU : CDOProjectDiscoveryImpl.java Line : 29,The metaclass ProjectDiscovery is removed and the class ProjectDiscovery is removed also  Coevolve this java code snippet according to the described change  :   import org.eclipse.modisco.infra.discovery.benchmark.Project  import org.eclipse.modisco.infra.discovery.benchmark.ProjectDiscovery  import org.eclipse.modisco.java.discoverer.benchmark.javaBenchmark.CDOProjectDiscovery    Give the updated java method only If there is any instruction to remove  please comment it,import org.eclipse.modisco.infra.discovery.benchmark.Project   import org.eclipse.modisco.java.discoverer.benchmark.javaBenchmark.CDOProjectDiscovery     public class UpdatedClass {      public static void main(String[] args) {          // Remove the following line as the metaclass ProjectDiscovery is removed          // import org.eclipse.modisco.infra.discovery.benchmark.ProjectDiscovery                     // Updated code          Project project = new Project()           CDOProjectDiscovery cdoProjectDiscovery = new CDOProjectDiscovery()                     // Rest of the code      }  }
12,null,Error : CDOProjectDiscoveryImpl CU : CDOProjectDiscoveryImpl.java Line : 58,,The term "microcosm" refers to a small or miniature version of something larger or more complex. It is often used to describe a situation  group  or community that is seen as representative of a larger society or system.    In this context  a microcosm can be understood as a small-scale representation of the larger world. It is like a miniature world that mirrors the complexities  dynamics  and interactions found in the broader society. By studying and analyzing the microcosm  one can gain insights into the larger system and understand its functioning.    For example  a school can be seen as a microcosm of society. Within the school  there are diverse groups of students  teachers  administrators  and staff who interact with each other and form social relationships. The hierarchical structure  power dynamics  and social norms present in society can also be observed within the school. By studying the interactions and dynamics within the school  one can gain a better understanding of broader social phenomena.    Similarly  a workplace can also be considered a microcosm. It reflects the organizational structure  power dynamics  and social interactions found in larger society. By examining the workplace  one can analyze issues such as power struggles  gender dynamics  and interpersonal relationships  which are prevalent in the broader social context.    Overall  the concept of microcosm helps us to understand the larger world by examining and analyzing smaller-scale systems that mirror its complexities. It allows for a more focused and detailed examination of social phenomena  providing insights into broader societal dynamics.
13,Extract property,Error : DISCOVERY__DICOVERY_DATE CU : CDOProjectDiscoveryImpl.java Line : 795,The literal DISCOVERY__DICOVERY_DATE is generated by combining the literal of the source class and the literal of the attribute  The attribute dicoveryDate is moved from the class Discovery to the class DiscoveryIteration through the reference iterations Coevolve this java code snippet according to the described change  :   /**   * <!-- begin-user-doc --> <!-- end-user-doc -->  * @generated  */ @Override public int eBaseStructuralFeatureID(int derivedFeatureID Class<?> baseClass){   if (baseClass == Discovery.class) { switch (derivedFeatureID) { case JavaBenchmarkPackage.CDO_PROJECT_DISCOVERY__DICOVERY_DATE:      return BenchmarkPackage.DISCOVERY__DICOVERY_DATE  case JavaBenchmarkPackage.CDO_PROJECT_DISCOVERY__ALGORITHM_VARIANT:    return BenchmarkPackage.DISCOVERY__ALGORITHM_VARIANT  case JavaBenchmarkPackage.CDO_PROJECT_DISCOVERY__DISCOVERER_ID:  return BenchmarkPackage.DISCOVERY__DISCOVERER_ID  case JavaBenchmarkPackage.CDO_PROJECT_DISCOVERY__DISCOVERER_CLASS_NAME:return BenchmarkPackage.DISCOVERY__DISCOVERER_CLASS_NAME  case JavaBenchmarkPackage.CDO_PROJECT_DISCOVERY__SAVE_TIME_IN_SECONDS:return BenchmarkPackage.DISCOVERY__SAVE_TIME_IN_SECONDS  case JavaBenchmarkPackage.CDO_PROJECT_DISCOVERY__TOTAL_EXECUTION_TIME_IN_SECONDS:return BenchmarkPackage.DISCOVERY__TOTAL_EXECUTION_TIME_IN_SECONDS  case JavaBenchmarkPackage.CDO_PROJECT_DISCOVERY__META_MODEL_VARIANT:return BenchmarkPackage.DISCOVERY__META_MODEL_VARIANT  case JavaBenchmarkPackage.CDO_PROJECT_DISCOVERY__MAX_USED_MEMORY_IN_BYTES:return BenchmarkPackage.DISCOVERY__MAX_USED_MEMORY_IN_BYTES  case JavaBenchmarkPackage.CDO_PROJECT_DISCOVERY__NUMBER_OF_MODEL_ELEMENTS:return BenchmarkPackage.DISCOVERY__NUMBER_OF_MODEL_ELEMENTS  case JavaBenchmarkPackage.CDO_PROJECT_DISCOVERY__XMI_SIZE_IN_BYTES:return BenchmarkPackage.DISCOVERY__XMI_SIZE_IN_BYTES  case JavaBenchmarkPackage.CDO_PROJECT_DISCOVERY__NAME:return BenchmarkPackage.DISCOVERY__NAME  case JavaBenchmarkPackage.CDO_PROJECT_DISCOVERY__DISCOVERY_ERROR:return BenchmarkPackage.DISCOVERY__DISCOVERY_ERROR  default:return -1  } } if (baseClass == ProjectDiscovery.class) { switch (derivedFeatureID) { case JavaBenchmarkPackage.CDO_PROJECT_DISCOVERY__PROJECTS:return BenchmarkPackage.PROJECT_DISCOVERY__PROJECTS  default:return -1  } } return super.eBaseStructuralFeatureID(derivedFeatureID baseClass)  }   Give the updated java method only,@Override   public int eBaseStructuralFeatureID(int derivedFeatureID  Class<?> baseClass) {    if (baseClass == DiscoveryIteration.class) {      switch (derivedFeatureID) {        case JavaBenchmarkPackage.CDO_PROJECT_DISCOVERY__DICOVERY_DATE:          return BenchmarkPackage.DISCOVERY_ITERATION__DICOVERY_DATE         default:          return -1       }    }    return super.eBaseStructuralFeatureID(derivedFeatureID  baseClass)   }
14,Extract property,Error : DISCOVERY__ALGORITHM_VARIANT CU : CDOProjectDiscoveryImpl.java Line : 796,,I'm sorry  that query doesn't make sense. Could you please provide more information or rephrase your question?
15,Extract property,Error : DISCOVERY__SAVE_TIME_IN_SECONDS CU : CDOProjectDiscoveryImpl.java Line : 799,The literal DISCOVERY__SAVE_TIME_IN_SECONDS is generated by combining the literal of the source class and the literal of the attribute  The attribute saveTimeInSeconds is moved from the class Discovery to the class DiscoveryIteration through the reference iterations Coevolve this java code snippet according to the described change  :   /**   * <!-- begin-user-doc --> <!-- end-user-doc -->  * @generated  */ @Override public int eBaseStructuralFeatureID(int derivedFeatureID Class<?> baseClass){   if (baseClass == Discovery.class) { switch (derivedFeatureID) { case JavaBenchmarkPackage.CDO_PROJECT_DISCOVERY__DICOVERY_DATE:      return BenchmarkPackage.DISCOVERY__DICOVERY_DATE  case JavaBenchmarkPackage.CDO_PROJECT_DISCOVERY__ALGORITHM_VARIANT:    return BenchmarkPackage.DISCOVERY__ALGORITHM_VARIANT  case JavaBenchmarkPackage.CDO_PROJECT_DISCOVERY__DISCOVERER_ID:  return BenchmarkPackage.DISCOVERY__DISCOVERER_ID  case JavaBenchmarkPackage.CDO_PROJECT_DISCOVERY__DISCOVERER_CLASS_NAME:return BenchmarkPackage.DISCOVERY__DISCOVERER_CLASS_NAME  case JavaBenchmarkPackage.CDO_PROJECT_DISCOVERY__SAVE_TIME_IN_SECONDS:return BenchmarkPackage.DISCOVERY__SAVE_TIME_IN_SECONDS  case JavaBenchmarkPackage.CDO_PROJECT_DISCOVERY__TOTAL_EXECUTION_TIME_IN_SECONDS:return BenchmarkPackage.DISCOVERY__TOTAL_EXECUTION_TIME_IN_SECONDS  case JavaBenchmarkPackage.CDO_PROJECT_DISCOVERY__META_MODEL_VARIANT:return BenchmarkPackage.DISCOVERY__META_MODEL_VARIANT  case JavaBenchmarkPackage.CDO_PROJECT_DISCOVERY__MAX_USED_MEMORY_IN_BYTES:return BenchmarkPackage.DISCOVERY__MAX_USED_MEMORY_IN_BYTES  case JavaBenchmarkPackage.CDO_PROJECT_DISCOVERY__NUMBER_OF_MODEL_ELEMENTS:return BenchmarkPackage.DISCOVERY__NUMBER_OF_MODEL_ELEMENTS  case JavaBenchmarkPackage.CDO_PROJECT_DISCOVERY__XMI_SIZE_IN_BYTES:return BenchmarkPackage.DISCOVERY__XMI_SIZE_IN_BYTES  case JavaBenchmarkPackage.CDO_PROJECT_DISCOVERY__NAME:return BenchmarkPackage.DISCOVERY__NAME  case JavaBenchmarkPackage.CDO_PROJECT_DISCOVERY__DISCOVERY_ERROR:return BenchmarkPackage.DISCOVERY__DISCOVERY_ERROR  default:return -1  } } if (baseClass == ProjectDiscovery.class) { switch (derivedFeatureID) { case JavaBenchmarkPackage.CDO_PROJECT_DISCOVERY__PROJECTS:return BenchmarkPackage.PROJECT_DISCOVERY__PROJECTS  default:return -1  } } return super.eBaseStructuralFeatureID(derivedFeatureID baseClass)  }   Give the updated java method only,@Override   public int eBaseStructuralFeatureID(int derivedFeatureID  Class<?> baseClass) {      if (baseClass == DiscoveryIteration.class) {          switch (derivedFeatureID) {              case JavaBenchmarkPackage.CDO_PROJECT_DISCOVERY__DICOVERY_DATE:                  return BenchmarkPackage.DISCOVERY__DICOVERY_DATE               case JavaBenchmarkPackage.CDO_PROJECT_DISCOVERY__ALGORITHM_VARIANT:                  return BenchmarkPackage.DISCOVERY__ALGORITHM_VARIANT               case JavaBenchmarkPackage.CDO_PROJECT_DISCOVERY__DISCOVERER_ID:                  return BenchmarkPackage.DISCOVERY__DISCOVERER_ID               case JavaBenchmarkPackage.CDO_PROJECT_DISCOVERY__DISCOVERER_CLASS_NAME:                  return BenchmarkPackage.DISCOVERY__DISCOVERER_CLASS_NAME               case JavaBenchmarkPackage.CDO_PROJECT_DISCOVERY__TOTAL_EXECUTION_TIME_IN_SECONDS:                  return BenchmarkPackage.DISCOVERY__TOTAL_EXECUTION_TIME_IN_SECONDS               case JavaBenchmarkPackage.CDO_PROJECT_DISCOVERY__META_MODEL_VARIANT:                  return BenchmarkPackage.DISCOVERY__META_MODEL_VARIANT               case JavaBenchmarkPackage.CDO_PROJECT_DISCOVERY__MAX_USED_MEMORY_IN_BYTES:                  return BenchmarkPackage.DISCOVERY__MAX_USED_MEMORY_IN_BYTES               case JavaBenchmarkPackage.CDO_PROJECT_DISCOVERY__NUMBER_OF_MODEL_ELEMENTS:                  return BenchmarkPackage.DISCOVERY__NUMBER_OF_MODEL_ELEMENTS               case JavaBenchmarkPackage.CDO_PROJECT_DISCOVERY__XMI_SIZE_IN_BYTES:                  return BenchmarkPackage.DISCOVERY__XMI_SIZE_IN_BYTES               case JavaBenchmarkPackage.CDO_PROJECT_DISCOVERY__NAME:                  return BenchmarkPackage.DISCOVERY__NAME               case JavaBenchmarkPackage.CDO_PROJECT_DISCOVERY__DISCOVERY_ERROR:                  return BenchmarkPackage.DISCOVERY__DISCOVERY_ERROR               default:                  return -1           }      }      if (baseClass == ProjectDiscovery.class) {          switch (derivedFeatureID) {              case JavaBenchmarkPackage.CDO_PROJECT_DISCOVERY__PROJECTS:                  return BenchmarkPackage.PROJECT_DISCOVERY__PROJECTS               default:                  return -1           }      }      return super.eBaseStructuralFeatureID(derivedFeatureID  baseClass)   }
