33,null,Error : CDODiscoveryImpl CU : CDODiscoveryImpl.java Line : 50,,There are many positive aspects of having a job. Some of these include:    1. Financial stability: Having a job allows you to earn a steady income and meet your financial needs. It gives you the ability to pay your bills  support your family  and save for the future.    2. Personal fulfillment: Having a job can provide a sense of purpose and fulfillment. It gives you the opportunity to contribute your skills and talents to a larger cause  and to make a meaningful impact in the world.    3. Professional growth: Jobs often provide opportunities for professional growth and development. You can learn new skills  acquire knowledge  and gain valuable experience that can help advance your career.    4. Social connections: Jobs allow you to interact with colleagues and build professional networks. This can lead to friendships  mentorship opportunities  and a sense of belonging within a workplace community.    5. Personal development: Jobs provide opportunities for personal growth and self-improvement. They can help you develop important qualities such as discipline  time management  problem-solving skills  and resilience.    6. Health benefits: Many jobs offer health insurance and other benefits that can help you maintain your physical and mental well-being. This can include access to healthcare services  wellness programs  and paid time off for rest and relaxation.    7. Sense of independence: Having a job gives you a sense of independence and autonomy. It allows you to make decisions and take responsibility for your own life and livelihood.    8. Opportunities for creativity: Many jobs offer opportunities for creativity and innovation. Whether you're working in a creative field or finding innovative solutions to problems  having a job can allow you to express your creativity and contribute fresh ideas.    9. Sense of accomplishment: Successfully completing tasks and projects at work can give you a sense of accomplishment and boost your self-esteem. It can also provide motivation to set and achieve new goals.    10. Stability and security: Having a job can provide a sense of stability and security  particularly in times of economic uncertainty. It can provide you with a reliable source of income and a sense of financial security.    Overall  having a job offers numerous benefits that contribute to a fulfilling and well-rounded life.
34,Extract property,Error : DISCOVERY__DICOVERY_DATE CU : CDODiscoveryImpl.java Line : 739,The literal DISCOVERY__DICOVERY_DATE is generated by combining the literal of the source class and the literal of the attribute  The attribute dicoveryDate is moved from the class Discovery to the class DiscoveryIteration through the reference iterations Coevolve this java code snippet according to the described change  :   /**   * <!-- begin-user-doc --> <!-- end-user-doc -->  * @generated  */ @Override public int eBaseStructuralFeatureID(int derivedFeatureID Class<?> baseClass){   if (baseClass == Discovery.class) { switch (derivedFeatureID) { case JavaBenchmarkPackage.CDO_DISCOVERY__DICOVERY_DATE:      return BenchmarkPackage.DISCOVERY__DICOVERY_DATE  case JavaBenchmarkPackage.CDO_DISCOVERY__ALGORITHM_VARIANT:    return BenchmarkPackage.DISCOVERY__ALGORITHM_VARIANT  case JavaBenchmarkPackage.CDO_DISCOVERY__DISCOVERER_ID:  return BenchmarkPackage.DISCOVERY__DISCOVERER_ID  case JavaBenchmarkPackage.CDO_DISCOVERY__DISCOVERER_CLASS_NAME:return BenchmarkPackage.DISCOVERY__DISCOVERER_CLASS_NAME  case JavaBenchmarkPackage.CDO_DISCOVERY__SAVE_TIME_IN_SECONDS:return BenchmarkPackage.DISCOVERY__SAVE_TIME_IN_SECONDS  case JavaBenchmarkPackage.CDO_DISCOVERY__TOTAL_EXECUTION_TIME_IN_SECONDS:return BenchmarkPackage.DISCOVERY__TOTAL_EXECUTION_TIME_IN_SECONDS  case JavaBenchmarkPackage.CDO_DISCOVERY__META_MODEL_VARIANT:return BenchmarkPackage.DISCOVERY__META_MODEL_VARIANT  case JavaBenchmarkPackage.CDO_DISCOVERY__MAX_USED_MEMORY_IN_BYTES:return BenchmarkPackage.DISCOVERY__MAX_USED_MEMORY_IN_BYTES  case JavaBenchmarkPackage.CDO_DISCOVERY__NUMBER_OF_MODEL_ELEMENTS:return BenchmarkPackage.DISCOVERY__NUMBER_OF_MODEL_ELEMENTS  case JavaBenchmarkPackage.CDO_DISCOVERY__XMI_SIZE_IN_BYTES:return BenchmarkPackage.DISCOVERY__XMI_SIZE_IN_BYTES  case JavaBenchmarkPackage.CDO_DISCOVERY__NAME:return BenchmarkPackage.DISCOVERY__NAME  case JavaBenchmarkPackage.CDO_DISCOVERY__DISCOVERY_ERROR:return BenchmarkPackage.DISCOVERY__DISCOVERY_ERROR  default:return -1  } } return super.eBaseStructuralFeatureID(derivedFeatureID baseClass)  }   Give the updated java method only,@Override   public int eBaseStructuralFeatureID(int derivedFeatureID  Class<?> baseClass) {    if (baseClass == DiscoveryIteration.class) {      switch (derivedFeatureID) {        case JavaBenchmarkPackage.CDO_DISCOVERY__DICOVERY_DATE: return BenchmarkPackage.DISCOVERY_ITERATION__DICOVERY_DATE       }    }    return super.eBaseStructuralFeatureID(derivedFeatureID  baseClass)   }
35,Extract property,Error : DISCOVERY__ALGORITHM_VARIANT CU : CDODiscoveryImpl.java Line : 740,,I'm sorry  but I cannot answer that question as it is not clear what you are asking. Can you please provide more information or clarify your question?
36,Extract property,Error : DISCOVERY__SAVE_TIME_IN_SECONDS CU : CDODiscoveryImpl.java Line : 743,The literal DISCOVERY__SAVE_TIME_IN_SECONDS is generated by combining the literal of the source class and the literal of the attribute  The attribute saveTimeInSeconds is moved from the class Discovery to the class DiscoveryIteration through the reference iterations Coevolve this java code snippet according to the described change  :   /**   * <!-- begin-user-doc --> <!-- end-user-doc -->  * @generated  */ @Override public int eBaseStructuralFeatureID(int derivedFeatureID Class<?> baseClass){   if (baseClass == Discovery.class) { switch (derivedFeatureID) { case JavaBenchmarkPackage.CDO_DISCOVERY__DICOVERY_DATE:      return BenchmarkPackage.DISCOVERY__DICOVERY_DATE  case JavaBenchmarkPackage.CDO_DISCOVERY__ALGORITHM_VARIANT:    return BenchmarkPackage.DISCOVERY__ALGORITHM_VARIANT  case JavaBenchmarkPackage.CDO_DISCOVERY__DISCOVERER_ID:  return BenchmarkPackage.DISCOVERY__DISCOVERER_ID  case JavaBenchmarkPackage.CDO_DISCOVERY__DISCOVERER_CLASS_NAME:return BenchmarkPackage.DISCOVERY__DISCOVERER_CLASS_NAME  case JavaBenchmarkPackage.CDO_DISCOVERY__SAVE_TIME_IN_SECONDS:return BenchmarkPackage.DISCOVERY__SAVE_TIME_IN_SECONDS  case JavaBenchmarkPackage.CDO_DISCOVERY__TOTAL_EXECUTION_TIME_IN_SECONDS:return BenchmarkPackage.DISCOVERY__TOTAL_EXECUTION_TIME_IN_SECONDS  case JavaBenchmarkPackage.CDO_DISCOVERY__META_MODEL_VARIANT:return BenchmarkPackage.DISCOVERY__META_MODEL_VARIANT  case JavaBenchmarkPackage.CDO_DISCOVERY__MAX_USED_MEMORY_IN_BYTES:return BenchmarkPackage.DISCOVERY__MAX_USED_MEMORY_IN_BYTES  case JavaBenchmarkPackage.CDO_DISCOVERY__NUMBER_OF_MODEL_ELEMENTS:return BenchmarkPackage.DISCOVERY__NUMBER_OF_MODEL_ELEMENTS  case JavaBenchmarkPackage.CDO_DISCOVERY__XMI_SIZE_IN_BYTES:return BenchmarkPackage.DISCOVERY__XMI_SIZE_IN_BYTES  case JavaBenchmarkPackage.CDO_DISCOVERY__NAME:return BenchmarkPackage.DISCOVERY__NAME  case JavaBenchmarkPackage.CDO_DISCOVERY__DISCOVERY_ERROR:return BenchmarkPackage.DISCOVERY__DISCOVERY_ERROR  default:return -1  } } return super.eBaseStructuralFeatureID(derivedFeatureID baseClass)  }   Give the updated java method only,/**    * <!-- begin-user-doc --> <!-- end-user-doc -->   * @generated   */  @Override  public int eBaseStructuralFeatureID(int derivedFeatureID  Class<?> baseClass) {      if (baseClass == Discovery.class) {          switch (derivedFeatureID) {              case JavaBenchmarkPackage.CDO_DISCOVERY__DICOVERY_DATE: return BenchmarkPackage.DISCOVERY__DICOVERY_DATE               case JavaBenchmarkPackage.CDO_DISCOVERY__ALGORITHM_VARIANT: return BenchmarkPackage.DISCOVERY__ALGORITHM_VARIANT               case JavaBenchmarkPackage.CDO_DISCOVERY__DISCOVERER_ID: return BenchmarkPackage.DISCOVERY__DISCOVERER_ID               case JavaBenchmarkPackage.CDO_DISCOVERY__DISCOVERER_CLASS_NAME: return BenchmarkPackage.DISCOVERY__DISCOVERER_CLASS_NAME               case JavaBenchmarkPackage.CDO_DISCOVERY__TOTAL_EXECUTION_TIME_IN_SECONDS: return BenchmarkPackage.DISCOVERY__TOTAL_EXECUTION_TIME_IN_SECONDS               case JavaBenchmarkPackage.CDO_DISCOVERY__META_MODEL_VARIANT: return BenchmarkPackage.DISCOVERY__META_MODEL_VARIANT               case JavaBenchmarkPackage.CDO_DISCOVERY__MAX_USED_MEMORY_IN_BYTES: return BenchmarkPackage.DISCOVERY__MAX_USED_MEMORY_IN_BYTES               case JavaBenchmarkPackage.CDO_DISCOVERY__NUMBER_OF_MODEL_ELEMENTS: return BenchmarkPackage.DISCOVERY__NUMBER_OF_MODEL_ELEMENTS               case JavaBenchmarkPackage.CDO_DISCOVERY__XMI_SIZE_IN_BYTES: return BenchmarkPackage.DISCOVERY__XMI_SIZE_IN_BYTES               case JavaBenchmarkPackage.CDO_DISCOVERY__NAME: return BenchmarkPackage.DISCOVERY__NAME               case JavaBenchmarkPackage.CDO_DISCOVERY__DISCOVERY_ERROR: return BenchmarkPackage.DISCOVERY__DISCOVERY_ERROR               default: return -1           }      }      return super.eBaseStructuralFeatureID(derivedFeatureID  baseClass)   }
37,Extract property,Error : DISCOVERY__TOTAL_EXECUTION_TIME_IN_SECONDS CU : CDODiscoveryImpl.java Line : 744,The literal DISCOVERY__TOTAL_EXECUTION_TIME_IN_SECONDS is generated by combining the literal of the source class and the literal of the attribute  The attribute totalExecutionTimeInSeconds is moved from the class Discovery to the class DiscoveryIteration through the reference iterations Coevolve this java code snippet according to the described change  :   /**   * <!-- begin-user-doc --> <!-- end-user-doc -->  * @generated  */ @Override public int eBaseStructuralFeatureID(int derivedFeatureID Class<?> baseClass){   if (baseClass == Discovery.class) { switch (derivedFeatureID) { case JavaBenchmarkPackage.CDO_DISCOVERY__DICOVERY_DATE:      return BenchmarkPackage.DISCOVERY__DICOVERY_DATE  case JavaBenchmarkPackage.CDO_DISCOVERY__ALGORITHM_VARIANT:    return BenchmarkPackage.DISCOVERY__ALGORITHM_VARIANT  case JavaBenchmarkPackage.CDO_DISCOVERY__DISCOVERER_ID:  return BenchmarkPackage.DISCOVERY__DISCOVERER_ID  case JavaBenchmarkPackage.CDO_DISCOVERY__DISCOVERER_CLASS_NAME:return BenchmarkPackage.DISCOVERY__DISCOVERER_CLASS_NAME  case JavaBenchmarkPackage.CDO_DISCOVERY__SAVE_TIME_IN_SECONDS:return BenchmarkPackage.DISCOVERY__SAVE_TIME_IN_SECONDS  case JavaBenchmarkPackage.CDO_DISCOVERY__TOTAL_EXECUTION_TIME_IN_SECONDS:return BenchmarkPackage.DISCOVERY__TOTAL_EXECUTION_TIME_IN_SECONDS  case JavaBenchmarkPackage.CDO_DISCOVERY__META_MODEL_VARIANT:return BenchmarkPackage.DISCOVERY__META_MODEL_VARIANT  case JavaBenchmarkPackage.CDO_DISCOVERY__MAX_USED_MEMORY_IN_BYTES:return BenchmarkPackage.DISCOVERY__MAX_USED_MEMORY_IN_BYTES  case JavaBenchmarkPackage.CDO_DISCOVERY__NUMBER_OF_MODEL_ELEMENTS:return BenchmarkPackage.DISCOVERY__NUMBER_OF_MODEL_ELEMENTS  case JavaBenchmarkPackage.CDO_DISCOVERY__XMI_SIZE_IN_BYTES:return BenchmarkPackage.DISCOVERY__XMI_SIZE_IN_BYTES  case JavaBenchmarkPackage.CDO_DISCOVERY__NAME:return BenchmarkPackage.DISCOVERY__NAME  case JavaBenchmarkPackage.CDO_DISCOVERY__DISCOVERY_ERROR:return BenchmarkPackage.DISCOVERY__DISCOVERY_ERROR  default:return -1  } } return super.eBaseStructuralFeatureID(derivedFeatureID baseClass)  }   Give the updated java method only,/**    * <!-- begin-user-doc --> <!-- end-user-doc -->   * @generated   */  @Override public int eBaseStructuralFeatureID(int derivedFeatureID Class<?> baseClass){    if (baseClass == DiscoveryIteration.class) {      switch (derivedFeatureID) {        case JavaBenchmarkPackage.CDO_DISCOVERY_ITERATION__DICOVERY_DATE:      return BenchmarkPackage.DISCOVERY_ITERATION__DICOVERY_DATE         case JavaBenchmarkPackage.CDO_DISCOVERY_ITERATION__ALGORITHM_VARIANT:    return BenchmarkPackage.DISCOVERY_ITERATION__ALGORITHM_VARIANT         case JavaBenchmarkPackage.CDO_DISCOVERY_ITERATION__DISCOVERER_ID:  return BenchmarkPackage.DISCOVERY_ITERATION__DISCOVERER_ID         case JavaBenchmarkPackage.CDO_DISCOVERY_ITERATION__DISCOVERER_CLASS_NAME:return BenchmarkPackage.DISCOVERY_ITERATION__DISCOVERER_CLASS_NAME         case JavaBenchmarkPackage.CDO_DISCOVERY_ITERATION__SAVE_TIME_IN_SECONDS:return BenchmarkPackage.DISCOVERY_ITERATION__SAVE_TIME_IN_SECONDS         case JavaBenchmarkPackage.CDO_DISCOVERY_ITERATION__META_MODEL_VARIANT:return BenchmarkPackage.DISCOVERY_ITERATION__META_MODEL_VARIANT         case JavaBenchmarkPackage.CDO_DISCOVERY_ITERATION__MAX_USED_MEMORY_IN_BYTES:return BenchmarkPackage.DISCOVERY_ITERATION__MAX_USED_MEMORY_IN_BYTES         case JavaBenchmarkPackage.CDO_DISCOVERY_ITERATION__NUMBER_OF_MODEL_ELEMENTS:return BenchmarkPackage.DISCOVERY_ITERATION__NUMBER_OF_MODEL_ELEMENTS         case JavaBenchmarkPackage.CDO_DISCOVERY_ITERATION__XMI_SIZE_IN_BYTES:return BenchmarkPackage.DISCOVERY_ITERATION__XMI_SIZE_IN_BYTES         case JavaBenchmarkPackage.CDO_DISCOVERY_ITERATION__NAME:return BenchmarkPackage.DISCOVERY_ITERATION__NAME         case JavaBenchmarkPackage.CDO_DISCOVERY_ITERATION__DISCOVERY_ERROR:return BenchmarkPackage.DISCOVERY_ITERATION__DISCOVERY_ERROR         case JavaBenchmarkPackage.CDO_DISCOVERY_ITERATION__TOTAL_EXECUTION_TIME_IN_SECONDS:return BenchmarkPackage.DISCOVERY_ITERATION__TOTAL_EXECUTION_TIME_IN_SECONDS         default:return -1       }    }    return super.eBaseStructuralFeatureID(derivedFeatureID baseClass)   }
38,Extract property,Error : DISCOVERY__META_MODEL_VARIANT CU : CDODiscoveryImpl.java Line : 745,,The phrase "catch up" means to reach the same level or status as someone or something  or to update oneself on recent events or information. It can also refer to meeting or reuniting with someone after a period of time apart.
39,Extract property,Error : DISCOVERY__MAX_USED_MEMORY_IN_BYTES CU : CDODiscoveryImpl.java Line : 746,The literal DISCOVERY__MAX_USED_MEMORY_IN_BYTES is generated by combining the literal of the source class and the literal of the attribute  The attribute maxUsedMemoryInBytes is moved from the class Discovery to the class DiscoveryIteration through the reference iterations Coevolve this java code snippet according to the described change  :   /**   * <!-- begin-user-doc --> <!-- end-user-doc -->  * @generated  */ @Override public int eBaseStructuralFeatureID(int derivedFeatureID Class<?> baseClass){   if (baseClass == Discovery.class) { switch (derivedFeatureID) { case JavaBenchmarkPackage.CDO_DISCOVERY__DICOVERY_DATE:      return BenchmarkPackage.DISCOVERY__DICOVERY_DATE  case JavaBenchmarkPackage.CDO_DISCOVERY__ALGORITHM_VARIANT:    return BenchmarkPackage.DISCOVERY__ALGORITHM_VARIANT  case JavaBenchmarkPackage.CDO_DISCOVERY__DISCOVERER_ID:  return BenchmarkPackage.DISCOVERY__DISCOVERER_ID  case JavaBenchmarkPackage.CDO_DISCOVERY__DISCOVERER_CLASS_NAME:return BenchmarkPackage.DISCOVERY__DISCOVERER_CLASS_NAME  case JavaBenchmarkPackage.CDO_DISCOVERY__SAVE_TIME_IN_SECONDS:return BenchmarkPackage.DISCOVERY__SAVE_TIME_IN_SECONDS  case JavaBenchmarkPackage.CDO_DISCOVERY__TOTAL_EXECUTION_TIME_IN_SECONDS:return BenchmarkPackage.DISCOVERY__TOTAL_EXECUTION_TIME_IN_SECONDS  case JavaBenchmarkPackage.CDO_DISCOVERY__META_MODEL_VARIANT:return BenchmarkPackage.DISCOVERY__META_MODEL_VARIANT  case JavaBenchmarkPackage.CDO_DISCOVERY__MAX_USED_MEMORY_IN_BYTES:return BenchmarkPackage.DISCOVERY__MAX_USED_MEMORY_IN_BYTES  case JavaBenchmarkPackage.CDO_DISCOVERY__NUMBER_OF_MODEL_ELEMENTS:return BenchmarkPackage.DISCOVERY__NUMBER_OF_MODEL_ELEMENTS  case JavaBenchmarkPackage.CDO_DISCOVERY__XMI_SIZE_IN_BYTES:return BenchmarkPackage.DISCOVERY__XMI_SIZE_IN_BYTES  case JavaBenchmarkPackage.CDO_DISCOVERY__NAME:return BenchmarkPackage.DISCOVERY__NAME  case JavaBenchmarkPackage.CDO_DISCOVERY__DISCOVERY_ERROR:return BenchmarkPackage.DISCOVERY__DISCOVERY_ERROR  default:return -1  } } return super.eBaseStructuralFeatureID(derivedFeatureID baseClass)  }   Give the updated java method only,@Override   public int eBaseStructuralFeatureID(int derivedFeatureID  Class<?> baseClass) {    if (baseClass == DiscoveryIteration.class) {      switch (derivedFeatureID) {        case JavaBenchmarkPackage.CDO_DISCOVERY__DICOVERY_DATE:          return BenchmarkPackage.DISCOVERY_ITERATION__DICOVERY_DATE         case JavaBenchmarkPackage.CDO_DISCOVERY__ALGORITHM_VARIANT:          return BenchmarkPackage.DISCOVERY_ITERATION__ALGORITHM_VARIANT         case JavaBenchmarkPackage.CDO_DISCOVERY__DISCOVERER_ID:          return BenchmarkPackage.DISCOVERY_ITERATION__DISCOVERER_ID         case JavaBenchmarkPackage.CDO_DISCOVERY__DISCOVERER_CLASS_NAME:          return BenchmarkPackage.DISCOVERY_ITERATION__DISCOVERER_CLASS_NAME         case JavaBenchmarkPackage.CDO_DISCOVERY__SAVE_TIME_IN_SECONDS:          return BenchmarkPackage.DISCOVERY_ITERATION__SAVE_TIME_IN_SECONDS         case JavaBenchmarkPackage.CDO_DISCOVERY__TOTAL_EXECUTION_TIME_IN_SECONDS:          return BenchmarkPackage.DISCOVERY_ITERATION__TOTAL_EXECUTION_TIME_IN_SECONDS         case JavaBenchmarkPackage.CDO_DISCOVERY__META_MODEL_VARIANT:          return BenchmarkPackage.DISCOVERY_ITERATION__META_MODEL_VARIANT         case JavaBenchmarkPackage.CDO_DISCOVERY__NUMBER_OF_MODEL_ELEMENTS:          return BenchmarkPackage.DISCOVERY_ITERATION__NUMBER_OF_MODEL_ELEMENTS         case JavaBenchmarkPackage.CDO_DISCOVERY__XMI_SIZE_IN_BYTES:          return BenchmarkPackage.DISCOVERY_ITERATION__XMI_SIZE_IN_BYTES         case JavaBenchmarkPackage.CDO_DISCOVERY__NAME:          return BenchmarkPackage.DISCOVERY_ITERATION__NAME         case JavaBenchmarkPackage.CDO_DISCOVERY__DISCOVERY_ERROR:          return BenchmarkPackage.DISCOVERY_ITERATION__DISCOVERY_ERROR         case JavaBenchmarkPackage.CDO_DISCOVERY__MAX_USED_MEMORY_IN_BYTES:          return BenchmarkPackage.DISCOVERY_ITERATION__MAX_USED_MEMORY_IN_BYTES         default:          return -1       }    }    return super.eBaseStructuralFeatureID(derivedFeatureID  baseClass)   }
40,Extract property,Error : DISCOVERY__DISCOVERY_ERROR CU : CDODiscoveryImpl.java Line : 750,The literal DISCOVERY__DISCOVERY_ERROR is generated by combining the literal of the source class and the literal of the attribute  The attribute discoveryError is moved from the class Discovery to the class DiscoveryIteration through the reference iterations Coevolve this java code snippet according to the described change  :   /**   * <!-- begin-user-doc --> <!-- end-user-doc -->  * @generated  */ @Override public int eBaseStructuralFeatureID(int derivedFeatureID Class<?> baseClass){   if (baseClass == Discovery.class) { switch (derivedFeatureID) { case JavaBenchmarkPackage.CDO_DISCOVERY__DICOVERY_DATE:      return BenchmarkPackage.DISCOVERY__DICOVERY_DATE  case JavaBenchmarkPackage.CDO_DISCOVERY__ALGORITHM_VARIANT:    return BenchmarkPackage.DISCOVERY__ALGORITHM_VARIANT  case JavaBenchmarkPackage.CDO_DISCOVERY__DISCOVERER_ID:  return BenchmarkPackage.DISCOVERY__DISCOVERER_ID  case JavaBenchmarkPackage.CDO_DISCOVERY__DISCOVERER_CLASS_NAME:return BenchmarkPackage.DISCOVERY__DISCOVERER_CLASS_NAME  case JavaBenchmarkPackage.CDO_DISCOVERY__SAVE_TIME_IN_SECONDS:return BenchmarkPackage.DISCOVERY__SAVE_TIME_IN_SECONDS  case JavaBenchmarkPackage.CDO_DISCOVERY__TOTAL_EXECUTION_TIME_IN_SECONDS:return BenchmarkPackage.DISCOVERY__TOTAL_EXECUTION_TIME_IN_SECONDS  case JavaBenchmarkPackage.CDO_DISCOVERY__META_MODEL_VARIANT:return BenchmarkPackage.DISCOVERY__META_MODEL_VARIANT  case JavaBenchmarkPackage.CDO_DISCOVERY__MAX_USED_MEMORY_IN_BYTES:return BenchmarkPackage.DISCOVERY__MAX_USED_MEMORY_IN_BYTES  case JavaBenchmarkPackage.CDO_DISCOVERY__NUMBER_OF_MODEL_ELEMENTS:return BenchmarkPackage.DISCOVERY__NUMBER_OF_MODEL_ELEMENTS  case JavaBenchmarkPackage.CDO_DISCOVERY__XMI_SIZE_IN_BYTES:return BenchmarkPackage.DISCOVERY__XMI_SIZE_IN_BYTES  case JavaBenchmarkPackage.CDO_DISCOVERY__NAME:return BenchmarkPackage.DISCOVERY__NAME  case JavaBenchmarkPackage.CDO_DISCOVERY__DISCOVERY_ERROR:return BenchmarkPackage.DISCOVERY__DISCOVERY_ERROR  default:return -1  } } return super.eBaseStructuralFeatureID(derivedFeatureID baseClass)  }   Give the updated java method only,@Override public int eBaseStructuralFeatureID(int derivedFeatureID Class<?> baseClass){    if (baseClass == DiscoveryIteration.class) {      switch (derivedFeatureID) {        case JavaBenchmarkPackage.CDO_DISCOVERY__DICOVERY_DATE:      return BenchmarkPackage.DISCOVERY_ITERATION__DICOVERY_DATE         case JavaBenchmarkPackage.CDO_DISCOVERY__ALGORITHM_VARIANT:    return BenchmarkPackage.DISCOVERY_ITERATION__ALGORITHM_VARIANT         case JavaBenchmarkPackage.CDO_DISCOVERY__DISCOVERER_ID:  return BenchmarkPackage.DISCOVERY_ITERATION__DISCOVERER_ID         case JavaBenchmarkPackage.CDO_DISCOVERY__DISCOVERER_CLASS_NAME:return BenchmarkPackage.DISCOVERY_ITERATION__DISCOVERER_CLASS_NAME         case JavaBenchmarkPackage.CDO_DISCOVERY__SAVE_TIME_IN_SECONDS:return BenchmarkPackage.DISCOVERY_ITERATION__SAVE_TIME_IN_SECONDS         case JavaBenchmarkPackage.CDO_DISCOVERY__TOTAL_EXECUTION_TIME_IN_SECONDS:return BenchmarkPackage.DISCOVERY_ITERATION__TOTAL_EXECUTION_TIME_IN_SECONDS         case JavaBenchmarkPackage.CDO_DISCOVERY__META_MODEL_VARIANT:return BenchmarkPackage.DISCOVERY_ITERATION__META_MODEL_VARIANT         case JavaBenchmarkPackage.CDO_DISCOVERY__MAX_USED_MEMORY_IN_BYTES:return BenchmarkPackage.DISCOVERY_ITERATION__MAX_USED_MEMORY_IN_BYTES         case JavaBenchmarkPackage.CDO_DISCOVERY__NUMBER_OF_MODEL_ELEMENTS:return BenchmarkPackage.DISCOVERY_ITERATION__NUMBER_OF_MODEL_ELEMENTS         case JavaBenchmarkPackage.CDO_DISCOVERY__XMI_SIZE_IN_BYTES:return BenchmarkPackage.DISCOVERY_ITERATION__XMI_SIZE_IN_BYTES         case JavaBenchmarkPackage.CDO_DISCOVERY__NAME:return BenchmarkPackage.DISCOVERY_ITERATION__NAME         case JavaBenchmarkPackage.CDO_DISCOVERY__DISCOVERY_ERROR:return BenchmarkPackage.DISCOVERY_ITERATION__DISCOVERY_ERROR         default:return -1       }    }    return super.eBaseStructuralFeatureID(derivedFeatureID baseClass)   }
