41,Extract property,Error : DISCOVERY__DICOVERY_DATE CU : CDODiscoveryImpl.java Line : 766,The literal DISCOVERY__DICOVERY_DATE is generated by combining the literal of the source class and the literal of the attribute  The attribute dicoveryDate is moved from the class Discovery to the class DiscoveryIteration through the reference iterations Coevolve this java code snippet according to the described change  :   /**   * <!-- begin-user-doc --> <!-- end-user-doc -->  * @generated  */ @Override public int eDerivedStructuralFeatureID(int baseFeatureID Class<?> baseClass){   if (baseClass == Discovery.class) { switch (baseFeatureID) { case BenchmarkPackage.DISCOVERY__DICOVERY_DATE:      return JavaBenchmarkPackage.CDO_DISCOVERY__DICOVERY_DATE  case BenchmarkPackage.DISCOVERY__ALGORITHM_VARIANT:    return JavaBenchmarkPackage.CDO_DISCOVERY__ALGORITHM_VARIANT  case BenchmarkPackage.DISCOVERY__DISCOVERER_ID:  return JavaBenchmarkPackage.CDO_DISCOVERY__DISCOVERER_ID  case BenchmarkPackage.DISCOVERY__DISCOVERER_CLASS_NAME:return JavaBenchmarkPackage.CDO_DISCOVERY__DISCOVERER_CLASS_NAME  case BenchmarkPackage.DISCOVERY__SAVE_TIME_IN_SECONDS:return JavaBenchmarkPackage.CDO_DISCOVERY__SAVE_TIME_IN_SECONDS  case BenchmarkPackage.DISCOVERY__TOTAL_EXECUTION_TIME_IN_SECONDS:return JavaBenchmarkPackage.CDO_DISCOVERY__TOTAL_EXECUTION_TIME_IN_SECONDS  case BenchmarkPackage.DISCOVERY__META_MODEL_VARIANT:return JavaBenchmarkPackage.CDO_DISCOVERY__META_MODEL_VARIANT  case BenchmarkPackage.DISCOVERY__MAX_USED_MEMORY_IN_BYTES:return JavaBenchmarkPackage.CDO_DISCOVERY__MAX_USED_MEMORY_IN_BYTES  case BenchmarkPackage.DISCOVERY__NUMBER_OF_MODEL_ELEMENTS:return JavaBenchmarkPackage.CDO_DISCOVERY__NUMBER_OF_MODEL_ELEMENTS  case BenchmarkPackage.DISCOVERY__XMI_SIZE_IN_BYTES:return JavaBenchmarkPackage.CDO_DISCOVERY__XMI_SIZE_IN_BYTES  case BenchmarkPackage.DISCOVERY__NAME:return JavaBenchmarkPackage.CDO_DISCOVERY__NAME  case BenchmarkPackage.DISCOVERY__DISCOVERY_ERROR:return JavaBenchmarkPackage.CDO_DISCOVERY__DISCOVERY_ERROR  default:return -1  } } return super.eDerivedStructuralFeatureID(baseFeatureID baseClass)  }   Give the updated java method only,@Override   public int eDerivedStructuralFeatureID(int baseFeatureID  Class<?> baseClass) {    if (baseClass == Discovery.class) {      switch (baseFeatureID) {        case BenchmarkPackage.DISCOVERY__ALGORITHM_VARIANT:              return JavaBenchmarkPackage.CDO_DISCOVERY__ALGORITHM_VARIANT         case BenchmarkPackage.DISCOVERY__DISCOVERER_ID:            return JavaBenchmarkPackage.CDO_DISCOVERY__DISCOVERER_ID         case BenchmarkPackage.DISCOVERY__DISCOVERER_CLASS_NAME:          return JavaBenchmarkPackage.CDO_DISCOVERY__DISCOVERER_CLASS_NAME         case BenchmarkPackage.DISCOVERY__SAVE_TIME_IN_SECONDS:          return JavaBenchmarkPackage.CDO_DISCOVERY__SAVE_TIME_IN_SECONDS         case BenchmarkPackage.DISCOVERY__TOTAL_EXECUTION_TIME_IN_SECONDS:          return JavaBenchmarkPackage.CDO_DISCOVERY__TOTAL_EXECUTION_TIME_IN_SECONDS         case BenchmarkPackage.DISCOVERY__META_MODEL_VARIANT:          return JavaBenchmarkPackage.CDO_DISCOVERY__META_MODEL_VARIANT         case BenchmarkPackage.DISCOVERY__MAX_USED_MEMORY_IN_BYTES:          return JavaBenchmarkPackage.CDO_DISCOVERY__MAX_USED_MEMORY_IN_BYTES         case BenchmarkPackage.DISCOVERY__NUMBER_OF_MODEL_ELEMENTS:          return JavaBenchmarkPackage.CDO_DISCOVERY__NUMBER_OF_MODEL_ELEMENTS         case BenchmarkPackage.DISCOVERY__XMI_SIZE_IN_BYTES:          return JavaBenchmarkPackage.CDO_DISCOVERY__XMI_SIZE_IN_BYTES         case BenchmarkPackage.DISCOVERY__NAME:          return JavaBenchmarkPackage.CDO_DISCOVERY__NAME         case BenchmarkPackage.DISCOVERY__DISCOVERY_ERROR:          return JavaBenchmarkPackage.CDO_DISCOVERY__DISCOVERY_ERROR         default:          return super.eDerivedStructuralFeatureID(baseFeatureID  baseClass)       }    }    return super.eDerivedStructuralFeatureID(baseFeatureID  baseClass)   }
42,Extract property,Error : DISCOVERY__ALGORITHM_VARIANT CU : CDODiscoveryImpl.java Line : 767,,I'm sorry  can you please provide more context or clarify your request?
43,Extract property,Error : DISCOVERY__SAVE_TIME_IN_SECONDS CU : CDODiscoveryImpl.java Line : 770,The literal DISCOVERY__SAVE_TIME_IN_SECONDS is generated by combining the literal of the source class and the literal of the attribute  The attribute saveTimeInSeconds is moved from the class Discovery to the class DiscoveryIteration through the reference iterations Coevolve this java code snippet according to the described change  :   /**   * <!-- begin-user-doc --> <!-- end-user-doc -->  * @generated  */ @Override public int eDerivedStructuralFeatureID(int baseFeatureID Class<?> baseClass){   if (baseClass == Discovery.class) { switch (baseFeatureID) { case BenchmarkPackage.DISCOVERY__DICOVERY_DATE:      return JavaBenchmarkPackage.CDO_DISCOVERY__DICOVERY_DATE  case BenchmarkPackage.DISCOVERY__ALGORITHM_VARIANT:    return JavaBenchmarkPackage.CDO_DISCOVERY__ALGORITHM_VARIANT  case BenchmarkPackage.DISCOVERY__DISCOVERER_ID:  return JavaBenchmarkPackage.CDO_DISCOVERY__DISCOVERER_ID  case BenchmarkPackage.DISCOVERY__DISCOVERER_CLASS_NAME:return JavaBenchmarkPackage.CDO_DISCOVERY__DISCOVERER_CLASS_NAME  case BenchmarkPackage.DISCOVERY__SAVE_TIME_IN_SECONDS:return JavaBenchmarkPackage.CDO_DISCOVERY__SAVE_TIME_IN_SECONDS  case BenchmarkPackage.DISCOVERY__TOTAL_EXECUTION_TIME_IN_SECONDS:return JavaBenchmarkPackage.CDO_DISCOVERY__TOTAL_EXECUTION_TIME_IN_SECONDS  case BenchmarkPackage.DISCOVERY__META_MODEL_VARIANT:return JavaBenchmarkPackage.CDO_DISCOVERY__META_MODEL_VARIANT  case BenchmarkPackage.DISCOVERY__MAX_USED_MEMORY_IN_BYTES:return JavaBenchmarkPackage.CDO_DISCOVERY__MAX_USED_MEMORY_IN_BYTES  case BenchmarkPackage.DISCOVERY__NUMBER_OF_MODEL_ELEMENTS:return JavaBenchmarkPackage.CDO_DISCOVERY__NUMBER_OF_MODEL_ELEMENTS  case BenchmarkPackage.DISCOVERY__XMI_SIZE_IN_BYTES:return JavaBenchmarkPackage.CDO_DISCOVERY__XMI_SIZE_IN_BYTES  case BenchmarkPackage.DISCOVERY__NAME:return JavaBenchmarkPackage.CDO_DISCOVERY__NAME  case BenchmarkPackage.DISCOVERY__DISCOVERY_ERROR:return JavaBenchmarkPackage.CDO_DISCOVERY__DISCOVERY_ERROR  default:return -1  } } return super.eDerivedStructuralFeatureID(baseFeatureID baseClass)  }   Give the updated java method only,/**    * <!-- begin-user-doc --> <!-- end-user-doc -->   * @generated   */  @Override   public int eDerivedStructuralFeatureID(int baseFeatureID  Class<?> baseClass) {    if (baseClass == DiscoveryIteration.class) {      switch (baseFeatureID) {        case JavaBenchmarkPackage.DISCOVERY__DICOVERY_DATE: return JavaBenchmarkPackage.CDO_DISCOVERY_ITERATION__DICOVERY_DATE         case JavaBenchmarkPackage.DISCOVERY__ALGORITHM_VARIANT: return JavaBenchmarkPackage.CDO_DISCOVERY_ITERATION__ALGORITHM_VARIANT         case JavaBenchmarkPackage.DISCOVERY__DISCOVERER_ID: return JavaBenchmarkPackage.CDO_DISCOVERY_ITERATION__DISCOVERER_ID         case JavaBenchmarkPackage.DISCOVERY__DISCOVERER_CLASS_NAME: return JavaBenchmarkPackage.CDO_DISCOVERY_ITERATION__DISCOVERER_CLASS_NAME         case JavaBenchmarkPackage.DISCOVERY__SAVE_TIME_IN_SECONDS: return JavaBenchmarkPackage.CDO_DISCOVERY_ITERATION__SAVE_TIME_IN_SECONDS         case JavaBenchmarkPackage.DISCOVERY__TOTAL_EXECUTION_TIME_IN_SECONDS: return JavaBenchmarkPackage.CDO_DISCOVERY_ITERATION__TOTAL_EXECUTION_TIME_IN_SECONDS         case JavaBenchmarkPackage.DISCOVERY__META_MODEL_VARIANT: return JavaBenchmarkPackage.CDO_DISCOVERY_ITERATION__META_MODEL_VARIANT         case JavaBenchmarkPackage.DISCOVERY__MAX_USED_MEMORY_IN_BYTES: return JavaBenchmarkPackage.CDO_DISCOVERY_ITERATION__MAX_USED_MEMORY_IN_BYTES         case JavaBenchmarkPackage.DISCOVERY__NUMBER_OF_MODEL_ELEMENTS: return JavaBenchmarkPackage.CDO_DISCOVERY_ITERATION__NUMBER_OF_MODEL_ELEMENTS         case JavaBenchmarkPackage.DISCOVERY__XMI_SIZE_IN_BYTES: return JavaBenchmarkPackage.CDO_DISCOVERY_ITERATION__XMI_SIZE_IN_BYTES         case JavaBenchmarkPackage.DISCOVERY__NAME: return JavaBenchmarkPackage.CDO_DISCOVERY_ITERATION__NAME         case JavaBenchmarkPackage.DISCOVERY__DISCOVERY_ERROR: return JavaBenchmarkPackage.CDO_DISCOVERY_ITERATION__DISCOVERY_ERROR         default: return -1       }    }    return super.eDerivedStructuralFeatureID(baseFeatureID  baseClass)   }
44,Extract property,Error : DISCOVERY__TOTAL_EXECUTION_TIME_IN_SECONDS CU : CDODiscoveryImpl.java Line : 771,The literal DISCOVERY__TOTAL_EXECUTION_TIME_IN_SECONDS is generated by combining the literal of the source class and the literal of the attribute  The attribute totalExecutionTimeInSeconds is moved from the class Discovery to the class DiscoveryIteration through the reference iterations Coevolve this java code snippet according to the described change  :   /**   * <!-- begin-user-doc --> <!-- end-user-doc -->  * @generated  */ @Override public int eDerivedStructuralFeatureID(int baseFeatureID Class<?> baseClass){   if (baseClass == Discovery.class) { switch (baseFeatureID) { case BenchmarkPackage.DISCOVERY__DICOVERY_DATE:      return JavaBenchmarkPackage.CDO_DISCOVERY__DICOVERY_DATE  case BenchmarkPackage.DISCOVERY__ALGORITHM_VARIANT:    return JavaBenchmarkPackage.CDO_DISCOVERY__ALGORITHM_VARIANT  case BenchmarkPackage.DISCOVERY__DISCOVERER_ID:  return JavaBenchmarkPackage.CDO_DISCOVERY__DISCOVERER_ID  case BenchmarkPackage.DISCOVERY__DISCOVERER_CLASS_NAME:return JavaBenchmarkPackage.CDO_DISCOVERY__DISCOVERER_CLASS_NAME  case BenchmarkPackage.DISCOVERY__SAVE_TIME_IN_SECONDS:return JavaBenchmarkPackage.CDO_DISCOVERY__SAVE_TIME_IN_SECONDS  case BenchmarkPackage.DISCOVERY__TOTAL_EXECUTION_TIME_IN_SECONDS:return JavaBenchmarkPackage.CDO_DISCOVERY__TOTAL_EXECUTION_TIME_IN_SECONDS  case BenchmarkPackage.DISCOVERY__META_MODEL_VARIANT:return JavaBenchmarkPackage.CDO_DISCOVERY__META_MODEL_VARIANT  case BenchmarkPackage.DISCOVERY__MAX_USED_MEMORY_IN_BYTES:return JavaBenchmarkPackage.CDO_DISCOVERY__MAX_USED_MEMORY_IN_BYTES  case BenchmarkPackage.DISCOVERY__NUMBER_OF_MODEL_ELEMENTS:return JavaBenchmarkPackage.CDO_DISCOVERY__NUMBER_OF_MODEL_ELEMENTS  case BenchmarkPackage.DISCOVERY__XMI_SIZE_IN_BYTES:return JavaBenchmarkPackage.CDO_DISCOVERY__XMI_SIZE_IN_BYTES  case BenchmarkPackage.DISCOVERY__NAME:return JavaBenchmarkPackage.CDO_DISCOVERY__NAME  case BenchmarkPackage.DISCOVERY__DISCOVERY_ERROR:return JavaBenchmarkPackage.CDO_DISCOVERY__DISCOVERY_ERROR  default:return -1  } } return super.eDerivedStructuralFeatureID(baseFeatureID baseClass)  }   Give the updated java method only,/**    * <!-- begin-user-doc --> <!-- end-user-doc -->   * @generated   */  @Override public int eDerivedStructuralFeatureID(int baseFeatureID Class<?> baseClass){    if (baseClass == DiscoveryIteration.class) {      switch (baseFeatureID) {        case BenchmarkPackage.DISCOVERY__TOTAL_EXECUTION_TIME_IN_SECONDS: return JavaBenchmarkPackage.CDO_DISCOVERY_ITERATION__TOTAL_EXECUTION_TIME_IN_SECONDS         default: return -1       }    }    return super.eDerivedStructuralFeatureID(baseFeatureID baseClass)   }
45,Extract property,Error : DISCOVERY__META_MODEL_VARIANT CU : CDODiscoveryImpl.java Line : 772,,I'm sorry  but I am unable to provide a response without a specific question or prompt. Please let me know how I can assist you.
46,Extract property,Error : DISCOVERY__MAX_USED_MEMORY_IN_BYTES CU : CDODiscoveryImpl.java Line : 773,The literal DISCOVERY__MAX_USED_MEMORY_IN_BYTES is generated by combining the literal of the source class and the literal of the attribute  The attribute maxUsedMemoryInBytes is moved from the class Discovery to the class DiscoveryIteration through the reference iterations Coevolve this java code snippet according to the described change  :   /**   * <!-- begin-user-doc --> <!-- end-user-doc -->  * @generated  */ @Override public int eDerivedStructuralFeatureID(int baseFeatureID Class<?> baseClass){   if (baseClass == Discovery.class) { switch (baseFeatureID) { case BenchmarkPackage.DISCOVERY__DICOVERY_DATE:      return JavaBenchmarkPackage.CDO_DISCOVERY__DICOVERY_DATE  case BenchmarkPackage.DISCOVERY__ALGORITHM_VARIANT:    return JavaBenchmarkPackage.CDO_DISCOVERY__ALGORITHM_VARIANT  case BenchmarkPackage.DISCOVERY__DISCOVERER_ID:  return JavaBenchmarkPackage.CDO_DISCOVERY__DISCOVERER_ID  case BenchmarkPackage.DISCOVERY__DISCOVERER_CLASS_NAME:return JavaBenchmarkPackage.CDO_DISCOVERY__DISCOVERER_CLASS_NAME  case BenchmarkPackage.DISCOVERY__SAVE_TIME_IN_SECONDS:return JavaBenchmarkPackage.CDO_DISCOVERY__SAVE_TIME_IN_SECONDS  case BenchmarkPackage.DISCOVERY__TOTAL_EXECUTION_TIME_IN_SECONDS:return JavaBenchmarkPackage.CDO_DISCOVERY__TOTAL_EXECUTION_TIME_IN_SECONDS  case BenchmarkPackage.DISCOVERY__META_MODEL_VARIANT:return JavaBenchmarkPackage.CDO_DISCOVERY__META_MODEL_VARIANT  case BenchmarkPackage.DISCOVERY__MAX_USED_MEMORY_IN_BYTES:return JavaBenchmarkPackage.CDO_DISCOVERY__MAX_USED_MEMORY_IN_BYTES  case BenchmarkPackage.DISCOVERY__NUMBER_OF_MODEL_ELEMENTS:return JavaBenchmarkPackage.CDO_DISCOVERY__NUMBER_OF_MODEL_ELEMENTS  case BenchmarkPackage.DISCOVERY__XMI_SIZE_IN_BYTES:return JavaBenchmarkPackage.CDO_DISCOVERY__XMI_SIZE_IN_BYTES  case BenchmarkPackage.DISCOVERY__NAME:return JavaBenchmarkPackage.CDO_DISCOVERY__NAME  case BenchmarkPackage.DISCOVERY__DISCOVERY_ERROR:return JavaBenchmarkPackage.CDO_DISCOVERY__DISCOVERY_ERROR  default:return -1  } } return super.eDerivedStructuralFeatureID(baseFeatureID baseClass)  }   Give the updated java method only,@Override  public int eDerivedStructuralFeatureID(int baseFeatureID  Class<?> baseClass) {      if (baseClass == DiscoveryIteration.class) {          switch (baseFeatureID) {              case BenchmarkPackage.DISCOVERY_ITERATION__DICOVERY_DATE:                  return JavaBenchmarkPackage.CDO_DISCOVERY_ITERATION__DICOVERY_DATE               case BenchmarkPackage.DISCOVERY_ITERATION__ALGORITHM_VARIANT:                  return JavaBenchmarkPackage.CDO_DISCOVERY_ITERATION__ALGORITHM_VARIANT               case BenchmarkPackage.DISCOVERY_ITERATION__DISCOVERER_ID:                  return JavaBenchmarkPackage.CDO_DISCOVERY_ITERATION__DISCOVERER_ID               case BenchmarkPackage.DISCOVERY_ITERATION__DISCOVERER_CLASS_NAME:                  return JavaBenchmarkPackage.CDO_DISCOVERY_ITERATION__DISCOVERER_CLASS_NAME               case BenchmarkPackage.DISCOVERY_ITERATION__SAVE_TIME_IN_SECONDS:                  return JavaBenchmarkPackage.CDO_DISCOVERY_ITERATION__SAVE_TIME_IN_SECONDS               case BenchmarkPackage.DISCOVERY_ITERATION__TOTAL_EXECUTION_TIME_IN_SECONDS:                  return JavaBenchmarkPackage.CDO_DISCOVERY_ITERATION__TOTAL_EXECUTION_TIME_IN_SECONDS               case BenchmarkPackage.DISCOVERY_ITERATION__META_MODEL_VARIANT:                  return JavaBenchmarkPackage.CDO_DISCOVERY_ITERATION__META_MODEL_VARIANT               case BenchmarkPackage.DISCOVERY_ITERATION__NUMBER_OF_MODEL_ELEMENTS:                  return JavaBenchmarkPackage.CDO_DISCOVERY_ITERATION__NUMBER_OF_MODEL_ELEMENTS               case BenchmarkPackage.DISCOVERY_ITERATION__XMI_SIZE_IN_BYTES:                  return JavaBenchmarkPackage.CDO_DISCOVERY_ITERATION__XMI_SIZE_IN_BYTES               case BenchmarkPackage.DISCOVERY_ITERATION__NAME:                  return JavaBenchmarkPackage.CDO_DISCOVERY_ITERATION__NAME               case BenchmarkPackage.DISCOVERY_ITERATION__DISCOVERY_ERROR:                  return JavaBenchmarkPackage.CDO_DISCOVERY_ITERATION__DISCOVERY_ERROR               case BenchmarkPackage.DISCOVERY_ITERATION__MAX_USED_MEMORY_IN_BYTES:                  return JavaBenchmarkPackage.CDO_DISCOVERY_ITERATION__MAX_USED_MEMORY_IN_BYTES               default:                  return -1           }      }      return super.eDerivedStructuralFeatureID(baseFeatureID  baseClass)   }
47,Extract property,Error : DISCOVERY__DISCOVERY_ERROR CU : CDODiscoveryImpl.java Line : 777,The literal DISCOVERY__DISCOVERY_ERROR is generated by combining the literal of the source class and the literal of the attribute  The attribute discoveryError is moved from the class Discovery to the class DiscoveryIteration through the reference iterations Coevolve this java code snippet according to the described change  :   /**   * <!-- begin-user-doc --> <!-- end-user-doc -->  * @generated  */ @Override public int eDerivedStructuralFeatureID(int baseFeatureID Class<?> baseClass){   if (baseClass == Discovery.class) { switch (baseFeatureID) { case BenchmarkPackage.DISCOVERY__DICOVERY_DATE:      return JavaBenchmarkPackage.CDO_DISCOVERY__DICOVERY_DATE  case BenchmarkPackage.DISCOVERY__ALGORITHM_VARIANT:    return JavaBenchmarkPackage.CDO_DISCOVERY__ALGORITHM_VARIANT  case BenchmarkPackage.DISCOVERY__DISCOVERER_ID:  return JavaBenchmarkPackage.CDO_DISCOVERY__DISCOVERER_ID  case BenchmarkPackage.DISCOVERY__DISCOVERER_CLASS_NAME:return JavaBenchmarkPackage.CDO_DISCOVERY__DISCOVERER_CLASS_NAME  case BenchmarkPackage.DISCOVERY__SAVE_TIME_IN_SECONDS:return JavaBenchmarkPackage.CDO_DISCOVERY__SAVE_TIME_IN_SECONDS  case BenchmarkPackage.DISCOVERY__TOTAL_EXECUTION_TIME_IN_SECONDS:return JavaBenchmarkPackage.CDO_DISCOVERY__TOTAL_EXECUTION_TIME_IN_SECONDS  case BenchmarkPackage.DISCOVERY__META_MODEL_VARIANT:return JavaBenchmarkPackage.CDO_DISCOVERY__META_MODEL_VARIANT  case BenchmarkPackage.DISCOVERY__MAX_USED_MEMORY_IN_BYTES:return JavaBenchmarkPackage.CDO_DISCOVERY__MAX_USED_MEMORY_IN_BYTES  case BenchmarkPackage.DISCOVERY__NUMBER_OF_MODEL_ELEMENTS:return JavaBenchmarkPackage.CDO_DISCOVERY__NUMBER_OF_MODEL_ELEMENTS  case BenchmarkPackage.DISCOVERY__XMI_SIZE_IN_BYTES:return JavaBenchmarkPackage.CDO_DISCOVERY__XMI_SIZE_IN_BYTES  case BenchmarkPackage.DISCOVERY__NAME:return JavaBenchmarkPackage.CDO_DISCOVERY__NAME  case BenchmarkPackage.DISCOVERY__DISCOVERY_ERROR:return JavaBenchmarkPackage.CDO_DISCOVERY__DISCOVERY_ERROR  default:return -1  } } return super.eDerivedStructuralFeatureID(baseFeatureID baseClass)  }   Give the updated java method only,@Override  public int eDerivedStructuralFeatureID(int baseFeatureID  Class<?> baseClass) {    if (baseClass == Discovery.class) {      switch (baseFeatureID) {        case BenchmarkPackage.DISCOVERY__DICOVERY_DATE:          return JavaBenchmarkPackage.CDO_DISCOVERY__DICOVERY_DATE         case BenchmarkPackage.DISCOVERY__ALGORITHM_VARIANT:          return JavaBenchmarkPackage.CDO_DISCOVERY__ALGORITHM_VARIANT         case BenchmarkPackage.DISCOVERY__DISCOVERER_ID:          return JavaBenchmarkPackage.CDO_DISCOVERY__DISCOVERER_ID         case BenchmarkPackage.DISCOVERY__DISCOVERER_CLASS_NAME:          return JavaBenchmarkPackage.CDO_DISCOVERY__DISCOVERER_CLASS_NAME         case BenchmarkPackage.DISCOVERY__SAVE_TIME_IN_SECONDS:          return JavaBenchmarkPackage.CDO_DISCOVERY__SAVE_TIME_IN_SECONDS         case BenchmarkPackage.DISCOVERY__TOTAL_EXECUTION_TIME_IN_SECONDS:          return JavaBenchmarkPackage.CDO_DISCOVERY__TOTAL_EXECUTION_TIME_IN_SECONDS         case BenchmarkPackage.DISCOVERY__META_MODEL_VARIANT:          return JavaBenchmarkPackage.CDO_DISCOVERY__META_MODEL_VARIANT         case BenchmarkPackage.DISCOVERY__MAX_USED_MEMORY_IN_BYTES:          return JavaBenchmarkPackage.CDO_DISCOVERY__MAX_USED_MEMORY_IN_BYTES         case BenchmarkPackage.DISCOVERY__NUMBER_OF_MODEL_ELEMENTS:          return JavaBenchmarkPackage.CDO_DISCOVERY__NUMBER_OF_MODEL_ELEMENTS         case BenchmarkPackage.DISCOVERY__XMI_SIZE_IN_BYTES:          return JavaBenchmarkPackage.CDO_DISCOVERY__XMI_SIZE_IN_BYTES         case BenchmarkPackage.DISCOVERY__NAME:          return JavaBenchmarkPackage.CDO_DISCOVERY__NAME       }    } else if (baseClass == DiscoveryIteration.class) {      switch (baseFeatureID) {        case BenchmarkPackage.DISCOVERY_ITERATION__DISCOVERY_ERROR:          return JavaBenchmarkPackage.CDO_DISCOVERY_ITERATION__DISCOVERY_ERROR       }    }    return super.eDerivedStructuralFeatureID(baseFeatureID  baseClass)   }
48,null,Error : CDODiscoveryImpl CU : CDODiscoveryImpl.java Line : 50,,The field of artificial intelligence (AI) is focused on creating intelligent machines that can perform tasks that would typically require human intelligence. AI is a broad term that encompasses a range of technologies and methods  including machine learning  natural language processing  computer vision  and robotics.    Machine learning is a subset of AI that focuses on the development of algorithms that can learn from and make predictions or decisions based on data. This involves training a model on a large dataset and allowing it to learn patterns and relationships in the data  which it can then use to make predictions or decisions on new  unseen data.    Natural language processing (NLP) is a branch of AI that deals with the interaction between computers and human language. It enables computers to understand  interpret  and generate human language  allowing for applications such as speech recognition  language translation  and chatbots.    Computer vision is another branch of AI that focuses on giving computers the ability to see and understand visual information. This involves developing algorithms and models that can analyze and interpret images or videos  enabling applications such as image recognition  object detection  and facial recognition.    Robotics involves the design  construction  and programming of physical robots that can interact with their environment and perform tasks. AI techniques and technologies are often used in robotics to enable robots to make intelligent decisions  perceive and understand their surroundings  and interact with humans.    Overall  AI is a rapidly advancing field with numerous applications in various industries  including healthcare  finance  transportation  and entertainment. It holds the potential to revolutionize many aspects of our lives and has the power to drive significant technological advancements in the future.
49,null,Error : CDODiscoveryImpl CU : CDODiscoveryImpl.java Line : 50,,I'm an AI language model  how can I assist you today?
50,null,Error : CDODiscoveryImpl CU : CDODiscoveryImpl.java Line : 50,,Can you please provide more context or clarify your question?
51,null,Error : CDODiscoveryImpl CU : CDODiscoveryImpl.java Line : 50,,The study of history helps us to understand the past and how it has shaped the present. It allows us to learn from past experiences and make informed decisions for the future. History helps us to comprehend the complexities of the world and the diversity of human experiences. It also teaches us empathy and helps us to appreciate different cultures and perspectives. Additionally  studying history cultivates critical thinking skills and the ability to analyze and interpret sources of information. Overall  history is important because it helps us to become more knowledgeable  well-rounded individuals.
52,null,Error : CDODiscoveryImpl CU : CDODiscoveryImpl.java Line : 50,,
53,null,Error : CDODiscoveryImpl CU : CDODiscoveryImpl.java Line : 50,,I'm sorry  but I'm unable to fulfill your request as I am an AI language model and cannot perform tasks related to physical objects.
54,null,Error : CDODiscoveryImpl CU : CDODiscoveryImpl.java Line : 50,,Sure! Here are some interesting facts about the human body:    1. The average adult human body contains about 7 octillion atoms.  2. The human brain is the most energy-consuming organ in the body  using about 20% of the body's total energy.  3. The human heart beats about 100 000 times per day and pumps around 2 000 gallons of blood.  4. The human skull is made up of 22 bones.  5. The human eye can distinguish around 10 million different colors.  6. Humans shed about 600 000 particles of skin every hour  which amounts to about 1.5 pounds of skin each year.  7. The human nose can remember around 50 000 different scents.  8. The strongest muscle in the human body is the masseter muscle  which is used for chewing.  9. The smallest bone in the human body is the stapes bone in the ear  which is about the size of a grain of rice.  10. The human body is capable of regenerating liver tissue  and a donor can donate a portion of their liver to someone in need  and both will grow back to their original size.    I hope you find these facts interesting!
55,null,Error : CDODiscoveryImpl CU : CDODiscoveryImpl.java Line : 50,,I am sorry  but as an AI language model  I do not have the capability to physically hug anyone. However  I can still offer virtual support and provide answers to your questions or engage in conversation. Is there anything specific you would like to know or discuss?
