NB,Change, Marker, Request, Result 
1,null,,,I'm an AI language model  so I don't have personal experiences or emotions. However  I can try to help you with any questions or concerns you have. Just let me know how I can assist you!
2,null,,,There are several reasons why someone might use a computer mouse. Here are a few:    1. Navigation: The mouse allows users to navigate through the graphical user interface (GUI) of a computer system  making it easy to click on icons  buttons  menus  and links.    2. Pointing and selecting: The primary function of a mouse is to move a cursor on the screen  allowing users to point and select objects or text by clicking on them.    3. Drag and drop: With a mouse  users can click and hold on an object  drag it across the screen  and then release the click to drop the object in a new location.    4. Scroll: Many mice have a scroll wheel that allows users to scroll through documents  web pages  and other content vertically or horizontally.    5. Gaming: Mice are commonly used in computer gaming to control character movement  aim weapons  and interact with the game environment.    6. Graphic design: Professionals in graphic design and digital art often use a mouse to precisely control their cursor movement  making it easier to create detailed and intricate designs.    7. Accessibility: For individuals with limited dexterity or mobility  a mouse can provide an easier and more comfortable way to interact with a computer compared to other input devices like keyboards or touchpads.    Overall  the computer mouse is a versatile tool that allows users to interact with their computers in a precise and intuitive manner.
3,null,,,Time management is the process of planning  organizing  and prioritizing tasks and activities to make the most efficient use of time. It involves setting goals  creating schedules  and using tools and techniques to effectively manage time and avoid procrastination. Time management skills are essential for individuals to be productive  meet deadlines  and achieve their personal and professional goals. Effective time management can help reduce stress  improve focus and concentration  and enhance overall productivity.
4,null,,,As an AI language model  I do not have personal experiences or emotions. However  I can provide information and answer any questions you may have about my capabilities or any topic you're interested in. How can I assist you today?
5,null,,,I'm sorry  but I cannot generate that story for you.
6,Delete Class ,Error : MultiProjectBenchmark CU : AbstractRunBenchmark.java Line : 86,Considering a metaclass called MultiProjectBenchmark The class MultiProjectBenchmark is generated from this metaclass. Here is a change: the metaclass MultiProjectBenchmark is removed with all the generated classes and properties are removed.  Coevolve this java code snippet according to the described change  :   public MultiProjectBenchmark createReport(final Object source) throws CoreException  IOException {   initStatProject((IJavaProject)source)    serverAndDisco(source DerbyCDOServerNoAudits.class BenchmarkJavaDiscovererCDO.class)    serverAndDisco(source DerbyCDOServerNoAudits.class JavaDiscovererCDONoUsages.class)    serverAndDisco(source DerbyCDOServer.class BenchmarkJavaDiscovererCDO.class)    disco(source JavaDiscovererIncrementalEMF.class)    disco(source JavaDiscovererEMFNoUsages.class)    disco(source JavaDiscovererEMFMinimalEObject.class)    disco(source JavaDiscovererClassicalEMF.class)    Statistics.copyLog(this.statProject.getLocation().toFile())    Report aReport=new Report(this.statProject)    MultiProjectBenchmark benchmarkModel=aReport.generate()    return benchmarkModel  }   Give the updated java method only,public Report createReport(final Object source) throws CoreException  IOException {    initStatProject((IJavaProject)source)     serverAndDisco(source DerbyCDOServerNoAudits.class BenchmarkJavaDiscovererCDO.class)     serverAndDisco(source DerbyCDOServerNoAudits.class JavaDiscovererCDONoUsages.class)     serverAndDisco(source DerbyCDOServer.class BenchmarkJavaDiscovererCDO.class)     disco(source JavaDiscovererIncrementalEMF.class)     disco(source JavaDiscovererEMFNoUsages.class)     disco(source JavaDiscovererEMFMinimalEObject.class)     disco(source JavaDiscovererClassicalEMF.class)     Statistics.copyLog(this.statProject.getLocation().toFile())     return new Report(this.statProject)   }
7,null,Error : generate CU : AbstractRunBenchmark.java Line : 86,,Yes  I can help you with writing a research proposal. Could you please provide me with more details about the topic and any specific requirements or guidelines?
8,null,Error : createReport CU : AbstractRunBenchmark.java Line : 171,,I am an AI language model created by OpenAI. I am designed to assist users in generating human-like text based on the prompts provided to me. How can I help you today?
9,Delete Class ,Error : MultiProjectBenchmark CU : AbstractRunBenchmark.java Line : 50,The metaclass MultiProjectBenchmark is removed and the class MultiProjectBenchmark is removed also  Coevolve this java code snippet according to the described change  :   import org.eclipse.jdt.core.IJavaProject  import org.eclipse.modisco.infra.discovery.benchmark.MultiProjectBenchmark  import com.ibm.icu.text.SimpleDateFormat    Give the updated java method only If there is any instruction to remove  please comment it,import org.eclipse.jdt.core.IJavaProject   import com.ibm.icu.text.SimpleDateFormat     //import org.eclipse.modisco.infra.discovery.benchmark.MultiProjectBenchmark     public class Coevolve {      public void methodName() {          //Updated code snippet          IJavaProject javaProject = null           //Add your logic here...                    SimpleDateFormat dateFormat = new SimpleDateFormat("yyyy-MM-dd")           //Add your logic here...      }  }
10,Delete Class ,Error : MultiProjectBenchmark CU : AbstractRunBenchmark.java Line : 64,Considering a metaclass called MultiProjectBenchmark The class MultiProjectBenchmark is generated from this metaclass. Here is a change: the metaclass MultiProjectBenchmark is removed with all the generated classes and properties are removed.  Coevolve this java code snippet according to the described change  :   public MultiProjectBenchmark createReport(final Object source) throws CoreException  IOException {   initStatProject((IJavaProject)source)    serverAndDisco(source DerbyCDOServerNoAudits.class BenchmarkJavaDiscovererCDO.class)    serverAndDisco(source DerbyCDOServerNoAudits.class JavaDiscovererCDONoUsages.class)    serverAndDisco(source DerbyCDOServer.class BenchmarkJavaDiscovererCDO.class)    disco(source JavaDiscovererIncrementalEMF.class)    disco(source JavaDiscovererEMFNoUsages.class)    disco(source JavaDiscovererEMFMinimalEObject.class)    disco(source JavaDiscovererClassicalEMF.class)    Statistics.copyLog(this.statProject.getLocation().toFile())    Report aReport=new Report(this.statProject)    MultiProjectBenchmark benchmarkModel=aReport.generate()    return benchmarkModel  }   Give the updated java method only,public MultiProjectBenchmark createReport(final Object source) throws CoreException  IOException {    initStatProject((IJavaProject)source)     serverAndDisco(source DerbyCDOServerNoAudits.class BenchmarkJavaDiscovererCDO.class)     serverAndDisco(source DerbyCDOServerNoAudits.class JavaDiscovererCDONoUsages.class)     serverAndDisco(source DerbyCDOServer.class BenchmarkJavaDiscovererCDO.class)     disco(source JavaDiscovererIncrementalEMF.class)     disco(source JavaDiscovererEMFNoUsages.class)     disco(source JavaDiscovererEMFMinimalEObject.class)     disco(source JavaDiscovererClassicalEMF.class)     Statistics.copyLog(this.statProject.getLocation().toFile())     Report aReport=new Report(this.statProject)     return aReport.generate()   }
11,Delete Class ,Error : DiscoveredProject CU : Report.java Line : 74,The metaclass DiscoveredProject is removed and the class DiscoveredProject is removed also  Coevolve this java code snippet according to the described change  :   import org.eclipse.modisco.infra.discovery.benchmark.BenchmarkFactory  import org.eclipse.modisco.infra.discovery.benchmark.DiscoveredProject  import org.eclipse.modisco.infra.discovery.benchmark.Discovery    Give the updated java method only If there is any instruction to remove  please comment it,import org.eclipse.modisco.infra.discovery.benchmark.BenchmarkFactory   import org.eclipse.modisco.infra.discovery.benchmark.Discovery     public class UpdatedJavaCodeSnippet {        public void updatedMethod() {          // Remove the metaclass DiscoveredProject                    Discovery discovery = BenchmarkFactory.eINSTANCE.createDiscovery()                     // Remove the class DiscoveredProject                    // Rest of the code...      }  }
12,Delete Class ,Error : MultiProjectBenchmark CU : Report.java Line : 76,The metaclass MultiProjectBenchmark is removed and the class MultiProjectBenchmark is removed also  Coevolve this java code snippet according to the described change  :   import org.eclipse.modisco.infra.discovery.benchmark.Discovery  import org.eclipse.modisco.infra.discovery.benchmark.MultiProjectBenchmark  import org.eclipse.modisco.java.discoverer.benchmark.javaBenchmark.CDODiscovery    Give the updated java method only If there is any instruction to remove  please comment it,import org.eclipse.modisco.infra.discovery.benchmark.Discovery   import org.eclipse.modisco.java.discoverer.benchmark.javaBenchmark.CDODiscovery     // Remove the import statement for MultiProjectBenchmark  // import org.eclipse.modisco.infra.discovery.benchmark.MultiProjectBenchmark     public class UpdatedClass {     public void updatedMethod() {        // Existing code logic                // Remove the usage of MultiProjectBenchmark        // MultiProjectBenchmark benchmark = new MultiProjectBenchmark()                 // Updated code logic        Discovery discovery = new CDODiscovery()                 // Rest of the code logic     }  }
13,Delete Class ,Error : MultiProjectBenchmark CU : Report.java Line : 98,Considering a metaclass called MultiProjectBenchmark The class MultiProjectBenchmark is generated from this metaclass. Here is a change: the metaclass MultiProjectBenchmark is removed with all the generated classes and properties are removed.  Coevolve this java code snippet according to the described change  :   public MultiProjectBenchmark generate() throws CoreException  IOException {   MultiProjectBenchmark benchmark=buildReportModelAndDiagrams()    generateHTML(benchmark this.statProject.getLocation().toFile())    return benchmark  }   Give the updated java method only,public void generate() throws CoreException  IOException {    MultiProjectBenchmark benchmark = buildReportModelAndDiagrams()     generateHTML(benchmark  this.statProject.getLocation().toFile())   }
14,Delete Class ,Error : MultiProjectBenchmark CU : Report.java Line : 99,Considering a metaclass called MultiProjectBenchmark The class MultiProjectBenchmark is generated from this metaclass. Here is a change: the metaclass MultiProjectBenchmark is removed with all the generated classes and properties are removed.  Coevolve this java code snippet according to the described change  :   public MultiProjectBenchmark generate() throws CoreException  IOException {   MultiProjectBenchmark benchmark=buildReportModelAndDiagrams()    generateHTML(benchmark this.statProject.getLocation().toFile())    return benchmark  }   Give the updated java method only,public void generate() throws CoreException  IOException {    MultiProjectBenchmark benchmark = buildReportModelAndDiagrams()     generateHTML(benchmark  this.statProject.getLocation().toFile())   }
15,null,Error : buildReportModelAndDiagrams CU : Report.java Line : 99,,I'm sorry  but I'm not able to generate a story without any specific details or prompts. Can you please provide more information or a specific topic for the story?
16,Delete Class ,Error : MultiProjectBenchmark CU : Report.java Line : 104,Considering a metaclass called MultiProjectBenchmark The class MultiProjectBenchmark is generated from this metaclass. Here is a change: the metaclass MultiProjectBenchmark is removed with all the generated classes and properties are removed.  Coevolve this java code snippet according to the described change  :   private MultiProjectBenchmark buildReportModelAndDiagrams() throws CoreException  IOException {   ResourceSet resourceSet=new ResourceSetImpl()    URI uri=URI.createURI("platform:/resource/" + this.statProject.getName() + "/report.xmi")    Resource modelResource=resourceSet.createResource(uri)    MultiProjectBenchmark benchmark=BenchmarkFactory.eINSTANCE.createMultiProjectBenchmark()    modelResource.getContents().add(benchmark)    List<IStatus> errors=new ArrayList<IStatus>()    this.statProject.refreshLocal(IResource.DEPTH_INFINITE new NullProgressMonitor())    for (  IResource resource : this.statProject.members()) {     try {       if (resource instanceof IFile) {         IFile file=(IFile)resource          if (file.getLocation().getFileExtension().equals(Statistics.TSV_FILE_EXT)) {           String lastLine1=""            String lastLine2=""            BufferedReader bufferReader=new BufferedReader(new FileReader(file.getLocation().toFile()))            String line=bufferReader.readLine()            titleLine(line)            line=bufferReader.readLine()            int maxUsedMemory=0            while (line != null) {             addToSeries(line)              lastLine2=lastLine1              lastLine1=line              int usedMemory=new Integer(getValue(line Statistics.USED_MEMORY))              maxUsedMemory=Math.max(maxUsedMemory usedMemory)              line=bufferReader.readLine()            }           IResource txtResource=resource.getParent().findMember(resource.getName().replaceAll("(.*)" + Statistics.TSV_FILE_EXT "$1" + Statistics.PROPERTIES_FILE_EXT))            Properties properties=new Properties()            properties.load(txtResource.getLocationURI().toURL().openStream())            Discovery discovery            DiscoveredProject benchmarkedProject            String storageKind=properties.getProperty(DiscoverJavaModelFromJavaProjectEMFStat.STORAGE_KIND)            if (storageKind != null && storageKind.equals("CDO")) {             CDODiscovery cdoDiscovery=JavaBenchmarkFactory.eINSTANCE.createCDODiscovery()              discovery=cdoDiscovery              cdoDiscovery.setVersion(properties.getProperty(JavaDiscovererCDO.CDO_VERSION))              cdoDiscovery.setServerDescription(properties.getProperty(JavaDiscovererCDO.CDO_SERVER_DESCRIPTION))              cdoDiscovery.setRevisedLruCapacity(new Integer(properties.getProperty(JavaDiscovererCDO.REVISED_LRU_CAPACITY)))              cdoDiscovery.setCacheType(properties.getProperty(JavaDiscovererCDO.CDO_CACHE_TYPE))              cdoDiscovery.setCurrentLruCapacity(new Integer(properties.getProperty(JavaDiscovererCDO.CURRENT_LRU_CAPACITY)))              benchmarkedProject=JavaBenchmarkFactory.eINSTANCE.createJavaDiscoveredProject()              try {               cdoDiscovery.setInitTimeInSeconds(new Double(properties.getProperty(Statistics.INIT_TIME)) / Report.MINUTE_MS_RANGE)              }  catch (            Exception e) {               MoDiscoLogger.logError(e Activator.getDefault())                IStatus status=new Status(IStatus.ERROR Activator.PLUGIN_ID e.getMessage() e)                errors.add(status)              }           }  else {             discovery=BenchmarkFactory.eINSTANCE.createDiscovery()              benchmarkedProject=BenchmarkFactory.eINSTANCE.createDiscoveredProject()            }           benchmark.getProjects().add(benchmarkedProject)            benchmarkedProject.getDiscoveries().add(discovery)            benchmarkedProject.setName(properties.getProperty(DiscoverJavaModelFromJavaProjectEMFStat.JAVA_PROJECT_NAME))            discovery.setName(resource.getName().replaceAll("(.*)\\." + Statistics.TSV_FILE_EXT "$1"))            discovery.setMaxUsedMemoryInBytes(maxUsedMemory)            discovery.setMetaModelVariant(properties.getProperty(DiscoverJavaModelFromJavaProjectEMFStat.MM_VARIANT))            discovery.setAlgorithmVariant(properties.getProperty(DiscoverJavaModelFromJavaProjectEMFStat.ALGO_VARIANT))            discovery.setSaveTimeInSeconds(new Double(getValue(lastLine2 Statistics.SAVE)) / Report.MINUTE_MS_RANGE)            discovery.setTotalExecutionTimeInSeconds(new Double(getValue(lastLine2 Statistics.SINCEBEGIN)) / Report.MINUTE_MS_RANGE)            discovery.setDiscovererClassName(properties.getProperty(DiscoverJavaModelFromJavaProjectEMFStat.DISCOVERER_CLASS_NAME))            benchmark.setJvmMaxHeapInMiB(new Integer(properties.getProperty(DiscoverJavaModelFromJavaProjectEMFStat.XMX).replaceAll("^([0-9]+).*" "$1")))            rescaleDebugCode(benchmark.getJvmMaxHeapInMiB())            birt(file benchmark discovery)          }       }       this.statProject.refreshLocal(IResource.DEPTH_INFINITE new NullProgressMonitor())      }  catch (    Exception e) {       MoDiscoLogger.logError(e Activator.getDefault())        IStatus status=new Status(IStatus.ERROR Activator.PLUGIN_ID e.getMessage() e)        errors.add(status)      }   }   modelResource.save(Collections.EMPTY_MAP)    if (errors.size() > 0) {     CoreException e=new CoreException(new MultiStatus(Activator.PLUGIN_ID IStatus.ERROR errors.toArray(new IStatus[]{}) "" new Exception()))      MoDiscoLogger.logError(e Activator.getDefault())    }   return benchmark  }   Give the updated java method only,private void buildReportModelAndDiagrams() throws CoreException  IOException {    ResourceSet resourceSet = new ResourceSetImpl()     URI uri = URI.createURI("platform:/resource/" + this.statProject.getName() + "/report.xmi")     Resource modelResource = resourceSet.createResource(uri)       List<IStatus> errors = new ArrayList<IStatus>()     this.statProject.refreshLocal(IResource.DEPTH_INFINITE  new NullProgressMonitor())     for (IResource resource : this.statProject.members()) {      try {        if (resource instanceof IFile) {          IFile file = (IFile) resource           if (file.getLocation().getFileExtension().equals(Statistics.TSV_FILE_EXT)) {            String lastLine1 = ""             String lastLine2 = ""             BufferedReader bufferReader = new BufferedReader(new FileReader(file.getLocation().toFile()))             String line = bufferReader.readLine()             titleLine(line)             line = bufferReader.readLine()             int maxUsedMemory = 0             while (line != null) {              addToSeries(line)               lastLine2 = lastLine1               lastLine1 = line               int usedMemory = new Integer(getValue(line  Statistics.USED_MEMORY))               maxUsedMemory = Math.max(maxUsedMemory  usedMemory)               line = bufferReader.readLine()             }            IResource txtResource = resource.getParent().findMember(resource.getName().replaceAll("(.*)" + Statistics.TSV_FILE_EXT  "$1" + Statistics.PROPERTIES_FILE_EXT))             Properties properties = new Properties()             properties.load(txtResource.getLocationURI().toURL().openStream())             String storageKind = properties.getProperty(DiscoverJavaModelFromJavaProjectEMFStat.STORAGE_KIND)             if (storageKind != null && storageKind.equals("CDO")) {              CDODiscovery cdoDiscovery = JavaBenchmarkFactory.eINSTANCE.createCDODiscovery()               try {                cdoDiscovery.setInitTimeInSeconds(new Double(properties.getProperty(Statistics.INIT_TIME)) / Report.MINUTE_MS_RANGE)               } catch (Exception e) {                MoDiscoLogger.logError(e  Activator.getDefault())                 IStatus status = new Status(IStatus.ERROR  Activator.PLUGIN_ID  e.getMessage()  e)                 errors.add(status)               }            }            benchmark.getProjects().add(benchmarkedProject)             benchmarkedProject.getDiscoveries().add(discovery)             benchmarkedProject.setName(properties.getProperty(DiscoverJavaModelFromJavaProjectEMFStat.JAVA_PROJECT_NAME))             discovery.setName(resource.getName().replaceAll("(.*)\\." + Statistics.TSV_FILE_EXT  "$1"))             discovery.setMaxUsedMemoryInBytes(maxUsedMemory)             discovery.setMetaModelVariant(properties.getProperty(DiscoverJavaModelFromJavaProjectEMFStat.MM_VARIANT))             discovery.setAlgorithmVariant(properties.getProperty(DiscoverJavaModelFromJavaProjectEMFStat.ALGO_VARIANT))             discovery.setSaveTimeInSeconds(new Double(getValue(lastLine2  Statistics.SAVE)) / Report.MINUTE_MS_RANGE)             discovery.setTotalExecutionTimeInSeconds(new Double(getValue(lastLine2  Statistics.SINCEBEGIN)) / Report.MINUTE_MS_RANGE)             discovery.setDiscovererClassName(properties.getProperty(DiscoverJavaModelFromJavaProjectEMFStat.DISCOVERER_CLASS_NAME))             benchmark.setJvmMaxHeapInMiB(new Integer(properties.getProperty(DiscoverJavaModelFromJavaProjectEMFStat.XMX).replaceAll("^([0-9]+).*"  "$1")))             rescaleDebugCode(benchmark.getJvmMaxHeapInMiB())             birt(file  benchmark  discovery)           }        }        this.statProject.refreshLocal(IResource.DEPTH_INFINITE  new NullProgressMonitor())       } catch (Exception e) {        MoDiscoLogger.logError(e  Activator.getDefault())         IStatus status = new Status(IStatus.ERROR  Activator.PLUGIN_ID  e.getMessage()  e)         errors.add(status)       }    }    modelResource.save(Collections.EMPTY_MAP)     if (errors.size() > 0) {      CoreException e = new CoreException(new MultiStatus(Activator.PLUGIN_ID  IStatus.ERROR  errors.toArray(new IStatus[]{})  ""  new Exception()))       MoDiscoLogger.logError(e  Activator.getDefault())     }  }
