24,Extract property,Error : DISCOVERY__SAVE_TIME_IN_SECONDS CU : CDOProjectDiscoveryImpl.java Line : 832,The literal DISCOVERY__SAVE_TIME_IN_SECONDS is generated by combining the literal of the source class and the literal of the attribute  The attribute saveTimeInSeconds is moved from the class Discovery to the class DiscoveryIteration through the reference iterations Coevolve this java code snippet according to the described change  :   /**   * <!-- begin-user-doc --> <!-- end-user-doc -->  * @generated  */ @Override public int eDerivedStructuralFeatureID(int baseFeatureID Class<?> baseClass){   if (baseClass == Discovery.class) { switch (baseFeatureID) { case BenchmarkPackage.DISCOVERY__DICOVERY_DATE:      return JavaBenchmarkPackage.CDO_PROJECT_DISCOVERY__DICOVERY_DATE  case BenchmarkPackage.DISCOVERY__ALGORITHM_VARIANT:    return JavaBenchmarkPackage.CDO_PROJECT_DISCOVERY__ALGORITHM_VARIANT  case BenchmarkPackage.DISCOVERY__DISCOVERER_ID:  return JavaBenchmarkPackage.CDO_PROJECT_DISCOVERY__DISCOVERER_ID  case BenchmarkPackage.DISCOVERY__DISCOVERER_CLASS_NAME:return JavaBenchmarkPackage.CDO_PROJECT_DISCOVERY__DISCOVERER_CLASS_NAME  case BenchmarkPackage.DISCOVERY__SAVE_TIME_IN_SECONDS:return JavaBenchmarkPackage.CDO_PROJECT_DISCOVERY__SAVE_TIME_IN_SECONDS  case BenchmarkPackage.DISCOVERY__TOTAL_EXECUTION_TIME_IN_SECONDS:return JavaBenchmarkPackage.CDO_PROJECT_DISCOVERY__TOTAL_EXECUTION_TIME_IN_SECONDS  case BenchmarkPackage.DISCOVERY__META_MODEL_VARIANT:return JavaBenchmarkPackage.CDO_PROJECT_DISCOVERY__META_MODEL_VARIANT  case BenchmarkPackage.DISCOVERY__MAX_USED_MEMORY_IN_BYTES:return JavaBenchmarkPackage.CDO_PROJECT_DISCOVERY__MAX_USED_MEMORY_IN_BYTES  case BenchmarkPackage.DISCOVERY__NUMBER_OF_MODEL_ELEMENTS:return JavaBenchmarkPackage.CDO_PROJECT_DISCOVERY__NUMBER_OF_MODEL_ELEMENTS  case BenchmarkPackage.DISCOVERY__XMI_SIZE_IN_BYTES:return JavaBenchmarkPackage.CDO_PROJECT_DISCOVERY__XMI_SIZE_IN_BYTES  case BenchmarkPackage.DISCOVERY__NAME:return JavaBenchmarkPackage.CDO_PROJECT_DISCOVERY__NAME  case BenchmarkPackage.DISCOVERY__DISCOVERY_ERROR:return JavaBenchmarkPackage.CDO_PROJECT_DISCOVERY__DISCOVERY_ERROR  default:return -1  } } if (baseClass == ProjectDiscovery.class) { switch (baseFeatureID) { case BenchmarkPackage.PROJECT_DISCOVERY__PROJECTS:return JavaBenchmarkPackage.CDO_PROJECT_DISCOVERY__PROJECTS  default:return -1  } } return super.eDerivedStructuralFeatureID(baseFeatureID baseClass)  }   Give the updated java method only,/**    * <!-- begin-user-doc --> <!-- end-user-doc -->   * @generated   */  @Override   public int eDerivedStructuralFeatureID(int baseFeatureID  Class<?> baseClass) {    if (baseClass == DiscoveryIteration.class) {      switch (baseFeatureID) {        case BenchmarkPackage.DISCOVERY_ITERATION__DICOVERY_DATE:      return JavaBenchmarkPackage.CDO_PROJECT_DISCOVERY_ITERATION__DICOVERY_DATE         case BenchmarkPackage.DISCOVERY_ITERATION__ALGORITHM_VARIANT:    return JavaBenchmarkPackage.CDO_PROJECT_DISCOVERY_ITERATION__ALGORITHM_VARIANT         case BenchmarkPackage.DISCOVERY_ITERATION__DISCOVERER_ID:  return JavaBenchmarkPackage.CDO_PROJECT_DISCOVERY_ITERATION__DISCOVERER_ID         case BenchmarkPackage.DISCOVERY_ITERATION__DISCOVERER_CLASS_NAME:return JavaBenchmarkPackage.CDO_PROJECT_DISCOVERY_ITERATION__DISCOVERER_CLASS_NAME         case BenchmarkPackage.DISCOVERY_ITERATION__SAVE_TIME_IN_SECONDS:return JavaBenchmarkPackage.CDO_PROJECT_DISCOVERY_ITERATION__SAVE_TIME_IN_SECONDS         case BenchmarkPackage.DISCOVERY_ITERATION__TOTAL_EXECUTION_TIME_IN_SECONDS:return JavaBenchmarkPackage.CDO_PROJECT_DISCOVERY_ITERATION__TOTAL_EXECUTION_TIME_IN_SECONDS         case BenchmarkPackage.DISCOVERY_ITERATION__META_MODEL_VARIANT:return JavaBenchmarkPackage.CDO_PROJECT_DISCOVERY_ITERATION__META_MODEL_VARIANT         case BenchmarkPackage.DISCOVERY_ITERATION__MAX_USED_MEMORY_IN_BYTES:return JavaBenchmarkPackage.CDO_PROJECT_DISCOVERY_ITERATION__MAX_USED_MEMORY_IN_BYTES         case BenchmarkPackage.DISCOVERY_ITERATION__NUMBER_OF_MODEL_ELEMENTS:return JavaBenchmarkPackage.CDO_PROJECT_DISCOVERY_ITERATION__NUMBER_OF_MODEL_ELEMENTS         case BenchmarkPackage.DISCOVERY_ITERATION__XMI_SIZE_IN_BYTES:return JavaBenchmarkPackage.CDO_PROJECT_DISCOVERY_ITERATION__XMI_SIZE_IN_BYTES         case BenchmarkPackage.DISCOVERY_ITERATION__NAME:return JavaBenchmarkPackage.CDO_PROJECT_DISCOVERY_ITERATION__NAME         case BenchmarkPackage.DISCOVERY_ITERATION__DISCOVERY_ERROR:return JavaBenchmarkPackage.CDO_PROJECT_DISCOVERY_ITERATION__DISCOVERY_ERROR         default:return -1       }    }    if (baseClass == ProjectDiscovery.class) {      switch (baseFeatureID) {        case BenchmarkPackage.PROJECT_DISCOVERY__PROJECTS:return JavaBenchmarkPackage.CDO_PROJECT_DISCOVERY__PROJECTS         default:return -1       }    }    return super.eDerivedStructuralFeatureID(baseFeatureID  baseClass)   }
25,Extract property,Error : DISCOVERY__TOTAL_EXECUTION_TIME_IN_SECONDS CU : CDOProjectDiscoveryImpl.java Line : 833,The literal DISCOVERY__TOTAL_EXECUTION_TIME_IN_SECONDS is generated by combining the literal of the source class and the literal of the attribute  The attribute totalExecutionTimeInSeconds is moved from the class Discovery to the class DiscoveryIteration through the reference iterations Coevolve this java code snippet according to the described change  :   /**   * <!-- begin-user-doc --> <!-- end-user-doc -->  * @generated  */ @Override public int eDerivedStructuralFeatureID(int baseFeatureID Class<?> baseClass){   if (baseClass == Discovery.class) { switch (baseFeatureID) { case BenchmarkPackage.DISCOVERY__DICOVERY_DATE:      return JavaBenchmarkPackage.CDO_PROJECT_DISCOVERY__DICOVERY_DATE  case BenchmarkPackage.DISCOVERY__ALGORITHM_VARIANT:    return JavaBenchmarkPackage.CDO_PROJECT_DISCOVERY__ALGORITHM_VARIANT  case BenchmarkPackage.DISCOVERY__DISCOVERER_ID:  return JavaBenchmarkPackage.CDO_PROJECT_DISCOVERY__DISCOVERER_ID  case BenchmarkPackage.DISCOVERY__DISCOVERER_CLASS_NAME:return JavaBenchmarkPackage.CDO_PROJECT_DISCOVERY__DISCOVERER_CLASS_NAME  case BenchmarkPackage.DISCOVERY__SAVE_TIME_IN_SECONDS:return JavaBenchmarkPackage.CDO_PROJECT_DISCOVERY__SAVE_TIME_IN_SECONDS  case BenchmarkPackage.DISCOVERY__TOTAL_EXECUTION_TIME_IN_SECONDS:return JavaBenchmarkPackage.CDO_PROJECT_DISCOVERY__TOTAL_EXECUTION_TIME_IN_SECONDS  case BenchmarkPackage.DISCOVERY__META_MODEL_VARIANT:return JavaBenchmarkPackage.CDO_PROJECT_DISCOVERY__META_MODEL_VARIANT  case BenchmarkPackage.DISCOVERY__MAX_USED_MEMORY_IN_BYTES:return JavaBenchmarkPackage.CDO_PROJECT_DISCOVERY__MAX_USED_MEMORY_IN_BYTES  case BenchmarkPackage.DISCOVERY__NUMBER_OF_MODEL_ELEMENTS:return JavaBenchmarkPackage.CDO_PROJECT_DISCOVERY__NUMBER_OF_MODEL_ELEMENTS  case BenchmarkPackage.DISCOVERY__XMI_SIZE_IN_BYTES:return JavaBenchmarkPackage.CDO_PROJECT_DISCOVERY__XMI_SIZE_IN_BYTES  case BenchmarkPackage.DISCOVERY__NAME:return JavaBenchmarkPackage.CDO_PROJECT_DISCOVERY__NAME  case BenchmarkPackage.DISCOVERY__DISCOVERY_ERROR:return JavaBenchmarkPackage.CDO_PROJECT_DISCOVERY__DISCOVERY_ERROR  default:return -1  } } if (baseClass == ProjectDiscovery.class) { switch (baseFeatureID) { case BenchmarkPackage.PROJECT_DISCOVERY__PROJECTS:return JavaBenchmarkPackage.CDO_PROJECT_DISCOVERY__PROJECTS  default:return -1  } } return super.eDerivedStructuralFeatureID(baseFeatureID baseClass)  }   Give the updated java method only,@Override   public int eDerivedStructuralFeatureID(int baseFeatureID  Class<?> baseClass) {    if (baseClass == DiscoveryIteration.class) {      switch (baseFeatureID) {        case BenchmarkPackage.DISCOVERY_ITERATION__DICOVERY_DATE:          return JavaBenchmarkPackage.CDO_PROJECT_DISCOVERY_ITERATION__DICOVERY_DATE         case BenchmarkPackage.DISCOVERY_ITERATION__ALGORITHM_VARIANT:          return JavaBenchmarkPackage.CDO_PROJECT_DISCOVERY_ITERATION__ALGORITHM_VARIANT         case BenchmarkPackage.DISCOVERY_ITERATION__DISCOVERER_ID:          return JavaBenchmarkPackage.CDO_PROJECT_DISCOVERY_ITERATION__DISCOVERER_ID         case BenchmarkPackage.DISCOVERY_ITERATION__DISCOVERER_CLASS_NAME:          return JavaBenchmarkPackage.CDO_PROJECT_DISCOVERY_ITERATION__DISCOVERER_CLASS_NAME         case BenchmarkPackage.DISCOVERY_ITERATION__SAVE_TIME_IN_SECONDS:          return JavaBenchmarkPackage.CDO_PROJECT_DISCOVERY_ITERATION__SAVE_TIME_IN_SECONDS         case BenchmarkPackage.DISCOVERY_ITERATION__META_MODEL_VARIANT:          return JavaBenchmarkPackage.CDO_PROJECT_DISCOVERY_ITERATION__META_MODEL_VARIANT         case BenchmarkPackage.DISCOVERY_ITERATION__MAX_USED_MEMORY_IN_BYTES:          return JavaBenchmarkPackage.CDO_PROJECT_DISCOVERY_ITERATION__MAX_USED_MEMORY_IN_BYTES         case BenchmarkPackage.DISCOVERY_ITERATION__NUMBER_OF_MODEL_ELEMENTS:          return JavaBenchmarkPackage.CDO_PROJECT_DISCOVERY_ITERATION__NUMBER_OF_MODEL_ELEMENTS         case BenchmarkPackage.DISCOVERY_ITERATION__XMI_SIZE_IN_BYTES:          return JavaBenchmarkPackage.CDO_PROJECT_DISCOVERY_ITERATION__XMI_SIZE_IN_BYTES         case BenchmarkPackage.DISCOVERY_ITERATION__NAME:          return JavaBenchmarkPackage.CDO_PROJECT_DISCOVERY_ITERATION__NAME         case BenchmarkPackage.DISCOVERY_ITERATION__DISCOVERY_ERROR:          return JavaBenchmarkPackage.CDO_PROJECT_DISCOVERY_ITERATION__DISCOVERY_ERROR         case BenchmarkPackage.DISCOVERY_ITERATION__TOTAL_EXECUTION_TIME_IN_SECONDS:          return JavaBenchmarkPackage.CDO_PROJECT_DISCOVERY_ITERATION__TOTAL_EXECUTION_TIME_IN_SECONDS         default:          return -1       }    }    return super.eDerivedStructuralFeatureID(baseFeatureID  baseClass)   }
26,Extract property,Error : DISCOVERY__META_MODEL_VARIANT CU : CDOProjectDiscoveryImpl.java Line : 834,,The phrase "qui vivra verra" is a French expression that translates to "he/she who lives  shall see" in English. It is often used to convey the idea that the future is uncertain and that one must wait and see what happens.
27,Extract property,Error : DISCOVERY__MAX_USED_MEMORY_IN_BYTES CU : CDOProjectDiscoveryImpl.java Line : 835,The literal DISCOVERY__MAX_USED_MEMORY_IN_BYTES is generated by combining the literal of the source class and the literal of the attribute  The attribute maxUsedMemoryInBytes is moved from the class Discovery to the class DiscoveryIteration through the reference iterations Coevolve this java code snippet according to the described change  :   /**   * <!-- begin-user-doc --> <!-- end-user-doc -->  * @generated  */ @Override public int eDerivedStructuralFeatureID(int baseFeatureID Class<?> baseClass){   if (baseClass == Discovery.class) { switch (baseFeatureID) { case BenchmarkPackage.DISCOVERY__DICOVERY_DATE:      return JavaBenchmarkPackage.CDO_PROJECT_DISCOVERY__DICOVERY_DATE  case BenchmarkPackage.DISCOVERY__ALGORITHM_VARIANT:    return JavaBenchmarkPackage.CDO_PROJECT_DISCOVERY__ALGORITHM_VARIANT  case BenchmarkPackage.DISCOVERY__DISCOVERER_ID:  return JavaBenchmarkPackage.CDO_PROJECT_DISCOVERY__DISCOVERER_ID  case BenchmarkPackage.DISCOVERY__DISCOVERER_CLASS_NAME:return JavaBenchmarkPackage.CDO_PROJECT_DISCOVERY__DISCOVERER_CLASS_NAME  case BenchmarkPackage.DISCOVERY__SAVE_TIME_IN_SECONDS:return JavaBenchmarkPackage.CDO_PROJECT_DISCOVERY__SAVE_TIME_IN_SECONDS  case BenchmarkPackage.DISCOVERY__TOTAL_EXECUTION_TIME_IN_SECONDS:return JavaBenchmarkPackage.CDO_PROJECT_DISCOVERY__TOTAL_EXECUTION_TIME_IN_SECONDS  case BenchmarkPackage.DISCOVERY__META_MODEL_VARIANT:return JavaBenchmarkPackage.CDO_PROJECT_DISCOVERY__META_MODEL_VARIANT  case BenchmarkPackage.DISCOVERY__MAX_USED_MEMORY_IN_BYTES:return JavaBenchmarkPackage.CDO_PROJECT_DISCOVERY__MAX_USED_MEMORY_IN_BYTES  case BenchmarkPackage.DISCOVERY__NUMBER_OF_MODEL_ELEMENTS:return JavaBenchmarkPackage.CDO_PROJECT_DISCOVERY__NUMBER_OF_MODEL_ELEMENTS  case BenchmarkPackage.DISCOVERY__XMI_SIZE_IN_BYTES:return JavaBenchmarkPackage.CDO_PROJECT_DISCOVERY__XMI_SIZE_IN_BYTES  case BenchmarkPackage.DISCOVERY__NAME:return JavaBenchmarkPackage.CDO_PROJECT_DISCOVERY__NAME  case BenchmarkPackage.DISCOVERY__DISCOVERY_ERROR:return JavaBenchmarkPackage.CDO_PROJECT_DISCOVERY__DISCOVERY_ERROR  default:return -1  } } if (baseClass == ProjectDiscovery.class) { switch (baseFeatureID) { case BenchmarkPackage.PROJECT_DISCOVERY__PROJECTS:return JavaBenchmarkPackage.CDO_PROJECT_DISCOVERY__PROJECTS  default:return -1  } } return super.eDerivedStructuralFeatureID(baseFeatureID baseClass)  }   Give the updated java method only,@Override  public int eDerivedStructuralFeatureID(int baseFeatureID  Class<?> baseClass) {      if (baseClass == Discovery.class) {          switch (baseFeatureID) {              case BenchmarkPackage.DISCOVERY__DICOVERY_DATE:                  return JavaBenchmarkPackage.CDO_PROJECT_DISCOVERY_ITERATION__DICOVERY_DATE               case BenchmarkPackage.DISCOVERY__ALGORITHM_VARIANT:                  return JavaBenchmarkPackage.CDO_PROJECT_DISCOVERY_ITERATION__ALGORITHM_VARIANT               case BenchmarkPackage.DISCOVERY__DISCOVERER_ID:                  return JavaBenchmarkPackage.CDO_PROJECT_DISCOVERY_ITERATION__DISCOVERER_ID               case BenchmarkPackage.DISCOVERY__DISCOVERER_CLASS_NAME:                  return JavaBenchmarkPackage.CDO_PROJECT_DISCOVERY_ITERATION__DISCOVERER_CLASS_NAME               case BenchmarkPackage.DISCOVERY__SAVE_TIME_IN_SECONDS:                  return JavaBenchmarkPackage.CDO_PROJECT_DISCOVERY_ITERATION__SAVE_TIME_IN_SECONDS               case BenchmarkPackage.DISCOVERY__TOTAL_EXECUTION_TIME_IN_SECONDS:                  return JavaBenchmarkPackage.CDO_PROJECT_DISCOVERY_ITERATION__TOTAL_EXECUTION_TIME_IN_SECONDS               case BenchmarkPackage.DISCOVERY__META_MODEL_VARIANT:                  return JavaBenchmarkPackage.CDO_PROJECT_DISCOVERY_ITERATION__META_MODEL_VARIANT               case BenchmarkPackage.DISCOVERY__NUMBER_OF_MODEL_ELEMENTS:                  return JavaBenchmarkPackage.CDO_PROJECT_DISCOVERY_ITERATION__NUMBER_OF_MODEL_ELEMENTS               case BenchmarkPackage.DISCOVERY__XMI_SIZE_IN_BYTES:                  return JavaBenchmarkPackage.CDO_PROJECT_DISCOVERY_ITERATION__XMI_SIZE_IN_BYTES               case BenchmarkPackage.DISCOVERY__NAME:                  return JavaBenchmarkPackage.CDO_PROJECT_DISCOVERY_ITERATION__NAME               case BenchmarkPackage.DISCOVERY__DISCOVERY_ERROR:                  return JavaBenchmarkPackage.CDO_PROJECT_DISCOVERY_ITERATION__DISCOVERY_ERROR               case BenchmarkPackage.DISCOVERY__MAX_USED_MEMORY_IN_BYTES:                  return JavaBenchmarkPackage.CDO_PROJECT_DISCOVERY_ITERATION__MAX_USED_MEMORY_IN_BYTES               default:                  return -1           }      }      if (baseClass == ProjectDiscovery.class) {          switch (baseFeatureID) {              case BenchmarkPackage.PROJECT_DISCOVERY__PROJECTS:                  return JavaBenchmarkPackage.CDO_PROJECT_DISCOVERY_ITERATION__PROJECTS               default:                  return -1           }      }      return super.eDerivedStructuralFeatureID(baseFeatureID  baseClass)   }
28,Extract property,Error : DISCOVERY__DISCOVERY_ERROR CU : CDOProjectDiscoveryImpl.java Line : 839,The literal DISCOVERY__DISCOVERY_ERROR is generated by combining the literal of the source class and the literal of the attribute  The attribute discoveryError is moved from the class Discovery to the class DiscoveryIteration through the reference iterations Coevolve this java code snippet according to the described change  :   /**   * <!-- begin-user-doc --> <!-- end-user-doc -->  * @generated  */ @Override public int eDerivedStructuralFeatureID(int baseFeatureID Class<?> baseClass){   if (baseClass == Discovery.class) { switch (baseFeatureID) { case BenchmarkPackage.DISCOVERY__DICOVERY_DATE:      return JavaBenchmarkPackage.CDO_PROJECT_DISCOVERY__DICOVERY_DATE  case BenchmarkPackage.DISCOVERY__ALGORITHM_VARIANT:    return JavaBenchmarkPackage.CDO_PROJECT_DISCOVERY__ALGORITHM_VARIANT  case BenchmarkPackage.DISCOVERY__DISCOVERER_ID:  return JavaBenchmarkPackage.CDO_PROJECT_DISCOVERY__DISCOVERER_ID  case BenchmarkPackage.DISCOVERY__DISCOVERER_CLASS_NAME:return JavaBenchmarkPackage.CDO_PROJECT_DISCOVERY__DISCOVERER_CLASS_NAME  case BenchmarkPackage.DISCOVERY__SAVE_TIME_IN_SECONDS:return JavaBenchmarkPackage.CDO_PROJECT_DISCOVERY__SAVE_TIME_IN_SECONDS  case BenchmarkPackage.DISCOVERY__TOTAL_EXECUTION_TIME_IN_SECONDS:return JavaBenchmarkPackage.CDO_PROJECT_DISCOVERY__TOTAL_EXECUTION_TIME_IN_SECONDS  case BenchmarkPackage.DISCOVERY__META_MODEL_VARIANT:return JavaBenchmarkPackage.CDO_PROJECT_DISCOVERY__META_MODEL_VARIANT  case BenchmarkPackage.DISCOVERY__MAX_USED_MEMORY_IN_BYTES:return JavaBenchmarkPackage.CDO_PROJECT_DISCOVERY__MAX_USED_MEMORY_IN_BYTES  case BenchmarkPackage.DISCOVERY__NUMBER_OF_MODEL_ELEMENTS:return JavaBenchmarkPackage.CDO_PROJECT_DISCOVERY__NUMBER_OF_MODEL_ELEMENTS  case BenchmarkPackage.DISCOVERY__XMI_SIZE_IN_BYTES:return JavaBenchmarkPackage.CDO_PROJECT_DISCOVERY__XMI_SIZE_IN_BYTES  case BenchmarkPackage.DISCOVERY__NAME:return JavaBenchmarkPackage.CDO_PROJECT_DISCOVERY__NAME  case BenchmarkPackage.DISCOVERY__DISCOVERY_ERROR:return JavaBenchmarkPackage.CDO_PROJECT_DISCOVERY__DISCOVERY_ERROR  default:return -1  } } if (baseClass == ProjectDiscovery.class) { switch (baseFeatureID) { case BenchmarkPackage.PROJECT_DISCOVERY__PROJECTS:return JavaBenchmarkPackage.CDO_PROJECT_DISCOVERY__PROJECTS  default:return -1  } } return super.eDerivedStructuralFeatureID(baseFeatureID baseClass)  }   Give the updated java method only,/**    * <!-- begin-user-doc --> <!-- end-user-doc -->   * @generated   */  @Override public int eDerivedStructuralFeatureID(int baseFeatureID  Class<?> baseClass) {    if (baseClass == Discovery.class) {      switch (baseFeatureID) {        case BenchmarkPackage.DISCOVERY__DICOVERY_DATE:          return JavaBenchmarkPackage.CDO_PROJECT_DISCOVERY__DICOVERY_DATE         case BenchmarkPackage.DISCOVERY__ALGORITHM_VARIANT:          return JavaBenchmarkPackage.CDO_PROJECT_DISCOVERY__ALGORITHM_VARIANT         case BenchmarkPackage.DISCOVERY__DISCOVERER_ID:          return JavaBenchmarkPackage.CDO_PROJECT_DISCOVERY__DISCOVERER_ID         case BenchmarkPackage.DISCOVERY__DISCOVERER_CLASS_NAME:          return JavaBenchmarkPackage.CDO_PROJECT_DISCOVERY__DISCOVERER_CLASS_NAME         case BenchmarkPackage.DISCOVERY__SAVE_TIME_IN_SECONDS:          return JavaBenchmarkPackage.CDO_PROJECT_DISCOVERY__SAVE_TIME_IN_SECONDS         case BenchmarkPackage.DISCOVERY__TOTAL_EXECUTION_TIME_IN_SECONDS:          return JavaBenchmarkPackage.CDO_PROJECT_DISCOVERY__TOTAL_EXECUTION_TIME_IN_SECONDS         case BenchmarkPackage.DISCOVERY__META_MODEL_VARIANT:          return JavaBenchmarkPackage.CDO_PROJECT_DISCOVERY__META_MODEL_VARIANT         case BenchmarkPackage.DISCOVERY__MAX_USED_MEMORY_IN_BYTES:          return JavaBenchmarkPackage.CDO_PROJECT_DISCOVERY__MAX_USED_MEMORY_IN_BYTES         case BenchmarkPackage.DISCOVERY__NUMBER_OF_MODEL_ELEMENTS:          return JavaBenchmarkPackage.CDO_PROJECT_DISCOVERY__NUMBER_OF_MODEL_ELEMENTS         case BenchmarkPackage.DISCOVERY__XMI_SIZE_IN_BYTES:          return JavaBenchmarkPackage.CDO_PROJECT_DISCOVERY__XMI_SIZE_IN_BYTES         case BenchmarkPackage.DISCOVERY__NAME:          return JavaBenchmarkPackage.CDO_PROJECT_DISCOVERY__NAME         case BenchmarkPackage.DISCOVERY__DISCOVERY_ERROR:          return JavaBenchmarkPackage.CDO_PROJECT_DISCOVERY_ITERATION__DISCOVERY_ERROR         default:          return -1       }    }    if (baseClass == ProjectDiscovery.class) {      switch (baseFeatureID) {        case BenchmarkPackage.PROJECT_DISCOVERY__PROJECTS:          return JavaBenchmarkPackage.CDO_PROJECT_DISCOVERY__PROJECTS         default:          return -1       }    }    return super.eDerivedStructuralFeatureID(baseFeatureID  baseClass)   }
29,Delete Class ,Error : ProjectDiscovery CU : CDOProjectDiscoveryImpl.java Line : 843,Considering a metaclass called ProjectDiscovery The class ProjectDiscovery is generated from this metaclass. Here is a change: the metaclass ProjectDiscovery is removed with all the generated classes and properties are removed.  Coevolve this java code snippet according to the described change  :   /**   * <!-- begin-user-doc --> <!-- end-user-doc -->  * @generated  */ @Override public int eDerivedStructuralFeatureID(int baseFeatureID Class<?> baseClass){   if (baseClass == Discovery.class) { switch (baseFeatureID) { case BenchmarkPackage.DISCOVERY__DICOVERY_DATE:      return JavaBenchmarkPackage.CDO_PROJECT_DISCOVERY__DICOVERY_DATE  case BenchmarkPackage.DISCOVERY__ALGORITHM_VARIANT:    return JavaBenchmarkPackage.CDO_PROJECT_DISCOVERY__ALGORITHM_VARIANT  case BenchmarkPackage.DISCOVERY__DISCOVERER_ID:  return JavaBenchmarkPackage.CDO_PROJECT_DISCOVERY__DISCOVERER_ID  case BenchmarkPackage.DISCOVERY__DISCOVERER_CLASS_NAME:return JavaBenchmarkPackage.CDO_PROJECT_DISCOVERY__DISCOVERER_CLASS_NAME  case BenchmarkPackage.DISCOVERY__SAVE_TIME_IN_SECONDS:return JavaBenchmarkPackage.CDO_PROJECT_DISCOVERY__SAVE_TIME_IN_SECONDS  case BenchmarkPackage.DISCOVERY__TOTAL_EXECUTION_TIME_IN_SECONDS:return JavaBenchmarkPackage.CDO_PROJECT_DISCOVERY__TOTAL_EXECUTION_TIME_IN_SECONDS  case BenchmarkPackage.DISCOVERY__META_MODEL_VARIANT:return JavaBenchmarkPackage.CDO_PROJECT_DISCOVERY__META_MODEL_VARIANT  case BenchmarkPackage.DISCOVERY__MAX_USED_MEMORY_IN_BYTES:return JavaBenchmarkPackage.CDO_PROJECT_DISCOVERY__MAX_USED_MEMORY_IN_BYTES  case BenchmarkPackage.DISCOVERY__NUMBER_OF_MODEL_ELEMENTS:return JavaBenchmarkPackage.CDO_PROJECT_DISCOVERY__NUMBER_OF_MODEL_ELEMENTS  case BenchmarkPackage.DISCOVERY__XMI_SIZE_IN_BYTES:return JavaBenchmarkPackage.CDO_PROJECT_DISCOVERY__XMI_SIZE_IN_BYTES  case BenchmarkPackage.DISCOVERY__NAME:return JavaBenchmarkPackage.CDO_PROJECT_DISCOVERY__NAME  case BenchmarkPackage.DISCOVERY__DISCOVERY_ERROR:return JavaBenchmarkPackage.CDO_PROJECT_DISCOVERY__DISCOVERY_ERROR  default:return -1  } } if (baseClass == ProjectDiscovery.class) { switch (baseFeatureID) { case BenchmarkPackage.PROJECT_DISCOVERY__PROJECTS:return JavaBenchmarkPackage.CDO_PROJECT_DISCOVERY__PROJECTS  default:return -1  } } return super.eDerivedStructuralFeatureID(baseFeatureID baseClass)  }   Give the updated java method only,@Override public int eDerivedStructuralFeatureID(int baseFeatureID  Class<?> baseClass) {    if (baseClass == Discovery.class) {      return -1  // remove all generated properties for Discovery    }    if (baseClass == ProjectDiscovery.class) {      switch (baseFeatureID) {        case BenchmarkPackage.PROJECT_DISCOVERY__PROJECTS: return -1  // remove the generated property for projects        default: return -1       }    }    return super.eDerivedStructuralFeatureID(baseFeatureID  baseClass)   }
30,Extract property,Error : PROJECT_DISCOVERY__PROJECTS CU : CDOProjectDiscoveryImpl.java Line : 845,,There are many reasons why people love animals. Here are a few possible reasons:    1. Companionship: Animals can provide unconditional love and companionship. They can be a source of comfort and support  especially for people who live alone or struggle with loneliness.    2. Emotional support: Animals have been shown to help reduce stress  anxiety  and depression. They can provide emotional support and be a calming presence in people's lives.    3. Unconditional love: Animals are non-judgmental and love their owners unconditionally. They do not hold grudges or criticize  which can make them a source of comfort and acceptance.    4. Bonding: Taking care of an animal and building a bond with them can be a rewarding and fulfilling experience. The process of training  nurturing  and caring for an animal can create a strong bond between the owner and the pet.    5. Health benefits: Pets have been shown to have many health benefits  such as lower blood pressure  reduced risk of heart disease  and improved mental health. They can also encourage people to be more active and engage in physical activity.    6. Teaching responsibility: Having a pet can teach children and adults alike about responsibility  empathy  and compassion. Taking care of another living being requires commitment and can help develop important life skills.    7. Uniqueness: Animals often have unique personalities and behaviors that can be fascinating and entertaining to observe. Each animal has its own quirks and characteristics  which can make them interesting and lovable.    8. Connection to nature: Animals are a part of the natural world  and having a pet can help people feel more connected to nature and the environment. They can provide a sense of grounding and remind people of the beauty and diversity of the natural world.    Overall  the love for animals is often rooted in the emotional  physical  and psychological benefits they provide to individuals. They can bring joy  comfort  and a sense of purpose to people's lives.
31,null,Error : CDODiscoveryImpl CU : CDODiscoveryImpl.java Line : 50,,The term "C-section" stands for Cesarean section. It is a surgical procedure in which a baby is delivered through an incision made in the mother's abdomen and uterus. C-sections are typically performed when vaginal delivery is not safe or possible  such as in cases of fetal distress  breech presentation  multiple births  or certain medical conditions of the mother. The procedure is conducted under anesthesia  and recovery time is typically longer compared to vaginal birth.
32,null,Error : CDODiscoveryImpl CU : CDODiscoveryImpl.java Line : 50,,
