37,Rename Class ,Error : ExtendedElementTypeConfiguration CU : ElementTypeUtils.java Line : 27,The class ExtendedElementTypeConfiguration is generated from  The metaclass which ExtendedElementTypeConfiguration is renamed to ElementTypeConfiguration Coevolve this java code snippet according to the described change  :   import org.eclipse.gmf.runtime.emf.type.core.IMetamodelType  import org.eclipse.papyrus.infra.extendedtypes.ExtendedElementTypeConfiguration  import org.eclipse.papyrus.infra.extendedtypes.PostActionConfiguration    Give the updated java method only,import org.eclipse.gmf.runtime.emf.type.core.IMetamodelType   import org.eclipse.papyrus.infra.extendedtypes.ElementTypeConfiguration   import org.eclipse.papyrus.infra.extendedtypes.PostActionConfiguration     public class ExtendedElementTypeConfiguration extends ElementTypeConfiguration {      // existing code            @Override      public IMetamodelType getMetamodelType() {          // updated code          // return the renamed metamodel type          return super.getMetamodelType()       }            @Override      public void setMetamodelType(IMetamodelType metamodelType) {          // updated code          // set the renamed metamodel type          super.setMetamodelType(metamodelType)       }            @Override      public PostActionConfiguration getPostActionConfiguration() {          // updated code          // return the renamed post action configuration          return super.getPostActionConfiguration()       }            @Override      public void setPostActionConfiguration(PostActionConfiguration postActionConfiguration) {          // updated code          // set the renamed post action configuration          super.setPostActionConfiguration(postActionConfiguration)       }  }
38,Rename Class ,Error : PostActionConfiguration CU : ElementTypeUtils.java Line : 28,The class PostActionConfiguration is generated from  The metaclass which PostActionConfiguration is renamed to SemanticActionConfiguration Coevolve this java code snippet according to the described change  :   import org.eclipse.papyrus.infra.extendedtypes.ExtendedElementTypeConfiguration  import org.eclipse.papyrus.infra.extendedtypes.PostActionConfiguration  import org.eclipse.papyrus.infra.extendedtypes.PreActionConfiguration    Give the updated java method only,import org.eclipse.papyrus.infra.extendedtypes.ExtendedElementTypeConfiguration   import org.eclipse.papyrus.infra.extendedtypes.PreActionConfiguration     public class SemanticActionConfiguration extends ExtendedElementTypeConfiguration {      private PreActionConfiguration preActionConfiguration         public PreActionConfiguration getPreActionConfiguration() {          return preActionConfiguration       }        public void setPreActionConfiguration(PreActionConfiguration preActionConfiguration) {          this.preActionConfiguration = preActionConfiguration       }  }
39,Rename Class ,Error : PreActionConfiguration CU : ElementTypeUtils.java Line : 29,The class PreActionConfiguration is generated from  The metaclass which PreActionConfiguration is renamed to ViewActionConfiguration Coevolve this java code snippet according to the described change  :   import org.eclipse.papyrus.infra.extendedtypes.PostActionConfiguration  import org.eclipse.papyrus.infra.extendedtypes.PreActionConfiguration  import org.eclipse.papyrus.infra.extendedtypes.types.IExtendedHintedElementType    Give the updated java method only,import org.eclipse.papyrus.infra.extendedtypes.PostActionConfiguration   import org.eclipse.papyrus.infra.extendedtypes.ViewActionConfiguration   import org.eclipse.papyrus.infra.extendedtypes.types.IExtendedHintedElementType     public class PreActionConfiguration implements ViewActionConfiguration {      // Existing code for PreActionConfiguration class        @Override      public IExtendedHintedElementType getElementType() {          // Implementation for the getElementType() method      }        @Override      public void setElementType(IExtendedHintedElementType elementType) {          // Implementation for the setElementType() method      }        // Other methods specific to PreActionConfiguration class  }
40,Rename class,Error : ExtendedElementTypeConfiguration CU : ElementTypeUtils.java Line : 88,The class ExtendedElementTypeConfiguration is generated from  The metaclass ExtendedElementTypeConfiguration which is renamed to ElementTypeConfiguration Coevolve this java code snippet according to the described change  :   /**   * Tests if two elements types are equivalent (configuration)  * @param referenceType the reference type for the comparison  * @param typeToCompare the type that is compared to the reference one  * @return <code>true</code> if both types are equivalent semantically  */ public static boolean isSemanticallyEquivalent(IExtendedHintedElementType referenceType IExtendedHintedElementType typeToCompare){   boolean isEquivalent=true    ExtendedElementTypeConfiguration referenceConfiguration=referenceType.getConfiguration()    ExtendedElementTypeConfiguration configurationToCompare=typeToCompare.getConfiguration()    List<QueryConfiguration> referencePrevalidation=referenceConfiguration.getPreValidation()    List<QueryConfiguration> prevalidationToCompare=configurationToCompare.getPreValidation()    if (referencePrevalidation != null) {     isEquivalent=isEquivalent && isEquivalent(referencePrevalidation prevalidationToCompare)    }  else   if (prevalidationToCompare != null) {     isEquivalent=false    }   List<PreActionConfiguration> referencePreaction=referenceConfiguration.getPreAction()    List<PreActionConfiguration> preactionToCompare=configurationToCompare.getPreAction()    if (referencePreaction != null) {     isEquivalent=isEquivalent && isEquivalent(referencePreaction preactionToCompare)    }  else   if (preactionToCompare != null) {     isEquivalent=false    }   List<PostActionConfiguration> referencePostaction=referenceConfiguration.getPostAction()    List<PostActionConfiguration> postactionToCompare=configurationToCompare.getPostAction()    if (referencePostaction != null) {     isEquivalent=isEquivalent && isEquivalent(referencePostaction postactionToCompare)    }  else   if (postactionToCompare != null) {     isEquivalent=false    }   return isEquivalent  }   Give the updated java method only,/**    * Tests if two elements types are equivalent (configuration)   * @param referenceType the reference type for the comparison   * @param typeToCompare the type that is compared to the reference one   * @return <code>true</code> if both types are equivalent semantically   */  public static boolean isSemanticallyEquivalent(IHintedElementType referenceType  IHintedElementType typeToCompare){    boolean isEquivalent = true     ElementTypeConfiguration referenceConfiguration = ((ExtendedElementTypeConfiguration) referenceType.getConfiguration()).renameTo(ElementTypeConfiguration.class)     ElementTypeConfiguration configurationToCompare = ((ExtendedElementTypeConfiguration) typeToCompare.getConfiguration()).renameTo(ElementTypeConfiguration.class)     List<QueryConfiguration> referencePrevalidation = referenceConfiguration.getPreValidation()     List<QueryConfiguration> prevalidationToCompare = configurationToCompare.getPreValidation()     if (referencePrevalidation != null) {      isEquivalent = isEquivalent && isEquivalent(referencePrevalidation  prevalidationToCompare)     }    else if (prevalidationToCompare != null) {      isEquivalent = false     }    List<PreActionConfiguration> referencePreaction = referenceConfiguration.getPreAction()     List<PreActionConfiguration> preactionToCompare = configurationToCompare.getPreAction()     if (referencePreaction != null) {      isEquivalent = isEquivalent && isEquivalent(referencePreaction  preactionToCompare)     }    else if (preactionToCompare != null) {      isEquivalent = false     }    List<PostActionConfiguration> referencePostaction = referenceConfiguration.getPostAction()     List<PostActionConfiguration> postactionToCompare = configurationToCompare.getPostAction()     if (referencePostaction != null) {      isEquivalent = isEquivalent && isEquivalent(referencePostaction  postactionToCompare)     }    else if (postactionToCompare != null) {      isEquivalent = false     }    return isEquivalent   }
41,null,Error : getConfiguration CU : ElementTypeUtils.java Line : 88,,There are several reasons why people might choose to travel abroad. Some of these reasons include:    1. Cultural exploration: Traveling abroad allows individuals to experience different cultures  traditions  and ways of life. It provides an opportunity to learn about and appreciate the diversity of the world.    2. Adventure and exploration: Many people travel abroad to seek out new experiences and embark on exciting adventures. This can include activities such as hiking  scuba diving  or exploring historical landmarks.    3. Education and learning opportunities: Traveling abroad can be a valuable learning experience. It allows individuals to gain knowledge about different countries  languages  and customs. It can also provide opportunities for formal education through study abroad programs.    4. Personal growth and self-discovery: Traveling abroad often pushes individuals out of their comfort zones and challenges them to adapt to new environments. This can lead to personal growth  increased self-confidence  and a broader perspective on life.    5. Building connections and relationships: Traveling abroad provides an opportunity to meet new people and build connections with individuals from different backgrounds. This can lead to lifelong friendships and networking opportunities.    6. Relaxation and rejuvenation: Many people choose to travel abroad to escape their daily routines and relax in a new environment. Whether it's lounging on a beach or exploring a peaceful countryside  traveling abroad can provide a much-needed break from the stresses of everyday life.    7. Food and culinary experiences: Traveling abroad allows individuals to sample a wide variety of cuisines and taste flavors they may not have encountered before. Trying new foods can be an exciting and enjoyable aspect of traveling.    8. Volunteer and service opportunities: Some people choose to travel abroad to engage in volunteer work or participate in service projects. This allows them to make a positive impact on local communities and contribute to meaningful causes.    9. Business and career opportunities: Traveling abroad can provide individuals with opportunities to expand their professional networks  explore potential business ventures  or gain international work experience. It can also help individuals develop cross-cultural communication skills  which can be valuable in today's globalized world.    10. Simply for the love of travel: For some people  the desire to travel is simply driven by a love for exploring new places  experiencing different cultures  and satisfying their wanderlust. They may have a deep passion for travel and a curiosity to see as much of the world as possible.
42,Rename class,Error : ExtendedElementTypeConfiguration CU : ElementTypeUtils.java Line : 89,The class ExtendedElementTypeConfiguration is generated from  The metaclass ExtendedElementTypeConfiguration which is renamed to ElementTypeConfiguration Coevolve this java code snippet according to the described change  :   /**   * Tests if two elements types are equivalent (configuration)  * @param referenceType the reference type for the comparison  * @param typeToCompare the type that is compared to the reference one  * @return <code>true</code> if both types are equivalent semantically  */ public static boolean isSemanticallyEquivalent(IExtendedHintedElementType referenceType IExtendedHintedElementType typeToCompare){   boolean isEquivalent=true    ExtendedElementTypeConfiguration referenceConfiguration=referenceType.getConfiguration()    ExtendedElementTypeConfiguration configurationToCompare=typeToCompare.getConfiguration()    List<QueryConfiguration> referencePrevalidation=referenceConfiguration.getPreValidation()    List<QueryConfiguration> prevalidationToCompare=configurationToCompare.getPreValidation()    if (referencePrevalidation != null) {     isEquivalent=isEquivalent && isEquivalent(referencePrevalidation prevalidationToCompare)    }  else   if (prevalidationToCompare != null) {     isEquivalent=false    }   List<PreActionConfiguration> referencePreaction=referenceConfiguration.getPreAction()    List<PreActionConfiguration> preactionToCompare=configurationToCompare.getPreAction()    if (referencePreaction != null) {     isEquivalent=isEquivalent && isEquivalent(referencePreaction preactionToCompare)    }  else   if (preactionToCompare != null) {     isEquivalent=false    }   List<PostActionConfiguration> referencePostaction=referenceConfiguration.getPostAction()    List<PostActionConfiguration> postactionToCompare=configurationToCompare.getPostAction()    if (referencePostaction != null) {     isEquivalent=isEquivalent && isEquivalent(referencePostaction postactionToCompare)    }  else   if (postactionToCompare != null) {     isEquivalent=false    }   return isEquivalent  }   Give the updated java method only,/**    * Tests if two elements types are equivalent (configuration)   * @param referenceType the reference type for the comparison   * @param typeToCompare the type that is compared to the reference one   * @return <code>true</code> if both types are equivalent semantically   */  public static boolean isSemanticallyEquivalent(IHintedElementType referenceType  IHintedElementType typeToCompare){    boolean isEquivalent=true     ElementTypeConfiguration referenceConfiguration=referenceType.getConfiguration()     ElementTypeConfiguration configurationToCompare=typeToCompare.getConfiguration()     List<QueryConfiguration> referencePrevalidation=referenceConfiguration.getPreValidation()     List<QueryConfiguration> prevalidationToCompare=configurationToCompare.getPreValidation()     if (referencePrevalidation != null) {      isEquivalent=isEquivalent && isEquivalent(referencePrevalidation prevalidationToCompare)     }   else   if (prevalidationToCompare != null) {      isEquivalent=false     }    List<PreActionConfiguration> referencePreaction=referenceConfiguration.getPreAction()     List<PreActionConfiguration> preactionToCompare=configurationToCompare.getPreAction()     if (referencePreaction != null) {      isEquivalent=isEquivalent && isEquivalent(referencePreaction preactionToCompare)     }   else   if (preactionToCompare != null) {      isEquivalent=false     }    List<PostActionConfiguration> referencePostaction=referenceConfiguration.getPostAction()     List<PostActionConfiguration> postactionToCompare=configurationToCompare.getPostAction()     if (referencePostaction != null) {      isEquivalent=isEquivalent && isEquivalent(referencePostaction postactionToCompare)     }   else   if (postactionToCompare != null) {      isEquivalent=false     }    return isEquivalent   }
43,null,Error : getConfiguration CU : ElementTypeUtils.java Line : 89,,I'm sorry  I cannot continue the text for you as I do not have enough information. Can you please provide more details or specify what you need help with?
44,Rename class,Error : PreActionConfiguration CU : ElementTypeUtils.java Line : 97,The class PreActionConfiguration is generated from  The metaclass PreActionConfiguration which is renamed to ViewActionConfiguration Coevolve this java code snippet according to the described change  :   /**   * Tests if two elements types are equivalent (configuration)  * @param referenceType the reference type for the comparison  * @param typeToCompare the type that is compared to the reference one  * @return <code>true</code> if both types are equivalent semantically  */ public static boolean isSemanticallyEquivalent(IExtendedHintedElementType referenceType IExtendedHintedElementType typeToCompare){   boolean isEquivalent=true    ExtendedElementTypeConfiguration referenceConfiguration=referenceType.getConfiguration()    ExtendedElementTypeConfiguration configurationToCompare=typeToCompare.getConfiguration()    List<QueryConfiguration> referencePrevalidation=referenceConfiguration.getPreValidation()    List<QueryConfiguration> prevalidationToCompare=configurationToCompare.getPreValidation()    if (referencePrevalidation != null) {     isEquivalent=isEquivalent && isEquivalent(referencePrevalidation prevalidationToCompare)    }  else   if (prevalidationToCompare != null) {     isEquivalent=false    }   List<PreActionConfiguration> referencePreaction=referenceConfiguration.getPreAction()    List<PreActionConfiguration> preactionToCompare=configurationToCompare.getPreAction()    if (referencePreaction != null) {     isEquivalent=isEquivalent && isEquivalent(referencePreaction preactionToCompare)    }  else   if (preactionToCompare != null) {     isEquivalent=false    }   List<PostActionConfiguration> referencePostaction=referenceConfiguration.getPostAction()    List<PostActionConfiguration> postactionToCompare=configurationToCompare.getPostAction()    if (referencePostaction != null) {     isEquivalent=isEquivalent && isEquivalent(referencePostaction postactionToCompare)    }  else   if (postactionToCompare != null) {     isEquivalent=false    }   return isEquivalent  }   Give the updated java method only,/**    * Tests if two elements types are equivalent (configuration)   * @param referenceType the reference type for the comparison   * @param typeToCompare the type that is compared to the reference one   * @return <code>true</code> if both types are equivalent semantically   */  public static boolean isSemanticallyEquivalent(IExtendedHintedElementType referenceType IExtendedHintedElementType typeToCompare){    boolean isEquivalent=true     ExtendedElementTypeConfiguration referenceConfiguration=referenceType.getConfiguration()     ExtendedElementTypeConfiguration configurationToCompare=typeToCompare.getConfiguration()     List<QueryConfiguration> referencePrevalidation=referenceConfiguration.getPreValidation()     List<QueryConfiguration> prevalidationToCompare=configurationToCompare.getPreValidation()     if (referencePrevalidation != null) {      isEquivalent=isEquivalent && isEquivalent(referencePrevalidation prevalidationToCompare)     }   else   if (prevalidationToCompare != null) {      isEquivalent=false     }    List<ViewActionConfiguration> referencePreaction=referenceConfiguration.getPreAction()  // Updated line    List<ViewActionConfiguration> preactionToCompare=configurationToCompare.getPreAction()  // Updated line    if (referencePreaction != null) {      isEquivalent=isEquivalent && isEquivalent(referencePreaction preactionToCompare)     }   else   if (preactionToCompare != null) {      isEquivalent=false     }    List<PostActionConfiguration> referencePostaction=referenceConfiguration.getPostAction()     List<PostActionConfiguration> postactionToCompare=configurationToCompare.getPostAction()     if (referencePostaction != null) {      isEquivalent=isEquivalent && isEquivalent(referencePostaction postactionToCompare)     }   else   if (postactionToCompare != null) {      isEquivalent=false     }    return isEquivalent   }
45,Rename class,Error : PreActionConfiguration CU : ElementTypeUtils.java Line : 98,The class PreActionConfiguration is generated from  The metaclass PreActionConfiguration which is renamed to ViewActionConfiguration Coevolve this java code snippet according to the described change  :   /**   * Tests if two elements types are equivalent (configuration)  * @param referenceType the reference type for the comparison  * @param typeToCompare the type that is compared to the reference one  * @return <code>true</code> if both types are equivalent semantically  */ public static boolean isSemanticallyEquivalent(IExtendedHintedElementType referenceType IExtendedHintedElementType typeToCompare){   boolean isEquivalent=true    ExtendedElementTypeConfiguration referenceConfiguration=referenceType.getConfiguration()    ExtendedElementTypeConfiguration configurationToCompare=typeToCompare.getConfiguration()    List<QueryConfiguration> referencePrevalidation=referenceConfiguration.getPreValidation()    List<QueryConfiguration> prevalidationToCompare=configurationToCompare.getPreValidation()    if (referencePrevalidation != null) {     isEquivalent=isEquivalent && isEquivalent(referencePrevalidation prevalidationToCompare)    }  else   if (prevalidationToCompare != null) {     isEquivalent=false    }   List<PreActionConfiguration> referencePreaction=referenceConfiguration.getPreAction()    List<PreActionConfiguration> preactionToCompare=configurationToCompare.getPreAction()    if (referencePreaction != null) {     isEquivalent=isEquivalent && isEquivalent(referencePreaction preactionToCompare)    }  else   if (preactionToCompare != null) {     isEquivalent=false    }   List<PostActionConfiguration> referencePostaction=referenceConfiguration.getPostAction()    List<PostActionConfiguration> postactionToCompare=configurationToCompare.getPostAction()    if (referencePostaction != null) {     isEquivalent=isEquivalent && isEquivalent(referencePostaction postactionToCompare)    }  else   if (postactionToCompare != null) {     isEquivalent=false    }   return isEquivalent  }   Give the updated java method only,/**    * Tests if two elements types are equivalent (configuration)   * @param referenceType the reference type for the comparison   * @param typeToCompare the type that is compared to the reference one   * @return <code>true</code> if both types are equivalent semantically   */  public static boolean isSemanticallyEquivalent(IExtendedHintedElementType referenceType IExtendedHintedElementType typeToCompare){    boolean isEquivalent=true     ExtendedElementTypeConfiguration referenceConfiguration=referenceType.getConfiguration()     ExtendedElementTypeConfiguration configurationToCompare=typeToCompare.getConfiguration()     List<QueryConfiguration> referencePrevalidation=referenceConfiguration.getPreValidation()     List<QueryConfiguration> prevalidationToCompare=configurationToCompare.getPreValidation()     if (referencePrevalidation != null) {      isEquivalent=isEquivalent && isEquivalent(referencePrevalidation prevalidationToCompare)     }   else   if (prevalidationToCompare != null) {      isEquivalent=false     }    List<ViewActionConfiguration> referencePreaction=referenceConfiguration.getPreAction()     List<ViewActionConfiguration> preactionToCompare=configurationToCompare.getPreAction()     if (referencePreaction != null) {      isEquivalent=isEquivalent && isEquivalent(referencePreaction preactionToCompare)     }   else   if (preactionToCompare != null) {      isEquivalent=false     }    List<PostActionConfiguration> referencePostaction=referenceConfiguration.getPostAction()     List<PostActionConfiguration> postactionToCompare=configurationToCompare.getPostAction()     if (referencePostaction != null) {      isEquivalent=isEquivalent && isEquivalent(referencePostaction postactionToCompare)     }   else   if (postactionToCompare != null) {      isEquivalent=false     }    return isEquivalent   }
