NB,Change, Marker, Request, Result 
1,Rename class,Error : ExtendedElementTypeConfiguration CU : ExtendedTypesRegistry.java Line : 257,The class ExtendedElementTypeConfiguration is generated from  The metaclass ExtendedElementTypeConfiguration which is renamed to ElementTypeConfiguration Coevolve this java code snippet according to the described change  :   /**   * Gets the element type for <code>id</code>. May return <code>null</code> if this element is not registered.  * @param id the type ID  * @return the registered type with this ID  or <code>null</code> if thereis none.  */ public IElementType getType(String id){   IElementType type=ElementTypeRegistry.getInstance().getType(id)    if (type != null) {     return type    }   for (  ExtendedElementTypeSet set : extendedTypeSets) {     for (    ExtendedElementTypeConfiguration elementTypeConfiguration : set.getElementType()) {       if (id.equals(elementTypeConfiguration.getId())) {         @SuppressWarnings("restriction") ISpecializationType createSpecializationType=ExtendedHintedTypeFactory.getInstance().createSpecializationType(new ExtendedSemanticTypeDescriptor(elementTypeConfiguration))          ElementTypeRegistry.getInstance().register(createSpecializationType)          IClientContext papyrusContext=ClientContextManager.getInstance().getClientContext("org.eclipse.papyrus.infra.services.edit.TypeContext")          if (papyrusContext != null) {           papyrusContext.bindId(id)          }         return createSpecializationType        }     }   }   return null  }   Give the updated java method only,/**    * Gets the element type for <code>id</code>. May return <code>null</code> if this element is not registered.   * @param id the type ID   * @return the registered type with this ID  or <code>null</code> if thereis none.   */  public IElementType getType(String id){    IElementType type=ElementTypeRegistry.getInstance().getType(id)     if (type != null) {      return type     }    for (  ElementTypeConfiguration elementTypeConfiguration : elementTypeConfigurations) {      if (id.equals(elementTypeConfiguration.getId())) {        @SuppressWarnings("restriction")         ISpecializationType createSpecializationType=ExtendedHintedTypeFactory.getInstance().createSpecializationType(new ExtendedSemanticTypeDescriptor(elementTypeConfiguration))         ElementTypeRegistry.getInstance().register(createSpecializationType)         IClientContext papyrusContext=ClientContextManager.getInstance().getClientContext("org.eclipse.papyrus.infra.services.edit.TypeContext")         if (papyrusContext != null) {          papyrusContext.bindId(id)         }        return createSpecializationType       }    }    return null   }
2,null,,,I'm sorry  I cannot determine your gender based on your username.
3,null,Error : configuration CU : ExtendedSemanticTypeDescriptor.java Line : 55,,There are a few different ways to calculate profit margin  depending on the information available to you. Here are three common methods:    1. Gross Profit Margin: This is calculated by subtracting the cost of goods sold (COGS) from the total revenue and dividing the result by the total revenue. The formula is:  Gross Profit Margin = (Total Revenue - COGS) / Total Revenue    2. Operating Profit Margin: This takes into account not only the cost of goods sold but also other operating expenses such as rent  salaries  and utilities. It is calculated by subtracting the operating expenses from the total revenue and dividing the result by the total revenue. The formula is:  Operating Profit Margin = (Total Revenue - Operating Expenses) / Total Revenue    3. Net Profit Margin: This is the most comprehensive measure of profit margin  as it includes all expenses  including taxes and interest. It is calculated by subtracting all expenses (including taxes and interest) from the total revenue and dividing the result by the total revenue. The formula is:  Net Profit Margin = (Total Revenue - Total Expenses) / Total Revenue    Note that profit margin is typically expressed as a percentage  so you may want to multiply the result by 100 to get the percentage value.
4,null,Error : configuration CU : ExtendedSemanticTypeDescriptor.java Line : 62,,The term "AI" stands for Artificial Intelligence. It refers to the development of computer systems that can perform tasks that would typically require human intelligence  such as speech recognition  problem-solving  and decision-making. AI systems are designed to learn from and adapt to their environment  improving their performance over time. AI technology has a wide range of applications in various fields  including healthcare  finance  transportation  and entertainment.
5,null,Error : configuration CU : ExtendedSemanticTypeDescriptor.java Line : 75,,Sure  I'd be happy to help. What do you need assistance with?
6,null,Error : configuration CU : ExtendedSemanticTypeDescriptor.java Line : 82,,I'm sorry  but I cannot generate a response without a prompt. Can you please provide more information or ask a specific question?
7,null,Error : configuration CU : ExtendedSemanticTypeDescriptor.java Line : 90,,There are several reasons why people might choose to become a doctor. Some of these reasons include:    1. Desire to help others: Many people are drawn to the medical profession because they have a strong desire to make a positive impact on the lives of others. They want to help people who are sick or injured and improve their quality of life.    2. Intellectual challenge: Medicine is a complex and ever-evolving field that requires constant learning and problem-solving. Many individuals are attracted to the intellectual challenge of diagnosing and treating patients.    3. Job security: Becoming a doctor offers a high level of job security. There will always be a need for healthcare professionals  and doctors are in high demand.    4. Financial stability: Doctors tend to earn high salaries  which can provide financial stability and security. This can be an attractive aspect of the profession for many individuals.    5. Prestige and respect: Being a doctor is often associated with prestige and respect in society. Doctors are seen as knowledgeable experts and are often highly regarded in their communities.    6. Personal fulfillment: For some individuals  the personal fulfillment that comes from helping others and making a difference in people's lives is a major motivator for pursuing a career in medicine.    7. Variety and flexibility: Medicine offers a wide range of specialties and subspecialties  allowing doctors to choose a field that aligns with their interests and passions. This variety and flexibility can be appealing to those who want to explore different areas of medicine.    8. Continuous learning: Medicine is a field that requires lifelong learning and professional development. For individuals who enjoy learning and staying up-to-date with the latest advancements in healthcare  becoming a doctor can be a fulfilling career choice.    9. Opportunities for research and innovation: Doctors have the opportunity to contribute to medical research and innovation. They can be at the forefront of discovering new treatments and technologies that can improve patient outcomes.    10. Personal experience with healthcare: Some individuals are inspired to become doctors because of personal experiences with healthcare. Whether they have had positive or negative experiences  these encounters can shape their desire to pursue a career in medicine.    It's important to note that these reasons can vary from person to person  and many individuals may have multiple motivations for choosing to become a doctor.
8,null,Error : configuration CU : ExtendedSemanticTypeDescriptor.java Line : 108,,There are many reasons why people may want to have a conversation with an AI. Some possible reasons include:    1. Curiosity: People may be interested in exploring the capabilities and limitations of AI technology and want to engage in a conversation to see how well the AI can understand and respond to their queries.    2. Entertainment: Conversing with an AI can be a fun and entertaining experience. AI chatbots can be programmed to have a sense of humor and engage in playful banter  providing a source of amusement for users.    3. Information and assistance: AI chatbots can be designed to provide information and assistance on a wide range of topics. People may want to have a conversation with an AI to get answers to their questions or seek guidance on specific issues.    4. Emotional support: Some AI chatbots are designed to provide emotional support and companionship. People may want to have a conversation with an AI to share their thoughts and feelings  knowing that they will be listened to and understood without judgment.    5. Accessibility: AI chatbots can be a valuable tool for individuals with disabilities or language barriers. People may want to have a conversation with an AI to overcome communication barriers and access information or services that would otherwise be difficult to obtain.    6. Practice and learning: Engaging in conversations with AI chatbots can be a way for people to practice their language skills or learn new languages. AI chatbots can provide feedback and corrections  helping users improve their language proficiency.    Overall  the reasons why people want to have a conversation with an AI can vary greatly depending on their individual needs and interests.
9,Rename class,Error : ExtendedElementTypeConfiguration CU : ExtendedSemanticTypeDescriptor.java Line : 27,The class ExtendedElementTypeConfiguration is generated from  The metaclass ExtendedElementTypeConfiguration which is renamed to ElementTypeConfiguration Coevolve this java code snippet according to the described change  :   /**   * configuration of this descriptor   */ private final ExtendedElementTypeConfiguration configuration    Give the updated java method only,/**    * configuration of this descriptor    */  private final ElementTypeConfiguration configuration 
10,Rename class,Error : ExtendedElementTypeConfiguration CU : ExtendedSemanticTypeDescriptor.java Line : 38,The class ExtendedElementTypeConfiguration is generated from  The metaclass ExtendedElementTypeConfiguration which is renamed to ElementTypeConfiguration Coevolve this java code snippet according to the described change  :   /**   * Constructor.  * @param configuration the configuration of this descriptor  */ public ExtendedSemanticTypeDescriptor(ExtendedElementTypeConfiguration configuration){   this.configuration=configuration  }   Give the updated java method only,/**    * Constructor.   * @param configuration the configuration of this descriptor   */  public SemanticTypeDescriptor(ElementTypeConfiguration configuration){    this.configuration=configuration   }
11,null,,,I'm sorry  I cannot answer that question as it is not clear what you are asking. Please provide more information or ask a specific question.
12,Rename class,Error : ExtendedElementTypeConfiguration CU : ExtendedSemanticTypeDescriptor.java Line : 47,The class ExtendedElementTypeConfiguration is generated from  The metaclass ExtendedElementTypeConfiguration which is renamed to ElementTypeConfiguration Coevolve this java code snippet according to the described change  :   /**   * Returns the configuration of the element type  * @return the configuration of the element type  */ public ExtendedElementTypeConfiguration getConfiguration(){   return configuration  }   Give the updated java method only,/**   * Returns the configuration of the element type   * @return the configuration of the element type   */  public ElementTypeConfiguration getConfiguration(){    return configuration   }
13,null,Error : configuration CU : ExtendedSemanticTypeDescriptor.java Line : 48,,The term "AI" stands for Artificial Intelligence. It refers to the simulation of human intelligence in machines that are programmed to think and learn like humans. AI technology enables machines to perform tasks that typically require human intelligence  such as visual perception  speech recognition  decision-making  and problem-solving. AI can be categorized into two types: narrow AI  which is designed for specific tasks  and general AI  which has the ability to perform any intellectual task that a human being can do. AI has a wide range of applications in various industries  including healthcare  finance  transportation  and entertainment  and it continues to advance and evolve rapidly.
14,Rename class,Error : PostActionConfiguration CU : ExtendedEditHelperAdvice.java Line : 75,The class PostActionConfiguration is generated from  The metaclass PostActionConfiguration which is renamed to SemanticActionConfiguration Coevolve this java code snippet according to the described change  :   /**   * {@inheritDoc}  */ @Override protected ICommand getAfterConfigureCommand(ConfigureRequest request){   CompositeCommand compositeCommand=new CompositeCommand("AfterConfigureCommand")    IElementType type=request.getTypeToConfigure()    if (type instanceof IExtendedHintedElementType) {     IExtendedHintedElementType extendedHintedElementType=(IExtendedHintedElementType)type      ExtendedElementTypeConfiguration configuration=extendedHintedElementType.getConfiguration()      for (    PostActionConfiguration postActionConfiguration : configuration.getPostAction()) {       ICommand command=null        try {         command=ExtendedElementTypeActionService.getInstance().getICommand(request.getElementsToEdit() postActionConfiguration)        }  catch (      ProviderNotFoundException e) {         Activator.log.error(e)        }       if (command != null) {         compositeCommand.add(command)        }     }     if (!compositeCommand.isEmpty()) {       return compositeCommand      }   }   return super.getAfterConfigureCommand(request)  }   Give the updated java method only,/**    * {@inheritDoc}   */  @Override   protected ICommand getAfterConfigureCommand(ConfigureRequest request){    CompositeCommand compositeCommand=new CompositeCommand("AfterConfigureCommand")     IElementType type=request.getTypeToConfigure()     if (type instanceof IExtendedHintedElementType) {      IExtendedHintedElementType extendedHintedElementType=(IExtendedHintedElementType)type       SemanticActionConfiguration configuration=extendedHintedElementType.getConfiguration()       for (SemanticActionConfiguration postActionConfiguration : configuration.getPostAction()) {        ICommand command=null         try {          command=SemanticActionService.getInstance().getICommand(request.getElementsToEdit() postActionConfiguration)         }        catch (ProviderNotFoundException e) {          Activator.log.error(e)         }        if (command != null) {          compositeCommand.add(command)         }      }      if (!compositeCommand.isEmpty()) {        return compositeCommand       }    }    return super.getAfterConfigureCommand(request)   }
15,Rename class,Error : ExtendedElementTypeConfiguration CU : ExtendedEditHelperAdvice.java Line : 74,The class ExtendedElementTypeConfiguration is generated from  The metaclass ExtendedElementTypeConfiguration which is renamed to ElementTypeConfiguration Coevolve this java code snippet according to the described change  :   /**   * {@inheritDoc}  */ @Override protected ICommand getAfterConfigureCommand(ConfigureRequest request){   CompositeCommand compositeCommand=new CompositeCommand("AfterConfigureCommand")    IElementType type=request.getTypeToConfigure()    if (type instanceof IExtendedHintedElementType) {     IExtendedHintedElementType extendedHintedElementType=(IExtendedHintedElementType)type      ExtendedElementTypeConfiguration configuration=extendedHintedElementType.getConfiguration()      for (    PostActionConfiguration postActionConfiguration : configuration.getPostAction()) {       ICommand command=null        try {         command=ExtendedElementTypeActionService.getInstance().getICommand(request.getElementsToEdit() postActionConfiguration)        }  catch (      ProviderNotFoundException e) {         Activator.log.error(e)        }       if (command != null) {         compositeCommand.add(command)        }     }     if (!compositeCommand.isEmpty()) {       return compositeCommand      }   }   return super.getAfterConfigureCommand(request)  }   Give the updated java method only,@Override  protected ICommand getAfterConfigureCommand(ConfigureRequest request) {      CompositeCommand compositeCommand = new CompositeCommand("AfterConfigureCommand")       IElementType type = request.getTypeToConfigure()       if (type instanceof IExtendedHintedElementType) {          IExtendedHintedElementType extendedHintedElementType = (IExtendedHintedElementType) type           ElementTypeConfiguration configuration = extendedHintedElementType.getConfiguration()           for (PostActionConfiguration postActionConfiguration : configuration.getPostAction()) {              ICommand command = null               try {                  command = ElementTypeActionService.getInstance().getICommand(request.getElementsToEdit()  postActionConfiguration)               } catch (ProviderNotFoundException e) {                  Activator.log.error(e)               }              if (command != null) {                  compositeCommand.add(command)               }          }          if (!compositeCommand.isEmpty()) {              return compositeCommand           }      }      return super.getAfterConfigureCommand(request)   }
16,null,Error : getConfiguration CU : ExtendedEditHelperAdvice.java Line : 74,,There are several reasons why people may choose to become police officers:    1. Desire to serve and protect: Many individuals are driven by a strong sense of duty and a desire to make a positive impact in their communities. Becoming a police officer allows them to serve and protect their fellow citizens.    2. Sense of justice: Police officers play a crucial role in upholding the law and ensuring that justice is served. Some people are motivated by a strong belief in fairness and equality and want to contribute to maintaining a just society.    3. Job security: Law enforcement careers often offer stability and job security. Police officers typically have access to benefits such as healthcare  retirement plans  and opportunities for advancement within the department.    4. Excitement and variety: Police work can be unpredictable and varied. Some individuals are drawn to the excitement and adrenaline rush that comes with responding to emergencies  investigating crimes  and working in a dynamic environment.    5. Desire for a challenging career: Police work can be mentally and physically demanding  which can be appealing to individuals who are seeking a challenging and fulfilling career. The constantly changing nature of the job can provide opportunities for personal growth and development.    6. Respect and authority: Police officers are often respected members of the community and are seen as authority figures. For some individuals  the opportunity to have a position of authority and command respect is a motivating factor in pursuing a career in law enforcement.    7. Strong sense of teamwork: Police work often involves collaboration and teamwork. Many individuals are attracted to the camaraderie and sense of belonging that comes with being part of a close-knit team working towards a common goal.    8. Desire to make a difference: Police officers have the opportunity to make a positive difference in people's lives. Whether it is by preventing crime  assisting victims  or providing support to those in need  many individuals are driven by the desire to help others and contribute to the well-being of their community.    It is important to note that these reasons can vary from person to person  and individuals may have multiple motivations for pursuing a career in law enforcement.
17,Rename Class ,Error : PostActionConfiguration CU : ExtendedTypesOwnerAdvice.java Line : 28,The class PostActionConfiguration is generated from  The metaclass which PostActionConfiguration is renamed to SemanticActionConfiguration Coevolve this java code snippet according to the described change  :   import org.eclipse.papyrus.infra.extendedtypes.ExtendedElementTypeConfiguration  import org.eclipse.papyrus.infra.extendedtypes.PostActionConfiguration  import org.eclipse.papyrus.infra.extendedtypes.providers.ExtendedElementTypeActionService    Give the updated java method only,import org.eclipse.papyrus.infra.extendedtypes.ExtendedElementTypeConfiguration   import org.eclipse.papyrus.infra.extendedtypes.SemanticActionConfiguration   import org.eclipse.papyrus.infra.extendedtypes.providers.ExtendedElementTypeActionService     // Updated method  public void updatePostActionConfiguration(ExtendedElementTypeConfiguration configuration) {      // Get the current post action configuration      PostActionConfiguration postActionConfig = configuration.getPostActionConfiguration()         // Check if the post action configuration is an instance of PostActionConfiguration      if (postActionConfig instanceof PostActionConfiguration) {          // Rename the post action configuration to SemanticActionConfiguration          SemanticActionConfiguration semanticActionConfig = new SemanticActionConfiguration()                     // Set the properties of the semantic action configuration          semanticActionConfig.setPostActionClass(postActionConfig.getPostActionClass())           semanticActionConfig.setPrecondition(postActionConfig.getPrecondition())           semanticActionConfig.setKind(postActionConfig.getKind())                     // Set the semantic action configuration to the extended element type configuration          configuration.setPostActionConfiguration(semanticActionConfig)       }  }
18,Rename class,Error : ExtendedElementTypeConfiguration CU : ExtendedTypesOwnerAdvice.java Line : 52,The class ExtendedElementTypeConfiguration is generated from  The metaclass ExtendedElementTypeConfiguration which is renamed to ElementTypeConfiguration Coevolve this java code snippet according to the described change  :   /**   * {@inheritDoc}  */ @Override protected ICommand getBeforeCreateCommand(CreateElementRequest request){   IElementType typeToCreate=request.getElementType()    if (typeToCreate instanceof IExtendedHintedElementType) {     ExtendedElementTypeConfiguration configuration=((IExtendedHintedElementType)typeToCreate).getConfiguration()      List<QueryConfiguration> queryConfigurations=configuration.getPreValidation()      if (queryConfigurations == null || queryConfigurations.isEmpty()) {       return super.getBeforeCreateCommand(request)      }     for (    Object objectToEdit : request.getElementsToEdit()) {       for (      QueryConfiguration queryConfiguration : queryConfigurations) {         try {           boolean result=QueryUtil.evaluateBooleanQuery((EObject)objectToEdit queryConfiguration)            if (!result) {             return UnexecutableCommand.INSTANCE            }         }  catch (        Exception e) {           Activator.log.error(e)          }       }     }     CompositeCommand compositeCommand=new CompositeCommand("PreValidationPostAction")      for (    PostActionConfiguration postActionConfiguration : configuration.getPostAction()) {       ICommand command=null        try {         command=ExtendedElementTypeActionService.getInstance().getPreValidationCommand(request.getElementsToEdit() postActionConfiguration)        }  catch (      ProviderNotFoundException e) {         Activator.log.error(e)        }       if (command != null) {         compositeCommand.add(command)        }     }     ICommand superCommand=super.getBeforeCreateCommand(request)      if (superCommand != null) {       compositeCommand.compose(superCommand)      }     if (!compositeCommand.isEmpty()) {       return compositeCommand      }     return super.getBeforeCreateCommand(request)    }   return super.getBeforeCreateCommand(request)  }   Give the updated java method only,/**    * {@inheritDoc}   */  @Override protected ICommand getBeforeCreateCommand(CreateElementRequest request){    IElementType typeToCreate=request.getElementType()     if (typeToCreate instanceof IExtendedHintedElementType) {      ElementTypeConfiguration configuration=((IExtendedHintedElementType)typeToCreate).getConfiguration()       List<QueryConfiguration> queryConfigurations=configuration.getPreValidation()       if (queryConfigurations == null || queryConfigurations.isEmpty()) {        return super.getBeforeCreateCommand(request)       }      for (Object objectToEdit : request.getElementsToEdit()) {        for (QueryConfiguration queryConfiguration : queryConfigurations) {          try {            boolean result=QueryUtil.evaluateBooleanQuery((EObject)objectToEdit queryConfiguration)             if (!result) {              return UnexecutableCommand.INSTANCE             }          }          catch (Exception e) {            Activator.log.error(e)           }        }      }      CompositeCommand compositeCommand=new CompositeCommand("PreValidationPostAction")       for (PostActionConfiguration postActionConfiguration : configuration.getPostAction()) {        ICommand command=null         try {          command=ElementTypeActionService.getInstance().getPreValidationCommand(request.getElementsToEdit() postActionConfiguration)         }        catch (ProviderNotFoundException e) {          Activator.log.error(e)         }        if (command != null) {          compositeCommand.add(command)         }      }      ICommand superCommand=super.getBeforeCreateCommand(request)       if (superCommand != null) {        compositeCommand.compose(superCommand)       }      if (!compositeCommand.isEmpty()) {        return compositeCommand       }      return super.getBeforeCreateCommand(request)     }    return super.getBeforeCreateCommand(request)   }
