18,Extract property,Error : DISCOVERY__MAX_USED_MEMORY_IN_BYTES CU : CDOProjectDiscoveryImpl.java Line : 802,The literal DISCOVERY__MAX_USED_MEMORY_IN_BYTES is generated by combining the literal of the source class and the literal of the attribute  The attribute maxUsedMemoryInBytes is moved from the class Discovery to the class DiscoveryIteration through the reference iterations Coevolve this java code snippet according to the described change  :   /**   * <!-- begin-user-doc --> <!-- end-user-doc -->  * @generated  */ @Override public int eBaseStructuralFeatureID(int derivedFeatureID Class<?> baseClass){   if (baseClass == Discovery.class) { switch (derivedFeatureID) { case JavaBenchmarkPackage.CDO_PROJECT_DISCOVERY__DICOVERY_DATE:      return BenchmarkPackage.DISCOVERY__DICOVERY_DATE  case JavaBenchmarkPackage.CDO_PROJECT_DISCOVERY__ALGORITHM_VARIANT:    return BenchmarkPackage.DISCOVERY__ALGORITHM_VARIANT  case JavaBenchmarkPackage.CDO_PROJECT_DISCOVERY__DISCOVERER_ID:  return BenchmarkPackage.DISCOVERY__DISCOVERER_ID  case JavaBenchmarkPackage.CDO_PROJECT_DISCOVERY__DISCOVERER_CLASS_NAME:return BenchmarkPackage.DISCOVERY__DISCOVERER_CLASS_NAME  case JavaBenchmarkPackage.CDO_PROJECT_DISCOVERY__SAVE_TIME_IN_SECONDS:return BenchmarkPackage.DISCOVERY__SAVE_TIME_IN_SECONDS  case JavaBenchmarkPackage.CDO_PROJECT_DISCOVERY__TOTAL_EXECUTION_TIME_IN_SECONDS:return BenchmarkPackage.DISCOVERY__TOTAL_EXECUTION_TIME_IN_SECONDS  case JavaBenchmarkPackage.CDO_PROJECT_DISCOVERY__META_MODEL_VARIANT:return BenchmarkPackage.DISCOVERY__META_MODEL_VARIANT  case JavaBenchmarkPackage.CDO_PROJECT_DISCOVERY__MAX_USED_MEMORY_IN_BYTES:return BenchmarkPackage.DISCOVERY__MAX_USED_MEMORY_IN_BYTES  case JavaBenchmarkPackage.CDO_PROJECT_DISCOVERY__NUMBER_OF_MODEL_ELEMENTS:return BenchmarkPackage.DISCOVERY__NUMBER_OF_MODEL_ELEMENTS  case JavaBenchmarkPackage.CDO_PROJECT_DISCOVERY__XMI_SIZE_IN_BYTES:return BenchmarkPackage.DISCOVERY__XMI_SIZE_IN_BYTES  case JavaBenchmarkPackage.CDO_PROJECT_DISCOVERY__NAME:return BenchmarkPackage.DISCOVERY__NAME  case JavaBenchmarkPackage.CDO_PROJECT_DISCOVERY__DISCOVERY_ERROR:return BenchmarkPackage.DISCOVERY__DISCOVERY_ERROR  default:return -1  } } if (baseClass == ProjectDiscovery.class) { switch (derivedFeatureID) { case JavaBenchmarkPackage.CDO_PROJECT_DISCOVERY__PROJECTS:return BenchmarkPackage.PROJECT_DISCOVERY__PROJECTS  default:return -1  } } return super.eBaseStructuralFeatureID(derivedFeatureID baseClass)  }   Give the updated java method only,@Override   public int eBaseStructuralFeatureID(int derivedFeatureID  Class<?> baseClass) {    if (baseClass == DiscoveryIteration.class) {      switch (derivedFeatureID) {        case JavaBenchmarkPackage.CDO_PROJECT_DISCOVERY__DICOVERY_DATE:                return BenchmarkPackage.DISCOVERY_ITERATION__DICOVERY_DATE         case JavaBenchmarkPackage.CDO_PROJECT_DISCOVERY__ALGORITHM_VARIANT:              return BenchmarkPackage.DISCOVERY_ITERATION__ALGORITHM_VARIANT         case JavaBenchmarkPackage.CDO_PROJECT_DISCOVERY__DISCOVERER_ID:            return BenchmarkPackage.DISCOVERY_ITERATION__DISCOVERER_ID         case JavaBenchmarkPackage.CDO_PROJECT_DISCOVERY__DISCOVERER_CLASS_NAME:          return BenchmarkPackage.DISCOVERY_ITERATION__DISCOVERER_CLASS_NAME         case JavaBenchmarkPackage.CDO_PROJECT_DISCOVERY__SAVE_TIME_IN_SECONDS:          return BenchmarkPackage.DISCOVERY_ITERATION__SAVE_TIME_IN_SECONDS         case JavaBenchmarkPackage.CDO_PROJECT_DISCOVERY__TOTAL_EXECUTION_TIME_IN_SECONDS:          return BenchmarkPackage.DISCOVERY_ITERATION__TOTAL_EXECUTION_TIME_IN_SECONDS         case JavaBenchmarkPackage.CDO_PROJECT_DISCOVERY__META_MODEL_VARIANT:          return BenchmarkPackage.DISCOVERY_ITERATION__META_MODEL_VARIANT         case JavaBenchmarkPackage.CDO_PROJECT_DISCOVERY__MAX_USED_MEMORY_IN_BYTES:          return BenchmarkPackage.DISCOVERY_ITERATION__MAX_USED_MEMORY_IN_BYTES         case JavaBenchmarkPackage.CDO_PROJECT_DISCOVERY__NUMBER_OF_MODEL_ELEMENTS:          return BenchmarkPackage.DISCOVERY_ITERATION__NUMBER_OF_MODEL_ELEMENTS         case JavaBenchmarkPackage.CDO_PROJECT_DISCOVERY__XMI_SIZE_IN_BYTES:          return BenchmarkPackage.DISCOVERY_ITERATION__XMI_SIZE_IN_BYTES         case JavaBenchmarkPackage.CDO_PROJECT_DISCOVERY__NAME:          return BenchmarkPackage.DISCOVERY_ITERATION__NAME         case JavaBenchmarkPackage.CDO_PROJECT_DISCOVERY__DISCOVERY_ERROR:          return BenchmarkPackage.DISCOVERY_ITERATION__DISCOVERY_ERROR         default:          return -1       }    }    if (baseClass == ProjectDiscovery.class) {      switch (derivedFeatureID) {        case JavaBenchmarkPackage.CDO_PROJECT_DISCOVERY__PROJECTS:          return BenchmarkPackage.PROJECT_DISCOVERY__PROJECTS         default:          return -1       }    }    return super.eBaseStructuralFeatureID(derivedFeatureID  baseClass)   }
19,Extract property,Error : DISCOVERY__DISCOVERY_ERROR CU : CDOProjectDiscoveryImpl.java Line : 806,The literal DISCOVERY__DISCOVERY_ERROR is generated by combining the literal of the source class and the literal of the attribute  The attribute discoveryError is moved from the class Discovery to the class DiscoveryIteration through the reference iterations Coevolve this java code snippet according to the described change  :   /**   * <!-- begin-user-doc --> <!-- end-user-doc -->  * @generated  */ @Override public int eBaseStructuralFeatureID(int derivedFeatureID Class<?> baseClass){   if (baseClass == Discovery.class) { switch (derivedFeatureID) { case JavaBenchmarkPackage.CDO_PROJECT_DISCOVERY__DICOVERY_DATE:      return BenchmarkPackage.DISCOVERY__DICOVERY_DATE  case JavaBenchmarkPackage.CDO_PROJECT_DISCOVERY__ALGORITHM_VARIANT:    return BenchmarkPackage.DISCOVERY__ALGORITHM_VARIANT  case JavaBenchmarkPackage.CDO_PROJECT_DISCOVERY__DISCOVERER_ID:  return BenchmarkPackage.DISCOVERY__DISCOVERER_ID  case JavaBenchmarkPackage.CDO_PROJECT_DISCOVERY__DISCOVERER_CLASS_NAME:return BenchmarkPackage.DISCOVERY__DISCOVERER_CLASS_NAME  case JavaBenchmarkPackage.CDO_PROJECT_DISCOVERY__SAVE_TIME_IN_SECONDS:return BenchmarkPackage.DISCOVERY__SAVE_TIME_IN_SECONDS  case JavaBenchmarkPackage.CDO_PROJECT_DISCOVERY__TOTAL_EXECUTION_TIME_IN_SECONDS:return BenchmarkPackage.DISCOVERY__TOTAL_EXECUTION_TIME_IN_SECONDS  case JavaBenchmarkPackage.CDO_PROJECT_DISCOVERY__META_MODEL_VARIANT:return BenchmarkPackage.DISCOVERY__META_MODEL_VARIANT  case JavaBenchmarkPackage.CDO_PROJECT_DISCOVERY__MAX_USED_MEMORY_IN_BYTES:return BenchmarkPackage.DISCOVERY__MAX_USED_MEMORY_IN_BYTES  case JavaBenchmarkPackage.CDO_PROJECT_DISCOVERY__NUMBER_OF_MODEL_ELEMENTS:return BenchmarkPackage.DISCOVERY__NUMBER_OF_MODEL_ELEMENTS  case JavaBenchmarkPackage.CDO_PROJECT_DISCOVERY__XMI_SIZE_IN_BYTES:return BenchmarkPackage.DISCOVERY__XMI_SIZE_IN_BYTES  case JavaBenchmarkPackage.CDO_PROJECT_DISCOVERY__NAME:return BenchmarkPackage.DISCOVERY__NAME  case JavaBenchmarkPackage.CDO_PROJECT_DISCOVERY__DISCOVERY_ERROR:return BenchmarkPackage.DISCOVERY__DISCOVERY_ERROR  default:return -1  } } if (baseClass == ProjectDiscovery.class) { switch (derivedFeatureID) { case JavaBenchmarkPackage.CDO_PROJECT_DISCOVERY__PROJECTS:return BenchmarkPackage.PROJECT_DISCOVERY__PROJECTS  default:return -1  } } return super.eBaseStructuralFeatureID(derivedFeatureID baseClass)  }   Give the updated java method only,@Override  public int eBaseStructuralFeatureID(int derivedFeatureID  Class<?> baseClass) {    if (baseClass == Discovery.class) {      switch (derivedFeatureID) {        case JavaBenchmarkPackage.CDO_PROJECT_DISCOVERY__DICOVERY_DATE:          return BenchmarkPackage.DISCOVERY__DICOVERY_DATE         case JavaBenchmarkPackage.CDO_PROJECT_DISCOVERY__ALGORITHM_VARIANT:          return BenchmarkPackage.DISCOVERY__ALGORITHM_VARIANT         case JavaBenchmarkPackage.CDO_PROJECT_DISCOVERY__DISCOVERER_ID:          return BenchmarkPackage.DISCOVERY__DISCOVERER_ID         case JavaBenchmarkPackage.CDO_PROJECT_DISCOVERY__DISCOVERER_CLASS_NAME:          return BenchmarkPackage.DISCOVERY__DISCOVERER_CLASS_NAME         case JavaBenchmarkPackage.CDO_PROJECT_DISCOVERY__SAVE_TIME_IN_SECONDS:          return BenchmarkPackage.DISCOVERY__SAVE_TIME_IN_SECONDS         case JavaBenchmarkPackage.CDO_PROJECT_DISCOVERY__TOTAL_EXECUTION_TIME_IN_SECONDS:          return BenchmarkPackage.DISCOVERY__TOTAL_EXECUTION_TIME_IN_SECONDS         case JavaBenchmarkPackage.CDO_PROJECT_DISCOVERY__META_MODEL_VARIANT:          return BenchmarkPackage.DISCOVERY__META_MODEL_VARIANT         case JavaBenchmarkPackage.CDO_PROJECT_DISCOVERY__MAX_USED_MEMORY_IN_BYTES:          return BenchmarkPackage.DISCOVERY__MAX_USED_MEMORY_IN_BYTES         case JavaBenchmarkPackage.CDO_PROJECT_DISCOVERY__NUMBER_OF_MODEL_ELEMENTS:          return BenchmarkPackage.DISCOVERY__NUMBER_OF_MODEL_ELEMENTS         case JavaBenchmarkPackage.CDO_PROJECT_DISCOVERY__XMI_SIZE_IN_BYTES:          return BenchmarkPackage.DISCOVERY__XMI_SIZE_IN_BYTES         case JavaBenchmarkPackage.CDO_PROJECT_DISCOVERY__NAME:          return BenchmarkPackage.DISCOVERY__NAME         case JavaBenchmarkPackage.CDO_PROJECT_DISCOVERY__DISCOVERY_ERROR:          return BenchmarkPackage.DISCOVERY_ITERATION__DISCOVERY_ERROR         default:          return -1       }    }    if (baseClass == ProjectDiscovery.class) {      switch (derivedFeatureID) {        case JavaBenchmarkPackage.CDO_PROJECT_DISCOVERY__PROJECTS:          return BenchmarkPackage.PROJECT_DISCOVERY__PROJECTS         default:          return -1       }    }    return super.eBaseStructuralFeatureID(derivedFeatureID  baseClass)   }
20,Delete Class ,Error : ProjectDiscovery CU : CDOProjectDiscoveryImpl.java Line : 810,Considering a metaclass called ProjectDiscovery The class ProjectDiscovery is generated from this metaclass. Here is a change: the metaclass ProjectDiscovery is removed with all the generated classes and properties are removed.  Coevolve this java code snippet according to the described change  :   /**   * <!-- begin-user-doc --> <!-- end-user-doc -->  * @generated  */ @Override public int eBaseStructuralFeatureID(int derivedFeatureID Class<?> baseClass){   if (baseClass == Discovery.class) { switch (derivedFeatureID) { case JavaBenchmarkPackage.CDO_PROJECT_DISCOVERY__DICOVERY_DATE:      return BenchmarkPackage.DISCOVERY__DICOVERY_DATE  case JavaBenchmarkPackage.CDO_PROJECT_DISCOVERY__ALGORITHM_VARIANT:    return BenchmarkPackage.DISCOVERY__ALGORITHM_VARIANT  case JavaBenchmarkPackage.CDO_PROJECT_DISCOVERY__DISCOVERER_ID:  return BenchmarkPackage.DISCOVERY__DISCOVERER_ID  case JavaBenchmarkPackage.CDO_PROJECT_DISCOVERY__DISCOVERER_CLASS_NAME:return BenchmarkPackage.DISCOVERY__DISCOVERER_CLASS_NAME  case JavaBenchmarkPackage.CDO_PROJECT_DISCOVERY__SAVE_TIME_IN_SECONDS:return BenchmarkPackage.DISCOVERY__SAVE_TIME_IN_SECONDS  case JavaBenchmarkPackage.CDO_PROJECT_DISCOVERY__TOTAL_EXECUTION_TIME_IN_SECONDS:return BenchmarkPackage.DISCOVERY__TOTAL_EXECUTION_TIME_IN_SECONDS  case JavaBenchmarkPackage.CDO_PROJECT_DISCOVERY__META_MODEL_VARIANT:return BenchmarkPackage.DISCOVERY__META_MODEL_VARIANT  case JavaBenchmarkPackage.CDO_PROJECT_DISCOVERY__MAX_USED_MEMORY_IN_BYTES:return BenchmarkPackage.DISCOVERY__MAX_USED_MEMORY_IN_BYTES  case JavaBenchmarkPackage.CDO_PROJECT_DISCOVERY__NUMBER_OF_MODEL_ELEMENTS:return BenchmarkPackage.DISCOVERY__NUMBER_OF_MODEL_ELEMENTS  case JavaBenchmarkPackage.CDO_PROJECT_DISCOVERY__XMI_SIZE_IN_BYTES:return BenchmarkPackage.DISCOVERY__XMI_SIZE_IN_BYTES  case JavaBenchmarkPackage.CDO_PROJECT_DISCOVERY__NAME:return BenchmarkPackage.DISCOVERY__NAME  case JavaBenchmarkPackage.CDO_PROJECT_DISCOVERY__DISCOVERY_ERROR:return BenchmarkPackage.DISCOVERY__DISCOVERY_ERROR  default:return -1  } } if (baseClass == ProjectDiscovery.class) { switch (derivedFeatureID) { case JavaBenchmarkPackage.CDO_PROJECT_DISCOVERY__PROJECTS:return BenchmarkPackage.PROJECT_DISCOVERY__PROJECTS  default:return -1  } } return super.eBaseStructuralFeatureID(derivedFeatureID baseClass)  }   Give the updated java method only,@Override   public int eBaseStructuralFeatureID(int derivedFeatureID  Class<?> baseClass) {    if (baseClass == Discovery.class) {      switch (derivedFeatureID) {        case JavaBenchmarkPackage.CDO_PROJECT_DISCOVERY__DICOVERY_DATE: return BenchmarkPackage.DISCOVERY__DICOVERY_DATE         case JavaBenchmarkPackage.CDO_PROJECT_DISCOVERY__ALGORITHM_VARIANT: return BenchmarkPackage.DISCOVERY__ALGORITHM_VARIANT         case JavaBenchmarkPackage.CDO_PROJECT_DISCOVERY__DISCOVERER_ID: return BenchmarkPackage.DISCOVERY__DISCOVERER_ID         case JavaBenchmarkPackage.CDO_PROJECT_DISCOVERY__DISCOVERER_CLASS_NAME: return BenchmarkPackage.DISCOVERY__DISCOVERER_CLASS_NAME         case JavaBenchmarkPackage.CDO_PROJECT_DISCOVERY__SAVE_TIME_IN_SECONDS: return BenchmarkPackage.DISCOVERY__SAVE_TIME_IN_SECONDS         case JavaBenchmarkPackage.CDO_PROJECT_DISCOVERY__TOTAL_EXECUTION_TIME_IN_SECONDS: return BenchmarkPackage.DISCOVERY__TOTAL_EXECUTION_TIME_IN_SECONDS         case JavaBenchmarkPackage.CDO_PROJECT_DISCOVERY__META_MODEL_VARIANT: return BenchmarkPackage.DISCOVERY__META_MODEL_VARIANT         case JavaBenchmarkPackage.CDO_PROJECT_DISCOVERY__MAX_USED_MEMORY_IN_BYTES: return BenchmarkPackage.DISCOVERY__MAX_USED_MEMORY_IN_BYTES         case JavaBenchmarkPackage.CDO_PROJECT_DISCOVERY__NUMBER_OF_MODEL_ELEMENTS: return BenchmarkPackage.DISCOVERY__NUMBER_OF_MODEL_ELEMENTS         case JavaBenchmarkPackage.CDO_PROJECT_DISCOVERY__XMI_SIZE_IN_BYTES: return BenchmarkPackage.DISCOVERY__XMI_SIZE_IN_BYTES         case JavaBenchmarkPackage.CDO_PROJECT_DISCOVERY__NAME: return BenchmarkPackage.DISCOVERY__NAME         case JavaBenchmarkPackage.CDO_PROJECT_DISCOVERY__DISCOVERY_ERROR: return BenchmarkPackage.DISCOVERY__DISCOVERY_ERROR         default: return -1       }    }    if (baseClass == ProjectDiscovery.class) {      switch (derivedFeatureID) {        case JavaBenchmarkPackage.CDO_PROJECT_DISCOVERY__PROJECTS: return -1  // Remove this line        default: return -1       }    }    return super.eBaseStructuralFeatureID(derivedFeatureID  baseClass)   }
21,Extract property,Error : PROJECT_DISCOVERY__PROJECTS CU : CDOProjectDiscoveryImpl.java Line : 812,,I'm sorry  I cannot continue the text for you as I am an AI language model and I do not have access to your thoughts or ideas. However  if you provide me with some information or a specific topic  I can try to help you generate a text based on that.
22,Extract property,Error : DISCOVERY__DICOVERY_DATE CU : CDOProjectDiscoveryImpl.java Line : 828,The literal DISCOVERY__DICOVERY_DATE is generated by combining the literal of the source class and the literal of the attribute  The attribute dicoveryDate is moved from the class Discovery to the class DiscoveryIteration through the reference iterations Coevolve this java code snippet according to the described change  :   /**   * <!-- begin-user-doc --> <!-- end-user-doc -->  * @generated  */ @Override public int eDerivedStructuralFeatureID(int baseFeatureID Class<?> baseClass){   if (baseClass == Discovery.class) { switch (baseFeatureID) { case BenchmarkPackage.DISCOVERY__DICOVERY_DATE:      return JavaBenchmarkPackage.CDO_PROJECT_DISCOVERY__DICOVERY_DATE  case BenchmarkPackage.DISCOVERY__ALGORITHM_VARIANT:    return JavaBenchmarkPackage.CDO_PROJECT_DISCOVERY__ALGORITHM_VARIANT  case BenchmarkPackage.DISCOVERY__DISCOVERER_ID:  return JavaBenchmarkPackage.CDO_PROJECT_DISCOVERY__DISCOVERER_ID  case BenchmarkPackage.DISCOVERY__DISCOVERER_CLASS_NAME:return JavaBenchmarkPackage.CDO_PROJECT_DISCOVERY__DISCOVERER_CLASS_NAME  case BenchmarkPackage.DISCOVERY__SAVE_TIME_IN_SECONDS:return JavaBenchmarkPackage.CDO_PROJECT_DISCOVERY__SAVE_TIME_IN_SECONDS  case BenchmarkPackage.DISCOVERY__TOTAL_EXECUTION_TIME_IN_SECONDS:return JavaBenchmarkPackage.CDO_PROJECT_DISCOVERY__TOTAL_EXECUTION_TIME_IN_SECONDS  case BenchmarkPackage.DISCOVERY__META_MODEL_VARIANT:return JavaBenchmarkPackage.CDO_PROJECT_DISCOVERY__META_MODEL_VARIANT  case BenchmarkPackage.DISCOVERY__MAX_USED_MEMORY_IN_BYTES:return JavaBenchmarkPackage.CDO_PROJECT_DISCOVERY__MAX_USED_MEMORY_IN_BYTES  case BenchmarkPackage.DISCOVERY__NUMBER_OF_MODEL_ELEMENTS:return JavaBenchmarkPackage.CDO_PROJECT_DISCOVERY__NUMBER_OF_MODEL_ELEMENTS  case BenchmarkPackage.DISCOVERY__XMI_SIZE_IN_BYTES:return JavaBenchmarkPackage.CDO_PROJECT_DISCOVERY__XMI_SIZE_IN_BYTES  case BenchmarkPackage.DISCOVERY__NAME:return JavaBenchmarkPackage.CDO_PROJECT_DISCOVERY__NAME  case BenchmarkPackage.DISCOVERY__DISCOVERY_ERROR:return JavaBenchmarkPackage.CDO_PROJECT_DISCOVERY__DISCOVERY_ERROR  default:return -1  } } if (baseClass == ProjectDiscovery.class) { switch (baseFeatureID) { case BenchmarkPackage.PROJECT_DISCOVERY__PROJECTS:return JavaBenchmarkPackage.CDO_PROJECT_DISCOVERY__PROJECTS  default:return -1  } } return super.eDerivedStructuralFeatureID(baseFeatureID baseClass)  }   Give the updated java method only,@Override  public int eDerivedStructuralFeatureID(int baseFeatureID  Class<?> baseClass) {      if (baseClass == DiscoveryIteration.class) {          switch (baseFeatureID) {              case BenchmarkPackage.DISCOVERY__DICOVERY_DATE:                  return JavaBenchmarkPackage.DISCOVERY_ITERATION__DICOVERY_DATE               default:                  return -1           }      }      return super.eDerivedStructuralFeatureID(baseFeatureID  baseClass)   }
23,Extract property,Error : DISCOVERY__ALGORITHM_VARIANT CU : CDOProjectDiscoveryImpl.java Line : 829,,I'm sorry  I cannot continue the text for you as I am an AI language model and I do not have access to personal information or the ability to continue someone else's writing.
24,Extract property,Error : DISCOVERY__SAVE_TIME_IN_SECONDS CU : CDOProjectDiscoveryImpl.java Line : 832,The literal DISCOVERY__SAVE_TIME_IN_SECONDS is generated by combining the literal of the source class and the literal of the attribute  The attribute saveTimeInSeconds is moved from the class Discovery to the class DiscoveryIteration through the reference iterations Coevolve this java code snippet according to the described change  :   /**   * <!-- begin-user-doc --> <!-- end-user-doc -->  * @generated  */ @Override public int eDerivedStructuralFeatureID(int baseFeatureID Class<?> baseClass){   if (baseClass == Discovery.class) { switch (baseFeatureID) { case BenchmarkPackage.DISCOVERY__DICOVERY_DATE:      return JavaBenchmarkPackage.CDO_PROJECT_DISCOVERY__DICOVERY_DATE  case BenchmarkPackage.DISCOVERY__ALGORITHM_VARIANT:    return JavaBenchmarkPackage.CDO_PROJECT_DISCOVERY__ALGORITHM_VARIANT  case BenchmarkPackage.DISCOVERY__DISCOVERER_ID:  return JavaBenchmarkPackage.CDO_PROJECT_DISCOVERY__DISCOVERER_ID  case BenchmarkPackage.DISCOVERY__DISCOVERER_CLASS_NAME:return JavaBenchmarkPackage.CDO_PROJECT_DISCOVERY__DISCOVERER_CLASS_NAME  case BenchmarkPackage.DISCOVERY__SAVE_TIME_IN_SECONDS:return JavaBenchmarkPackage.CDO_PROJECT_DISCOVERY__SAVE_TIME_IN_SECONDS  case BenchmarkPackage.DISCOVERY__TOTAL_EXECUTION_TIME_IN_SECONDS:return JavaBenchmarkPackage.CDO_PROJECT_DISCOVERY__TOTAL_EXECUTION_TIME_IN_SECONDS  case BenchmarkPackage.DISCOVERY__META_MODEL_VARIANT:return JavaBenchmarkPackage.CDO_PROJECT_DISCOVERY__META_MODEL_VARIANT  case BenchmarkPackage.DISCOVERY__MAX_USED_MEMORY_IN_BYTES:return JavaBenchmarkPackage.CDO_PROJECT_DISCOVERY__MAX_USED_MEMORY_IN_BYTES  case BenchmarkPackage.DISCOVERY__NUMBER_OF_MODEL_ELEMENTS:return JavaBenchmarkPackage.CDO_PROJECT_DISCOVERY__NUMBER_OF_MODEL_ELEMENTS  case BenchmarkPackage.DISCOVERY__XMI_SIZE_IN_BYTES:return JavaBenchmarkPackage.CDO_PROJECT_DISCOVERY__XMI_SIZE_IN_BYTES  case BenchmarkPackage.DISCOVERY__NAME:return JavaBenchmarkPackage.CDO_PROJECT_DISCOVERY__NAME  case BenchmarkPackage.DISCOVERY__DISCOVERY_ERROR:return JavaBenchmarkPackage.CDO_PROJECT_DISCOVERY__DISCOVERY_ERROR  default:return -1  } } if (baseClass == ProjectDiscovery.class) { switch (baseFeatureID) { case BenchmarkPackage.PROJECT_DISCOVERY__PROJECTS:return JavaBenchmarkPackage.CDO_PROJECT_DISCOVERY__PROJECTS  default:return -1  } } return super.eDerivedStructuralFeatureID(baseFeatureID baseClass)  }   Give the updated java method only,/**    * <!-- begin-user-doc --> <!-- end-user-doc -->   * @generated   */  @Override   public int eDerivedStructuralFeatureID(int baseFeatureID  Class<?> baseClass) {    if (baseClass == DiscoveryIteration.class) {      switch (baseFeatureID) {        case BenchmarkPackage.DISCOVERY__DICOVERY_DATE: return JavaBenchmarkPackage.CDO_PROJECT_DISCOVERY_ITERATION__DICOVERY_DATE         case BenchmarkPackage.DISCOVERY__ALGORITHM_VARIANT: return JavaBenchmarkPackage.CDO_PROJECT_DISCOVERY_ITERATION__ALGORITHM_VARIANT         case BenchmarkPackage.DISCOVERY__DISCOVERER_ID: return JavaBenchmarkPackage.CDO_PROJECT_DISCOVERY_ITERATION__DISCOVERER_ID         case BenchmarkPackage.DISCOVERY__DISCOVERER_CLASS_NAME: return JavaBenchmarkPackage.CDO_PROJECT_DISCOVERY_ITERATION__DISCOVERER_CLASS_NAME         case BenchmarkPackage.DISCOVERY__TOTAL_EXECUTION_TIME_IN_SECONDS: return JavaBenchmarkPackage.CDO_PROJECT_DISCOVERY_ITERATION__TOTAL_EXECUTION_TIME_IN_SECONDS         case BenchmarkPackage.DISCOVERY__META_MODEL_VARIANT: return JavaBenchmarkPackage.CDO_PROJECT_DISCOVERY_ITERATION__META_MODEL_VARIANT         case BenchmarkPackage.DISCOVERY__MAX_USED_MEMORY_IN_BYTES: return JavaBenchmarkPackage.CDO_PROJECT_DISCOVERY_ITERATION__MAX_USED_MEMORY_IN_BYTES         case BenchmarkPackage.DISCOVERY__NUMBER_OF_MODEL_ELEMENTS: return JavaBenchmarkPackage.CDO_PROJECT_DISCOVERY_ITERATION__NUMBER_OF_MODEL_ELEMENTS         case BenchmarkPackage.DISCOVERY__XMI_SIZE_IN_BYTES: return JavaBenchmarkPackage.CDO_PROJECT_DISCOVERY_ITERATION__XMI_SIZE_IN_BYTES         case BenchmarkPackage.DISCOVERY__NAME: return JavaBenchmarkPackage.CDO_PROJECT_DISCOVERY_ITERATION__NAME         case BenchmarkPackage.DISCOVERY__DISCOVERY_ERROR: return JavaBenchmarkPackage.CDO_PROJECT_DISCOVERY_ITERATION__DISCOVERY_ERROR         case BenchmarkPackage.DISCOVERY__SAVE_TIME_IN_SECONDS: return JavaBenchmarkPackage.CDO_PROJECT_DISCOVERY_ITERATION__SAVE_TIME_IN_SECONDS         default: return -1       }    }    if (baseClass == ProjectDiscovery.class) {      switch (baseFeatureID) {        case BenchmarkPackage.PROJECT_DISCOVERY__PROJECTS: return JavaBenchmarkPackage.CDO_PROJECT_DISCOVERY_ITERATION__PROJECTS         default: return -1       }    }    return super.eDerivedStructuralFeatureID(baseFeatureID  baseClass)   }
