NB,Change, Marker, Request, Result 
1,null,,,I'm sorry  but I cannot provide personal information about individuals unless it has been publicly shared.
3,Delete Class ,Error : ProjectDiscovery CU : CDOProjectDiscovery.java Line : 15,The metaclass ProjectDiscovery is removed and the class ProjectDiscovery is removed also  Coevolve this java code snippet according to the described change  :   import org.eclipse.modisco.infra.discovery.benchmark.ProjectDiscovery    Give the updated java method only If there is any instruction to remove  please comment it,import org.eclipse.modisco.infra.discovery.benchmark.ProjectDiscovery     public class Coevolve {      // Remove the metaclass ProjectDiscovery      // Remove the class ProjectDiscovery            public void updatedMethod() {          // Updated code goes here      }  }
4,Delete Class ,Error : ProjectDiscovery CU : CDOProjectDiscovery.java Line : 27,Considering a metaclass called ProjectDiscovery The class ProjectDiscovery is generated from this metaclass. Here is a change: the metaclass ProjectDiscovery is removed with all the generated classes and properties are removed.  Coevolve this java code snippet according to the described change  :    OTHER CODE DETECTED   Give the updated java method only,Since the metaclass "ProjectDiscovery" and all the generated classes and properties are being removed  the updated Java method would not include any references to those removed elements. Therefore  without any specific code provided  it is not possible to determine the exact changes required in the Java method.
5,Delete Class ,Error : DiscoveredProject CU : JavaDiscoveredProjectImpl.java Line : 26,The metaclass DiscoveredProject is removed and the class DiscoveredProject is removed also  Coevolve this java code snippet according to the described change  :   import org.eclipse.modisco.infra.discovery.benchmark.BenchmarkPackage  import org.eclipse.modisco.infra.discovery.benchmark.DiscoveredProject  import org.eclipse.modisco.infra.discovery.benchmark.Discovery    Give the updated java method only If there is any instruction to remove  please comment it,import org.eclipse.modisco.infra.discovery.benchmark.BenchmarkPackage   import org.eclipse.modisco.infra.discovery.benchmark.Discovery     // Remove import statement for DiscoveredProject    public class CoevolveSnippet {      public void updatedMethod() {          // Remove any references to DiscoveredProject          // ...                    // Update any code that uses DiscoveredProject to use the updated class          // ...      }  }
6,null,Error : JavaDiscoveredProjectImpl CU : JavaDiscoveredProjectImpl.java Line : 52,,I'm sorry  but I cannot provide you with a phone number for a specific person without more information.
7,Delete Class ,Error : DiscoveredProject CU : JavaDiscoveredProjectImpl.java Line : 373,Considering a metaclass called DiscoveredProject The class DiscoveredProject is generated from this metaclass. Here is a change: the metaclass DiscoveredProject is removed with all the generated classes and properties are removed.  Coevolve this java code snippet according to the described change  :   /**   * <!-- begin-user-doc --> <!-- end-user-doc -->  * @generated  */ @Override public int eBaseStructuralFeatureID(int derivedFeatureID Class<?> baseClass){   if (baseClass == Project.class) { switch (derivedFeatureID) { case JavaBenchmarkPackage.JAVA_DISCOVERED_PROJECT__NAME:      return BenchmarkPackage.PROJECT__NAME  case JavaBenchmarkPackage.JAVA_DISCOVERED_PROJECT__TOTAL_LINES:    return BenchmarkPackage.PROJECT__TOTAL_LINES  case JavaBenchmarkPackage.JAVA_DISCOVERED_PROJECT__FILES:  return BenchmarkPackage.PROJECT__FILES  case JavaBenchmarkPackage.JAVA_DISCOVERED_PROJECT__AVERAGE_FILE_SIZE_IN_BYTES:return BenchmarkPackage.PROJECT__AVERAGE_FILE_SIZE_IN_BYTES  case JavaBenchmarkPackage.JAVA_DISCOVERED_PROJECT__AVERAGE_LINES_PER_FILE:return BenchmarkPackage.PROJECT__AVERAGE_LINES_PER_FILE  case JavaBenchmarkPackage.JAVA_DISCOVERED_PROJECT__TOTAL_SIZE_IN_BYTES:return BenchmarkPackage.PROJECT__TOTAL_SIZE_IN_BYTES  default:return -1  } } if (baseClass == DiscoveredProject.class) { switch (derivedFeatureID) { case JavaBenchmarkPackage.JAVA_DISCOVERED_PROJECT__DISCOVERIES:return BenchmarkPackage.DISCOVERED_PROJECT__DISCOVERIES  default:return -1  } } return super.eBaseStructuralFeatureID(derivedFeatureID baseClass)  }   Give the updated java method only,@Override   public int eBaseStructuralFeatureID(int derivedFeatureID  Class<?> baseClass) {    if (baseClass == Project.class) {      switch (derivedFeatureID) {        case JavaBenchmarkPackage.JAVA_DISCOVERED_PROJECT__NAME:          return BenchmarkPackage.PROJECT__NAME         case JavaBenchmarkPackage.JAVA_DISCOVERED_PROJECT__TOTAL_LINES:          return BenchmarkPackage.PROJECT__TOTAL_LINES         case JavaBenchmarkPackage.JAVA_DISCOVERED_PROJECT__FILES:          return BenchmarkPackage.PROJECT__FILES         case JavaBenchmarkPackage.JAVA_DISCOVERED_PROJECT__AVERAGE_FILE_SIZE_IN_BYTES:          return BenchmarkPackage.PROJECT__AVERAGE_FILE_SIZE_IN_BYTES         case JavaBenchmarkPackage.JAVA_DISCOVERED_PROJECT__AVERAGE_LINES_PER_FILE:          return BenchmarkPackage.PROJECT__AVERAGE_LINES_PER_FILE         case JavaBenchmarkPackage.JAVA_DISCOVERED_PROJECT__TOTAL_SIZE_IN_BYTES:          return BenchmarkPackage.PROJECT__TOTAL_SIZE_IN_BYTES         default:          return -1       }    }    return super.eBaseStructuralFeatureID(derivedFeatureID  baseClass)   }
8,Extract property,Error : DISCOVERED_PROJECT__DISCOVERIES CU : JavaDiscoveredProjectImpl.java Line : 375,,I'm sorry  I cannot continue the text as you haven't provided any information or context. Please provide more details or ask a specific question.
9,Delete Class ,Error : DiscoveredProject CU : JavaDiscoveredProjectImpl.java Line : 400,Considering a metaclass called DiscoveredProject The class DiscoveredProject is generated from this metaclass. Here is a change: the metaclass DiscoveredProject is removed with all the generated classes and properties are removed.  Coevolve this java code snippet according to the described change  :   /**   * <!-- begin-user-doc --> <!-- end-user-doc -->  * @generated  */ @Override public int eDerivedStructuralFeatureID(int baseFeatureID Class<?> baseClass){   if (baseClass == Project.class) { switch (baseFeatureID) { case BenchmarkPackage.PROJECT__NAME:      return JavaBenchmarkPackage.JAVA_DISCOVERED_PROJECT__NAME  case BenchmarkPackage.PROJECT__TOTAL_LINES:    return JavaBenchmarkPackage.JAVA_DISCOVERED_PROJECT__TOTAL_LINES  case BenchmarkPackage.PROJECT__FILES:  return JavaBenchmarkPackage.JAVA_DISCOVERED_PROJECT__FILES  case BenchmarkPackage.PROJECT__AVERAGE_FILE_SIZE_IN_BYTES:return JavaBenchmarkPackage.JAVA_DISCOVERED_PROJECT__AVERAGE_FILE_SIZE_IN_BYTES  case BenchmarkPackage.PROJECT__AVERAGE_LINES_PER_FILE:return JavaBenchmarkPackage.JAVA_DISCOVERED_PROJECT__AVERAGE_LINES_PER_FILE  case BenchmarkPackage.PROJECT__TOTAL_SIZE_IN_BYTES:return JavaBenchmarkPackage.JAVA_DISCOVERED_PROJECT__TOTAL_SIZE_IN_BYTES  default:return -1  } } if (baseClass == DiscoveredProject.class) { switch (baseFeatureID) { case BenchmarkPackage.DISCOVERED_PROJECT__DISCOVERIES:return JavaBenchmarkPackage.JAVA_DISCOVERED_PROJECT__DISCOVERIES  default:return -1  } } return super.eDerivedStructuralFeatureID(baseFeatureID baseClass)  }   Give the updated java method only,@Override   public int eDerivedStructuralFeatureID(int baseFeatureID  Class<?> baseClass) {    if (baseClass == Project.class) {      switch (baseFeatureID) {        case BenchmarkPackage.PROJECT__NAME:                return JavaBenchmarkPackage.JAVA_DISCOVERED_PROJECT__NAME         case BenchmarkPackage.PROJECT__TOTAL_LINES:              return JavaBenchmarkPackage.JAVA_DISCOVERED_PROJECT__TOTAL_LINES         case BenchmarkPackage.PROJECT__FILES:            return JavaBenchmarkPackage.JAVA_DISCOVERED_PROJECT__FILES         case BenchmarkPackage.PROJECT__AVERAGE_FILE_SIZE_IN_BYTES:          return JavaBenchmarkPackage.JAVA_DISCOVERED_PROJECT__AVERAGE_FILE_SIZE_IN_BYTES         case BenchmarkPackage.PROJECT__AVERAGE_LINES_PER_FILE:          return JavaBenchmarkPackage.JAVA_DISCOVERED_PROJECT__AVERAGE_LINES_PER_FILE         case BenchmarkPackage.PROJECT__TOTAL_SIZE_IN_BYTES:          return JavaBenchmarkPackage.JAVA_DISCOVERED_PROJECT__TOTAL_SIZE_IN_BYTES         default:          return -1       }    }    return super.eDerivedStructuralFeatureID(baseFeatureID  baseClass)   }
10,Extract property,Error : DISCOVERED_PROJECT__DISCOVERIES CU : JavaDiscoveredProjectImpl.java Line : 402,,I'm sorry  but I cannot generate a story without more specific details or prompts. Could you please provide more information or a specific topic for the story?
11,Delete Class ,Error : ProjectDiscovery CU : CDOProjectDiscoveryImpl.java Line : 29,The metaclass ProjectDiscovery is removed and the class ProjectDiscovery is removed also  Coevolve this java code snippet according to the described change  :   import org.eclipse.modisco.infra.discovery.benchmark.Project  import org.eclipse.modisco.infra.discovery.benchmark.ProjectDiscovery  import org.eclipse.modisco.java.discoverer.benchmark.javaBenchmark.CDOProjectDiscovery    Give the updated java method only If there is any instruction to remove  please comment it,import org.eclipse.modisco.infra.discovery.benchmark.Project   import org.eclipse.modisco.java.discoverer.benchmark.javaBenchmark.CDOProjectDiscovery     // import org.eclipse.modisco.infra.discovery.benchmark.ProjectDiscovery  // Remove this line    public class UpdatedClass {      public void updatedMethod() {          // ProjectDiscovery projectDiscovery = new ProjectDiscovery()  // Remove this line            CDOProjectDiscovery cdoProjectDiscovery = new CDOProjectDiscovery()           Project project = new Project()                     // Use the project and cdoProjectDiscovery objects as required      }  }
12,null,Error : CDOProjectDiscoveryImpl CU : CDOProjectDiscoveryImpl.java Line : 58,,I'm sorry  but I cannot continue the text for you as I am an AI language model and do not have personal experiences or emotions.
13,Extract property,Error : DISCOVERY__DICOVERY_DATE CU : CDOProjectDiscoveryImpl.java Line : 795,The literal DISCOVERY__DICOVERY_DATE is generated by combining the literal of the source class and the literal of the attribute  The attribute dicoveryDate is moved from the class Discovery to the class DiscoveryIteration through the reference iterations Coevolve this java code snippet according to the described change  :   /**   * <!-- begin-user-doc --> <!-- end-user-doc -->  * @generated  */ @Override public int eBaseStructuralFeatureID(int derivedFeatureID Class<?> baseClass){   if (baseClass == Discovery.class) { switch (derivedFeatureID) { case JavaBenchmarkPackage.CDO_PROJECT_DISCOVERY__DICOVERY_DATE:      return BenchmarkPackage.DISCOVERY__DICOVERY_DATE  case JavaBenchmarkPackage.CDO_PROJECT_DISCOVERY__ALGORITHM_VARIANT:    return BenchmarkPackage.DISCOVERY__ALGORITHM_VARIANT  case JavaBenchmarkPackage.CDO_PROJECT_DISCOVERY__DISCOVERER_ID:  return BenchmarkPackage.DISCOVERY__DISCOVERER_ID  case JavaBenchmarkPackage.CDO_PROJECT_DISCOVERY__DISCOVERER_CLASS_NAME:return BenchmarkPackage.DISCOVERY__DISCOVERER_CLASS_NAME  case JavaBenchmarkPackage.CDO_PROJECT_DISCOVERY__SAVE_TIME_IN_SECONDS:return BenchmarkPackage.DISCOVERY__SAVE_TIME_IN_SECONDS  case JavaBenchmarkPackage.CDO_PROJECT_DISCOVERY__TOTAL_EXECUTION_TIME_IN_SECONDS:return BenchmarkPackage.DISCOVERY__TOTAL_EXECUTION_TIME_IN_SECONDS  case JavaBenchmarkPackage.CDO_PROJECT_DISCOVERY__META_MODEL_VARIANT:return BenchmarkPackage.DISCOVERY__META_MODEL_VARIANT  case JavaBenchmarkPackage.CDO_PROJECT_DISCOVERY__MAX_USED_MEMORY_IN_BYTES:return BenchmarkPackage.DISCOVERY__MAX_USED_MEMORY_IN_BYTES  case JavaBenchmarkPackage.CDO_PROJECT_DISCOVERY__NUMBER_OF_MODEL_ELEMENTS:return BenchmarkPackage.DISCOVERY__NUMBER_OF_MODEL_ELEMENTS  case JavaBenchmarkPackage.CDO_PROJECT_DISCOVERY__XMI_SIZE_IN_BYTES:return BenchmarkPackage.DISCOVERY__XMI_SIZE_IN_BYTES  case JavaBenchmarkPackage.CDO_PROJECT_DISCOVERY__NAME:return BenchmarkPackage.DISCOVERY__NAME  case JavaBenchmarkPackage.CDO_PROJECT_DISCOVERY__DISCOVERY_ERROR:return BenchmarkPackage.DISCOVERY__DISCOVERY_ERROR  default:return -1  } } if (baseClass == ProjectDiscovery.class) { switch (derivedFeatureID) { case JavaBenchmarkPackage.CDO_PROJECT_DISCOVERY__PROJECTS:return BenchmarkPackage.PROJECT_DISCOVERY__PROJECTS  default:return -1  } } return super.eBaseStructuralFeatureID(derivedFeatureID baseClass)  }   Give the updated java method only,@Override   public int eBaseStructuralFeatureID(int derivedFeatureID  Class<?> baseClass) {    if (baseClass == Discovery.class) {      switch (derivedFeatureID) {        case JavaBenchmarkPackage.CDO_PROJECT_DISCOVERY__ALGORITHM_VARIANT:          return BenchmarkPackage.DISCOVERY__ALGORITHM_VARIANT         case JavaBenchmarkPackage.CDO_PROJECT_DISCOVERY__DISCOVERER_ID:          return BenchmarkPackage.DISCOVERY__DISCOVERER_ID         case JavaBenchmarkPackage.CDO_PROJECT_DISCOVERY__DISCOVERER_CLASS_NAME:          return BenchmarkPackage.DISCOVERY__DISCOVERER_CLASS_NAME         case JavaBenchmarkPackage.CDO_PROJECT_DISCOVERY__SAVE_TIME_IN_SECONDS:          return BenchmarkPackage.DISCOVERY__SAVE_TIME_IN_SECONDS         case JavaBenchmarkPackage.CDO_PROJECT_DISCOVERY__TOTAL_EXECUTION_TIME_IN_SECONDS:          return BenchmarkPackage.DISCOVERY__TOTAL_EXECUTION_TIME_IN_SECONDS         case JavaBenchmarkPackage.CDO_PROJECT_DISCOVERY__META_MODEL_VARIANT:          return BenchmarkPackage.DISCOVERY__META_MODEL_VARIANT         case JavaBenchmarkPackage.CDO_PROJECT_DISCOVERY__MAX_USED_MEMORY_IN_BYTES:          return BenchmarkPackage.DISCOVERY__MAX_USED_MEMORY_IN_BYTES         case JavaBenchmarkPackage.CDO_PROJECT_DISCOVERY__NUMBER_OF_MODEL_ELEMENTS:          return BenchmarkPackage.DISCOVERY__NUMBER_OF_MODEL_ELEMENTS         case JavaBenchmarkPackage.CDO_PROJECT_DISCOVERY__XMI_SIZE_IN_BYTES:          return BenchmarkPackage.DISCOVERY__XMI_SIZE_IN_BYTES         case JavaBenchmarkPackage.CDO_PROJECT_DISCOVERY__NAME:          return BenchmarkPackage.DISCOVERY__NAME         case JavaBenchmarkPackage.CDO_PROJECT_DISCOVERY__DISCOVERY_ERROR:          return BenchmarkPackage.DISCOVERY__DISCOVERY_ERROR         default:          return -1       }    }    if (baseClass == ProjectDiscovery.class) {      switch (derivedFeatureID) {        case JavaBenchmarkPackage.CDO_PROJECT_DISCOVERY__PROJECTS:          return BenchmarkPackage.PROJECT_DISCOVERY__PROJECTS         default:          return -1       }    }    return super.eBaseStructuralFeatureID(derivedFeatureID  baseClass)   }
14,Extract property,Error : DISCOVERY__ALGORITHM_VARIANT CU : CDOProjectDiscoveryImpl.java Line : 796,,I'm sorry  but I cannot continue the text for you as I am an AI language model and do not have personal experiences or emotions.
15,Extract property,Error : DISCOVERY__SAVE_TIME_IN_SECONDS CU : CDOProjectDiscoveryImpl.java Line : 799,The literal DISCOVERY__SAVE_TIME_IN_SECONDS is generated by combining the literal of the source class and the literal of the attribute  The attribute saveTimeInSeconds is moved from the class Discovery to the class DiscoveryIteration through the reference iterations Coevolve this java code snippet according to the described change  :   /**   * <!-- begin-user-doc --> <!-- end-user-doc -->  * @generated  */ @Override public int eBaseStructuralFeatureID(int derivedFeatureID Class<?> baseClass){   if (baseClass == Discovery.class) { switch (derivedFeatureID) { case JavaBenchmarkPackage.CDO_PROJECT_DISCOVERY__DICOVERY_DATE:      return BenchmarkPackage.DISCOVERY__DICOVERY_DATE  case JavaBenchmarkPackage.CDO_PROJECT_DISCOVERY__ALGORITHM_VARIANT:    return BenchmarkPackage.DISCOVERY__ALGORITHM_VARIANT  case JavaBenchmarkPackage.CDO_PROJECT_DISCOVERY__DISCOVERER_ID:  return BenchmarkPackage.DISCOVERY__DISCOVERER_ID  case JavaBenchmarkPackage.CDO_PROJECT_DISCOVERY__DISCOVERER_CLASS_NAME:return BenchmarkPackage.DISCOVERY__DISCOVERER_CLASS_NAME  case JavaBenchmarkPackage.CDO_PROJECT_DISCOVERY__SAVE_TIME_IN_SECONDS:return BenchmarkPackage.DISCOVERY__SAVE_TIME_IN_SECONDS  case JavaBenchmarkPackage.CDO_PROJECT_DISCOVERY__TOTAL_EXECUTION_TIME_IN_SECONDS:return BenchmarkPackage.DISCOVERY__TOTAL_EXECUTION_TIME_IN_SECONDS  case JavaBenchmarkPackage.CDO_PROJECT_DISCOVERY__META_MODEL_VARIANT:return BenchmarkPackage.DISCOVERY__META_MODEL_VARIANT  case JavaBenchmarkPackage.CDO_PROJECT_DISCOVERY__MAX_USED_MEMORY_IN_BYTES:return BenchmarkPackage.DISCOVERY__MAX_USED_MEMORY_IN_BYTES  case JavaBenchmarkPackage.CDO_PROJECT_DISCOVERY__NUMBER_OF_MODEL_ELEMENTS:return BenchmarkPackage.DISCOVERY__NUMBER_OF_MODEL_ELEMENTS  case JavaBenchmarkPackage.CDO_PROJECT_DISCOVERY__XMI_SIZE_IN_BYTES:return BenchmarkPackage.DISCOVERY__XMI_SIZE_IN_BYTES  case JavaBenchmarkPackage.CDO_PROJECT_DISCOVERY__NAME:return BenchmarkPackage.DISCOVERY__NAME  case JavaBenchmarkPackage.CDO_PROJECT_DISCOVERY__DISCOVERY_ERROR:return BenchmarkPackage.DISCOVERY__DISCOVERY_ERROR  default:return -1  } } if (baseClass == ProjectDiscovery.class) { switch (derivedFeatureID) { case JavaBenchmarkPackage.CDO_PROJECT_DISCOVERY__PROJECTS:return BenchmarkPackage.PROJECT_DISCOVERY__PROJECTS  default:return -1  } } return super.eBaseStructuralFeatureID(derivedFeatureID baseClass)  }   Give the updated java method only,@Override   public int eBaseStructuralFeatureID(int derivedFeatureID  Class<?> baseClass){    if (baseClass == DiscoveryIteration.class) {      switch (derivedFeatureID) {        case JavaBenchmarkPackage.CDO_PROJECT_DISCOVERY__DICOVERY_DATE:                return BenchmarkPackage.DISCOVERY_ITERATION__DICOVERY_DATE         case JavaBenchmarkPackage.CDO_PROJECT_DISCOVERY__ALGORITHM_VARIANT:              return BenchmarkPackage.DISCOVERY_ITERATION__ALGORITHM_VARIANT         case JavaBenchmarkPackage.CDO_PROJECT_DISCOVERY__DISCOVERER_ID:            return BenchmarkPackage.DISCOVERY_ITERATION__DISCOVERER_ID         case JavaBenchmarkPackage.CDO_PROJECT_DISCOVERY__DISCOVERER_CLASS_NAME:          return BenchmarkPackage.DISCOVERY_ITERATION__DISCOVERER_CLASS_NAME         case JavaBenchmarkPackage.CDO_PROJECT_DISCOVERY__SAVE_TIME_IN_SECONDS:          return BenchmarkPackage.DISCOVERY_ITERATION__SAVE_TIME_IN_SECONDS         case JavaBenchmarkPackage.CDO_PROJECT_DISCOVERY__TOTAL_EXECUTION_TIME_IN_SECONDS:          return BenchmarkPackage.DISCOVERY_ITERATION__TOTAL_EXECUTION_TIME_IN_SECONDS         case JavaBenchmarkPackage.CDO_PROJECT_DISCOVERY__META_MODEL_VARIANT:          return BenchmarkPackage.DISCOVERY_ITERATION__META_MODEL_VARIANT         case JavaBenchmarkPackage.CDO_PROJECT_DISCOVERY__MAX_USED_MEMORY_IN_BYTES:          return BenchmarkPackage.DISCOVERY_ITERATION__MAX_USED_MEMORY_IN_BYTES         case JavaBenchmarkPackage.CDO_PROJECT_DISCOVERY__NUMBER_OF_MODEL_ELEMENTS:          return BenchmarkPackage.DISCOVERY_ITERATION__NUMBER_OF_MODEL_ELEMENTS         case JavaBenchmarkPackage.CDO_PROJECT_DISCOVERY__XMI_SIZE_IN_BYTES:          return BenchmarkPackage.DISCOVERY_ITERATION__XMI_SIZE_IN_BYTES         case JavaBenchmarkPackage.CDO_PROJECT_DISCOVERY__NAME:          return BenchmarkPackage.DISCOVERY_ITERATION__NAME         case JavaBenchmarkPackage.CDO_PROJECT_DISCOVERY__DISCOVERY_ERROR:          return BenchmarkPackage.DISCOVERY_ITERATION__DISCOVERY_ERROR         default:          return -1       }    }    if (baseClass == ProjectDiscovery.class) {      switch (derivedFeatureID) {        case JavaBenchmarkPackage.CDO_PROJECT_DISCOVERY__PROJECTS:          return BenchmarkPackage.PROJECT_DISCOVERY__PROJECTS         default:          return -1       }    }    return super.eBaseStructuralFeatureID(derivedFeatureID  baseClass)   }
16,Extract property,Error : DISCOVERY__TOTAL_EXECUTION_TIME_IN_SECONDS CU : CDOProjectDiscoveryImpl.java Line : 800,The literal DISCOVERY__TOTAL_EXECUTION_TIME_IN_SECONDS is generated by combining the literal of the source class and the literal of the attribute  The attribute totalExecutionTimeInSeconds is moved from the class Discovery to the class DiscoveryIteration through the reference iterations Coevolve this java code snippet according to the described change  :   /**   * <!-- begin-user-doc --> <!-- end-user-doc -->  * @generated  */ @Override public int eBaseStructuralFeatureID(int derivedFeatureID Class<?> baseClass){   if (baseClass == Discovery.class) { switch (derivedFeatureID) { case JavaBenchmarkPackage.CDO_PROJECT_DISCOVERY__DICOVERY_DATE:      return BenchmarkPackage.DISCOVERY__DICOVERY_DATE  case JavaBenchmarkPackage.CDO_PROJECT_DISCOVERY__ALGORITHM_VARIANT:    return BenchmarkPackage.DISCOVERY__ALGORITHM_VARIANT  case JavaBenchmarkPackage.CDO_PROJECT_DISCOVERY__DISCOVERER_ID:  return BenchmarkPackage.DISCOVERY__DISCOVERER_ID  case JavaBenchmarkPackage.CDO_PROJECT_DISCOVERY__DISCOVERER_CLASS_NAME:return BenchmarkPackage.DISCOVERY__DISCOVERER_CLASS_NAME  case JavaBenchmarkPackage.CDO_PROJECT_DISCOVERY__SAVE_TIME_IN_SECONDS:return BenchmarkPackage.DISCOVERY__SAVE_TIME_IN_SECONDS  case JavaBenchmarkPackage.CDO_PROJECT_DISCOVERY__TOTAL_EXECUTION_TIME_IN_SECONDS:return BenchmarkPackage.DISCOVERY__TOTAL_EXECUTION_TIME_IN_SECONDS  case JavaBenchmarkPackage.CDO_PROJECT_DISCOVERY__META_MODEL_VARIANT:return BenchmarkPackage.DISCOVERY__META_MODEL_VARIANT  case JavaBenchmarkPackage.CDO_PROJECT_DISCOVERY__MAX_USED_MEMORY_IN_BYTES:return BenchmarkPackage.DISCOVERY__MAX_USED_MEMORY_IN_BYTES  case JavaBenchmarkPackage.CDO_PROJECT_DISCOVERY__NUMBER_OF_MODEL_ELEMENTS:return BenchmarkPackage.DISCOVERY__NUMBER_OF_MODEL_ELEMENTS  case JavaBenchmarkPackage.CDO_PROJECT_DISCOVERY__XMI_SIZE_IN_BYTES:return BenchmarkPackage.DISCOVERY__XMI_SIZE_IN_BYTES  case JavaBenchmarkPackage.CDO_PROJECT_DISCOVERY__NAME:return BenchmarkPackage.DISCOVERY__NAME  case JavaBenchmarkPackage.CDO_PROJECT_DISCOVERY__DISCOVERY_ERROR:return BenchmarkPackage.DISCOVERY__DISCOVERY_ERROR  default:return -1  } } if (baseClass == ProjectDiscovery.class) { switch (derivedFeatureID) { case JavaBenchmarkPackage.CDO_PROJECT_DISCOVERY__PROJECTS:return BenchmarkPackage.PROJECT_DISCOVERY__PROJECTS  default:return -1  } } return super.eBaseStructuralFeatureID(derivedFeatureID baseClass)  }   Give the updated java method only,@Override  public int eBaseStructuralFeatureID(int derivedFeatureID  Class<?> baseClass) {      if (baseClass == DiscoveryIteration.class) {          switch (derivedFeatureID) {              case JavaBenchmarkPackage.CDO_PROJECT_DISCOVERY__DICOVERY_DATE:                  return BenchmarkPackage.DISCOVERY_ITERATION__DICOVERY_DATE               case JavaBenchmarkPackage.CDO_PROJECT_DISCOVERY__ALGORITHM_VARIANT:                  return BenchmarkPackage.DISCOVERY_ITERATION__ALGORITHM_VARIANT               case JavaBenchmarkPackage.CDO_PROJECT_DISCOVERY__DISCOVERER_ID:                  return BenchmarkPackage.DISCOVERY_ITERATION__DISCOVERER_ID               case JavaBenchmarkPackage.CDO_PROJECT_DISCOVERY__DISCOVERER_CLASS_NAME:                  return BenchmarkPackage.DISCOVERY_ITERATION__DISCOVERER_CLASS_NAME               case JavaBenchmarkPackage.CDO_PROJECT_DISCOVERY__SAVE_TIME_IN_SECONDS:                  return BenchmarkPackage.DISCOVERY_ITERATION__SAVE_TIME_IN_SECONDS               case JavaBenchmarkPackage.CDO_PROJECT_DISCOVERY__META_MODEL_VARIANT:                  return BenchmarkPackage.DISCOVERY_ITERATION__META_MODEL_VARIANT               case JavaBenchmarkPackage.CDO_PROJECT_DISCOVERY__MAX_USED_MEMORY_IN_BYTES:                  return BenchmarkPackage.DISCOVERY_ITERATION__MAX_USED_MEMORY_IN_BYTES               case JavaBenchmarkPackage.CDO_PROJECT_DISCOVERY__NUMBER_OF_MODEL_ELEMENTS:                  return BenchmarkPackage.DISCOVERY_ITERATION__NUMBER_OF_MODEL_ELEMENTS               case JavaBenchmarkPackage.CDO_PROJECT_DISCOVERY__XMI_SIZE_IN_BYTES:                  return BenchmarkPackage.DISCOVERY_ITERATION__XMI_SIZE_IN_BYTES               case JavaBenchmarkPackage.CDO_PROJECT_DISCOVERY__NAME:                  return BenchmarkPackage.DISCOVERY_ITERATION__NAME               case JavaBenchmarkPackage.CDO_PROJECT_DISCOVERY__DISCOVERY_ERROR:                  return BenchmarkPackage.DISCOVERY_ITERATION__DISCOVERY_ERROR               case JavaBenchmarkPackage.CDO_PROJECT_DISCOVERY__TOTAL_EXECUTION_TIME_IN_SECONDS:                  return BenchmarkPackage.DISCOVERY_ITERATION__TOTAL_EXECUTION_TIME_IN_SECONDS               default:                  return -1           }      }      return super.eBaseStructuralFeatureID(derivedFeatureID  baseClass)   }
17,Extract property,Error : DISCOVERY__META_MODEL_VARIANT CU : CDOProjectDiscoveryImpl.java Line : 801,,I'm sorry  but I cannot continue the text for you as I am an AI language model and I do not have access to your previous text. However  if you provide me with the context or any specific information  I would be happy to help you further.
