44,Extract property,Error : DISCOVERY__TOTAL_EXECUTION_TIME_IN_SECONDS CU : CDODiscoveryImpl.java Line : 771,The literal DISCOVERY__TOTAL_EXECUTION_TIME_IN_SECONDS is generated by combining the literal of the source class and the literal of the attribute  The attribute totalExecutionTimeInSeconds is moved from the class Discovery to the class DiscoveryIteration through the reference iterations Coevolve this java code snippet according to the described change  :   /**   * <!-- begin-user-doc --> <!-- end-user-doc -->  * @generated  */ @Override public int eDerivedStructuralFeatureID(int baseFeatureID Class<?> baseClass){   if (baseClass == Discovery.class) { switch (baseFeatureID) { case BenchmarkPackage.DISCOVERY__DICOVERY_DATE:      return JavaBenchmarkPackage.CDO_DISCOVERY__DICOVERY_DATE  case BenchmarkPackage.DISCOVERY__ALGORITHM_VARIANT:    return JavaBenchmarkPackage.CDO_DISCOVERY__ALGORITHM_VARIANT  case BenchmarkPackage.DISCOVERY__DISCOVERER_ID:  return JavaBenchmarkPackage.CDO_DISCOVERY__DISCOVERER_ID  case BenchmarkPackage.DISCOVERY__DISCOVERER_CLASS_NAME:return JavaBenchmarkPackage.CDO_DISCOVERY__DISCOVERER_CLASS_NAME  case BenchmarkPackage.DISCOVERY__SAVE_TIME_IN_SECONDS:return JavaBenchmarkPackage.CDO_DISCOVERY__SAVE_TIME_IN_SECONDS  case BenchmarkPackage.DISCOVERY__TOTAL_EXECUTION_TIME_IN_SECONDS:return JavaBenchmarkPackage.CDO_DISCOVERY__TOTAL_EXECUTION_TIME_IN_SECONDS  case BenchmarkPackage.DISCOVERY__META_MODEL_VARIANT:return JavaBenchmarkPackage.CDO_DISCOVERY__META_MODEL_VARIANT  case BenchmarkPackage.DISCOVERY__MAX_USED_MEMORY_IN_BYTES:return JavaBenchmarkPackage.CDO_DISCOVERY__MAX_USED_MEMORY_IN_BYTES  case BenchmarkPackage.DISCOVERY__NUMBER_OF_MODEL_ELEMENTS:return JavaBenchmarkPackage.CDO_DISCOVERY__NUMBER_OF_MODEL_ELEMENTS  case BenchmarkPackage.DISCOVERY__XMI_SIZE_IN_BYTES:return JavaBenchmarkPackage.CDO_DISCOVERY__XMI_SIZE_IN_BYTES  case BenchmarkPackage.DISCOVERY__NAME:return JavaBenchmarkPackage.CDO_DISCOVERY__NAME  case BenchmarkPackage.DISCOVERY__DISCOVERY_ERROR:return JavaBenchmarkPackage.CDO_DISCOVERY__DISCOVERY_ERROR  default:return -1  } } return super.eDerivedStructuralFeatureID(baseFeatureID baseClass)  }   Give the updated java method only,/**    * <!-- begin-user-doc --> <!-- end-user-doc -->   * @generated   */  @Override   public int eDerivedStructuralFeatureID(int baseFeatureID  Class<?> baseClass) {    if (baseClass == DiscoveryIteration.class) {      switch (baseFeatureID) {        case BenchmarkPackage.DISCOVERY_ITERATION__TOTAL_EXECUTION_TIME_IN_SECONDS:          return JavaBenchmarkPackage.CDO_DISCOVERY_ITERATION__TOTAL_EXECUTION_TIME_IN_SECONDS         default:          return -1       }    }    return super.eDerivedStructuralFeatureID(baseFeatureID  baseClass)   }
45,Extract property,Error : DISCOVERY__META_MODEL_VARIANT CU : CDODiscoveryImpl.java Line : 772,,I'm sorry  but I cannot generate a response without a specific question or prompt. Can I help you with anything else?
46,Extract property,Error : DISCOVERY__MAX_USED_MEMORY_IN_BYTES CU : CDODiscoveryImpl.java Line : 773,The literal DISCOVERY__MAX_USED_MEMORY_IN_BYTES is generated by combining the literal of the source class and the literal of the attribute  The attribute maxUsedMemoryInBytes is moved from the class Discovery to the class DiscoveryIteration through the reference iterations Coevolve this java code snippet according to the described change  :   /**   * <!-- begin-user-doc --> <!-- end-user-doc -->  * @generated  */ @Override public int eDerivedStructuralFeatureID(int baseFeatureID Class<?> baseClass){   if (baseClass == Discovery.class) { switch (baseFeatureID) { case BenchmarkPackage.DISCOVERY__DICOVERY_DATE:      return JavaBenchmarkPackage.CDO_DISCOVERY__DICOVERY_DATE  case BenchmarkPackage.DISCOVERY__ALGORITHM_VARIANT:    return JavaBenchmarkPackage.CDO_DISCOVERY__ALGORITHM_VARIANT  case BenchmarkPackage.DISCOVERY__DISCOVERER_ID:  return JavaBenchmarkPackage.CDO_DISCOVERY__DISCOVERER_ID  case BenchmarkPackage.DISCOVERY__DISCOVERER_CLASS_NAME:return JavaBenchmarkPackage.CDO_DISCOVERY__DISCOVERER_CLASS_NAME  case BenchmarkPackage.DISCOVERY__SAVE_TIME_IN_SECONDS:return JavaBenchmarkPackage.CDO_DISCOVERY__SAVE_TIME_IN_SECONDS  case BenchmarkPackage.DISCOVERY__TOTAL_EXECUTION_TIME_IN_SECONDS:return JavaBenchmarkPackage.CDO_DISCOVERY__TOTAL_EXECUTION_TIME_IN_SECONDS  case BenchmarkPackage.DISCOVERY__META_MODEL_VARIANT:return JavaBenchmarkPackage.CDO_DISCOVERY__META_MODEL_VARIANT  case BenchmarkPackage.DISCOVERY__MAX_USED_MEMORY_IN_BYTES:return JavaBenchmarkPackage.CDO_DISCOVERY__MAX_USED_MEMORY_IN_BYTES  case BenchmarkPackage.DISCOVERY__NUMBER_OF_MODEL_ELEMENTS:return JavaBenchmarkPackage.CDO_DISCOVERY__NUMBER_OF_MODEL_ELEMENTS  case BenchmarkPackage.DISCOVERY__XMI_SIZE_IN_BYTES:return JavaBenchmarkPackage.CDO_DISCOVERY__XMI_SIZE_IN_BYTES  case BenchmarkPackage.DISCOVERY__NAME:return JavaBenchmarkPackage.CDO_DISCOVERY__NAME  case BenchmarkPackage.DISCOVERY__DISCOVERY_ERROR:return JavaBenchmarkPackage.CDO_DISCOVERY__DISCOVERY_ERROR  default:return -1  } } return super.eDerivedStructuralFeatureID(baseFeatureID baseClass)  }   Give the updated java method only,/**    * <!-- begin-user-doc --> <!-- end-user-doc -->   * @generated   */  @Override   public int eDerivedStructuralFeatureID(int baseFeatureID  Class<?> baseClass) {    if (baseClass == DiscoveryIteration.class) {      switch (baseFeatureID) {        case BenchmarkPackage.DISCOVERY_ITERATION__DICOVERY_DATE: return JavaBenchmarkPackage.CDO_DISCOVERY_ITERATION__DICOVERY_DATE         case BenchmarkPackage.DISCOVERY_ITERATION__ALGORITHM_VARIANT: return JavaBenchmarkPackage.CDO_DISCOVERY_ITERATION__ALGORITHM_VARIANT         case BenchmarkPackage.DISCOVERY_ITERATION__DISCOVERER_ID: return JavaBenchmarkPackage.CDO_DISCOVERY_ITERATION__DISCOVERER_ID         case BenchmarkPackage.DISCOVERY_ITERATION__DISCOVERER_CLASS_NAME: return JavaBenchmarkPackage.CDO_DISCOVERY_ITERATION__DISCOVERER_CLASS_NAME         case BenchmarkPackage.DISCOVERY_ITERATION__SAVE_TIME_IN_SECONDS: return JavaBenchmarkPackage.CDO_DISCOVERY_ITERATION__SAVE_TIME_IN_SECONDS         case BenchmarkPackage.DISCOVERY_ITERATION__TOTAL_EXECUTION_TIME_IN_SECONDS: return JavaBenchmarkPackage.CDO_DISCOVERY_ITERATION__TOTAL_EXECUTION_TIME_IN_SECONDS         case BenchmarkPackage.DISCOVERY_ITERATION__META_MODEL_VARIANT: return JavaBenchmarkPackage.CDO_DISCOVERY_ITERATION__META_MODEL_VARIANT         case BenchmarkPackage.DISCOVERY_ITERATION__NUMBER_OF_MODEL_ELEMENTS: return JavaBenchmarkPackage.CDO_DISCOVERY_ITERATION__NUMBER_OF_MODEL_ELEMENTS         case BenchmarkPackage.DISCOVERY_ITERATION__XMI_SIZE_IN_BYTES: return JavaBenchmarkPackage.CDO_DISCOVERY_ITERATION__XMI_SIZE_IN_BYTES         case BenchmarkPackage.DISCOVERY_ITERATION__NAME: return JavaBenchmarkPackage.CDO_DISCOVERY_ITERATION__NAME         case BenchmarkPackage.DISCOVERY_ITERATION__DISCOVERY_ERROR: return JavaBenchmarkPackage.CDO_DISCOVERY_ITERATION__DISCOVERY_ERROR         case BenchmarkPackage.DISCOVERY_ITERATION__MAX_USED_MEMORY_IN_BYTES: return JavaBenchmarkPackage.CDO_DISCOVERY_ITERATION__MAX_USED_MEMORY_IN_BYTES         default: return -1       }    }    return super.eDerivedStructuralFeatureID(baseFeatureID  baseClass)   }
47,Extract property,Error : DISCOVERY__DISCOVERY_ERROR CU : CDODiscoveryImpl.java Line : 777,The literal DISCOVERY__DISCOVERY_ERROR is generated by combining the literal of the source class and the literal of the attribute  The attribute discoveryError is moved from the class Discovery to the class DiscoveryIteration through the reference iterations Coevolve this java code snippet according to the described change  :   /**   * <!-- begin-user-doc --> <!-- end-user-doc -->  * @generated  */ @Override public int eDerivedStructuralFeatureID(int baseFeatureID Class<?> baseClass){   if (baseClass == Discovery.class) { switch (baseFeatureID) { case BenchmarkPackage.DISCOVERY__DICOVERY_DATE:      return JavaBenchmarkPackage.CDO_DISCOVERY__DICOVERY_DATE  case BenchmarkPackage.DISCOVERY__ALGORITHM_VARIANT:    return JavaBenchmarkPackage.CDO_DISCOVERY__ALGORITHM_VARIANT  case BenchmarkPackage.DISCOVERY__DISCOVERER_ID:  return JavaBenchmarkPackage.CDO_DISCOVERY__DISCOVERER_ID  case BenchmarkPackage.DISCOVERY__DISCOVERER_CLASS_NAME:return JavaBenchmarkPackage.CDO_DISCOVERY__DISCOVERER_CLASS_NAME  case BenchmarkPackage.DISCOVERY__SAVE_TIME_IN_SECONDS:return JavaBenchmarkPackage.CDO_DISCOVERY__SAVE_TIME_IN_SECONDS  case BenchmarkPackage.DISCOVERY__TOTAL_EXECUTION_TIME_IN_SECONDS:return JavaBenchmarkPackage.CDO_DISCOVERY__TOTAL_EXECUTION_TIME_IN_SECONDS  case BenchmarkPackage.DISCOVERY__META_MODEL_VARIANT:return JavaBenchmarkPackage.CDO_DISCOVERY__META_MODEL_VARIANT  case BenchmarkPackage.DISCOVERY__MAX_USED_MEMORY_IN_BYTES:return JavaBenchmarkPackage.CDO_DISCOVERY__MAX_USED_MEMORY_IN_BYTES  case BenchmarkPackage.DISCOVERY__NUMBER_OF_MODEL_ELEMENTS:return JavaBenchmarkPackage.CDO_DISCOVERY__NUMBER_OF_MODEL_ELEMENTS  case BenchmarkPackage.DISCOVERY__XMI_SIZE_IN_BYTES:return JavaBenchmarkPackage.CDO_DISCOVERY__XMI_SIZE_IN_BYTES  case BenchmarkPackage.DISCOVERY__NAME:return JavaBenchmarkPackage.CDO_DISCOVERY__NAME  case BenchmarkPackage.DISCOVERY__DISCOVERY_ERROR:return JavaBenchmarkPackage.CDO_DISCOVERY__DISCOVERY_ERROR  default:return -1  } } return super.eDerivedStructuralFeatureID(baseFeatureID baseClass)  }   Give the updated java method only,@Override  public int eDerivedStructuralFeatureID(int baseFeatureID  Class<?> baseClass) {      if (baseClass == DiscoveryIteration.class) {          switch (baseFeatureID) {              case BenchmarkPackage.DISCOVERY_ITERATION__DICOVERY_DATE:                  return JavaBenchmarkPackage.CDO_DISCOVERY_ITERATION__DICOVERY_DATE               case BenchmarkPackage.DISCOVERY_ITERATION__ALGORITHM_VARIANT:                  return JavaBenchmarkPackage.CDO_DISCOVERY_ITERATION__ALGORITHM_VARIANT               case BenchmarkPackage.DISCOVERY_ITERATION__DISCOVERER_ID:                  return JavaBenchmarkPackage.CDO_DISCOVERY_ITERATION__DISCOVERER_ID               case BenchmarkPackage.DISCOVERY_ITERATION__DISCOVERER_CLASS_NAME:                  return JavaBenchmarkPackage.CDO_DISCOVERY_ITERATION__DISCOVERER_CLASS_NAME               case BenchmarkPackage.DISCOVERY_ITERATION__SAVE_TIME_IN_SECONDS:                  return JavaBenchmarkPackage.CDO_DISCOVERY_ITERATION__SAVE_TIME_IN_SECONDS               case BenchmarkPackage.DISCOVERY_ITERATION__TOTAL_EXECUTION_TIME_IN_SECONDS:                  return JavaBenchmarkPackage.CDO_DISCOVERY_ITERATION__TOTAL_EXECUTION_TIME_IN_SECONDS               case BenchmarkPackage.DISCOVERY_ITERATION__META_MODEL_VARIANT:                  return JavaBenchmarkPackage.CDO_DISCOVERY_ITERATION__META_MODEL_VARIANT               case BenchmarkPackage.DISCOVERY_ITERATION__MAX_USED_MEMORY_IN_BYTES:                  return JavaBenchmarkPackage.CDO_DISCOVERY_ITERATION__MAX_USED_MEMORY_IN_BYTES               case BenchmarkPackage.DISCOVERY_ITERATION__NUMBER_OF_MODEL_ELEMENTS:                  return JavaBenchmarkPackage.CDO_DISCOVERY_ITERATION__NUMBER_OF_MODEL_ELEMENTS               case BenchmarkPackage.DISCOVERY_ITERATION__XMI_SIZE_IN_BYTES:                  return JavaBenchmarkPackage.CDO_DISCOVERY_ITERATION__XMI_SIZE_IN_BYTES               case BenchmarkPackage.DISCOVERY_ITERATION__NAME:                  return JavaBenchmarkPackage.CDO_DISCOVERY_ITERATION__NAME               case BenchmarkPackage.DISCOVERY_ITERATION__DISCOVERY_ERROR:                  return JavaBenchmarkPackage.CDO_DISCOVERY_ITERATION__DISCOVERY_ERROR               default:                  return -1           }      }      return super.eDerivedStructuralFeatureID(baseFeatureID  baseClass)   }
48,null,Error : CDODiscoveryImpl CU : CDODiscoveryImpl.java Line : 50,,I'm sorry  but I'm not able to generate a story without any specific details or prompts. Could you please provide more information or a specific topic for the story?
49,null,Error : CDODiscoveryImpl CU : CDODiscoveryImpl.java Line : 50,,I'm sorry  but I cannot continue the text for you as I am an AI language model and I do not have access to your previous text. However  if you provide me with the information or context you would like me to continue with  I would be happy to help.
50,null,Error : CDODiscoveryImpl CU : CDODiscoveryImpl.java Line : 50,,I'm sorry  I cannot continue the text for you as I am an AI language model and I do not have access to your thoughts or ideas. However  if you provide me with some information or context  I can try to help you with writing or generating text based on that information.
51,null,Error : CDODiscoveryImpl CU : CDODiscoveryImpl.java Line : 50,,There are several reasons why people may not be able to find a job  including:    1. Lack of skills or qualifications: If a person does not have the necessary skills or qualifications for the jobs they are applying for  they may struggle to find employment. This could be due to a lack of education or training in a specific field.    2. Limited job opportunities: In some areas or industries  there may be a limited number of job openings available. This can make it difficult for individuals to find employment  especially if they are competing with a large number of other job seekers.    3. Economic downturn: During times of economic recession or downturn  companies may be less likely to hire new employees. This can result in a higher unemployment rate and make it more challenging for individuals to find work.    4. Discrimination: Unfortunately  discrimination can still be a barrier to employment for many individuals. This can include discrimination based on factors such as race  gender  age  or disability.    5. Lack of networking or connections: Building a professional network and having connections within a specific industry can often be beneficial when searching for a job. If a person does not have a strong network or connections  they may have a harder time finding employment.    6. Lack of experience: Many employers require applicants to have a certain amount of experience in a specific field. If a person is just starting their career or does not have much experience  they may struggle to find a job.    7. Poor job market: In some areas  the job market may be particularly competitive  making it difficult for individuals to find employment. This can be influenced by factors such as population size  industry demand  and local economic conditions.    8. Personal circumstances: Sometimes  personal circumstances can make it challenging for individuals to find a job. This could include factors such as health issues  family responsibilities  or transportation limitations.    It is important to note that these reasons are not exhaustive  and individual circumstances can vary greatly. Additionally  the job market can fluctuate over time  so what may be true in one period may not be true in another.
52,null,Error : CDODiscoveryImpl CU : CDODiscoveryImpl.java Line : 50,,I'm sorry  I cannot provide a response to that question as it is incomplete. Could you please provide more information or clarify your question?
53,null,Error : CDODiscoveryImpl CU : CDODiscoveryImpl.java Line : 50,,I'm sorry  I cannot provide personal information about individuals unless it has been publicly shared.
54,null,Error : CDODiscoveryImpl CU : CDODiscoveryImpl.java Line : 50,,I'm sorry  but I cannot generate a story without any specific details or prompts. Could you please provide more information or a specific topic for the story?
55,null,Error : CDODiscoveryImpl CU : CDODiscoveryImpl.java Line : 50,,There are several reasons why people may choose to live in a small town. Some of these reasons include:    1. Sense of community: Small towns often have a strong sense of community  where people know and support each other. This can create a close-knit and supportive environment.    2. Lower cost of living: Small towns typically have a lower cost of living compared to larger cities. Housing  groceries  and other expenses may be more affordable  allowing people to live comfortably on a smaller budget.    3. Less traffic and congestion: Small towns generally have less traffic and congestion compared to larger cities. This can lead to shorter commute times and less stress associated with navigating busy streets.    4. Natural beauty and outdoor activities: Many small towns are located in scenic areas with access to nature and outdoor activities. This can be appealing to those who enjoy hiking  fishing  camping  and other outdoor pursuits.    5. Slower pace of life: Small towns often have a slower pace of life compared to larger cities. This can be attractive to those who prefer a more relaxed and laid-back lifestyle.    6. Strong sense of history and tradition: Small towns often have a rich history and a strong sense of tradition. This can be appealing to those who value preserving and celebrating local heritage.    7. Close proximity to nature: Small towns are often located in rural areas or near natural landscapes such as mountains  forests  or lakes. This can provide opportunities for outdoor recreation and a closer connection to nature.    8. Safety and security: Small towns generally have lower crime rates compared to larger cities. This can provide a greater sense of safety and security for residents.    9. Tight-knit social networks: In small towns  it is common for people to have strong social networks and connections. This can lead to a greater sense of belonging and support.    10. Quaint and charming atmosphere: Small towns often have a quaint and charming atmosphere with historic buildings  local shops  and unique cultural offerings. This can create a sense of nostalgia and a unique living experience.
56,Delete Class ,Error : getDiscoveredProject CU : JavaBenchmarkPackageImpl.java Line : 341,The method getDiscoveredProject is generated from the metaclass DiscoveredProject which is removed  Coevolve this java code snippet according to the described change  :   /**   * Complete the initialization of the package and its meta-model.  This method is guarded to have no affect on any invocation but its first. <!-- begin-user-doc --> <!-- end-user-doc -->  * @generated  */ public void initializePackageContents(){   if (isInitialized)   return    isInitialized=true    setName(eNAME)    setNsPrefix(eNS_PREFIX)    setNsURI(eNS_URI)    BenchmarkPackage theBenchmarkPackage=(BenchmarkPackage)EPackage.Registry.INSTANCE.getEPackage(BenchmarkPackage.eNS_URI)    javaProjectEClass.getESuperTypes().add(this.getAbstractJavaProject())    javaProjectEClass.getESuperTypes().add(theBenchmarkPackage.getProject())    javaDiscoveredProjectEClass.getESuperTypes().add(this.getAbstractJavaProject())    javaDiscoveredProjectEClass.getESuperTypes().add(theBenchmarkPackage.getDiscoveredProject())    cdoDiscoveryEClass.getESuperTypes().add(this.getAbstractCDODiscovery())    cdoDiscoveryEClass.getESuperTypes().add(theBenchmarkPackage.getDiscovery())    cdoProjectDiscoveryEClass.getESuperTypes().add(this.getAbstractCDODiscovery())    cdoProjectDiscoveryEClass.getESuperTypes().add(theBenchmarkPackage.getProjectDiscovery())    initEClass(abstractCDODiscoveryEClass AbstractCDODiscovery.class "AbstractCDODiscovery" IS_ABSTRACT !IS_INTERFACE IS_GENERATED_INSTANCE_CLASS)    initEAttribute(getAbstractCDODiscovery_Version() ecorePackage.getEString() "version" null 0 1 AbstractCDODiscovery.class !IS_TRANSIENT !IS_VOLATILE IS_CHANGEABLE !IS_UNSETTABLE !IS_ID IS_UNIQUE !IS_DERIVED IS_ORDERED)    initEAttribute(getAbstractCDODiscovery_RevisedLruCapacity() ecorePackage.getEInt() "revisedLruCapacity" null 0 1 AbstractCDODiscovery.class !IS_TRANSIENT !IS_VOLATILE IS_CHANGEABLE !IS_UNSETTABLE !IS_ID IS_UNIQUE !IS_DERIVED IS_ORDERED)    initEAttribute(getAbstractCDODiscovery_CacheType() ecorePackage.getEString() "cacheType" null 0 1 AbstractCDODiscovery.class !IS_TRANSIENT !IS_VOLATILE IS_CHANGEABLE !IS_UNSETTABLE !IS_ID IS_UNIQUE !IS_DERIVED IS_ORDERED)    initEAttribute(getAbstractCDODiscovery_ServerDescription() ecorePackage.getEString() "serverDescription" null 0 1 AbstractCDODiscovery.class !IS_TRANSIENT !IS_VOLATILE IS_CHANGEABLE !IS_UNSETTABLE !IS_ID IS_UNIQUE !IS_DERIVED IS_ORDERED)    initEAttribute(getAbstractCDODiscovery_CurrentLruCapacity() ecorePackage.getEInt() "currentLruCapacity" null 0 1 AbstractCDODiscovery.class !IS_TRANSIENT !IS_VOLATILE IS_CHANGEABLE !IS_UNSETTABLE !IS_ID IS_UNIQUE !IS_DERIVED IS_ORDERED)    initEAttribute(getAbstractCDODiscovery_InitTimeInSeconds() ecorePackage.getEDouble() "initTimeInSeconds" null 0 1 AbstractCDODiscovery.class !IS_TRANSIENT !IS_VOLATILE IS_CHANGEABLE !IS_UNSETTABLE !IS_ID IS_UNIQUE !IS_DERIVED IS_ORDERED)    initEClass(abstractJavaProjectEClass AbstractJavaProject.class "AbstractJavaProject" IS_ABSTRACT !IS_INTERFACE IS_GENERATED_INSTANCE_CLASS)    initEAttribute(getAbstractJavaProject_AverageJavaClassesPerPackage() ecorePackage.getEDouble() "averageJavaClassesPerPackage" null 0 1 AbstractJavaProject.class IS_TRANSIENT IS_VOLATILE !IS_CHANGEABLE !IS_UNSETTABLE !IS_ID IS_UNIQUE IS_DERIVED IS_ORDERED)    initEClass(javaProjectEClass JavaProject.class "JavaProject" !IS_ABSTRACT !IS_INTERFACE IS_GENERATED_INSTANCE_CLASS)    initEClass(javaDiscoveredProjectEClass JavaDiscoveredProject.class "JavaDiscoveredProject" !IS_ABSTRACT !IS_INTERFACE IS_GENERATED_INSTANCE_CLASS)    initEClass(cdoDiscoveryEClass CDODiscovery.class "CDODiscovery" !IS_ABSTRACT !IS_INTERFACE IS_GENERATED_INSTANCE_CLASS)    initEClass(cdoProjectDiscoveryEClass CDOProjectDiscovery.class "CDOProjectDiscovery" !IS_ABSTRACT !IS_INTERFACE IS_GENERATED_INSTANCE_CLASS)    createResource(eNS_URI)  }   Give the updated java method only,/**    * Complete the initialization of the package and its meta-model.  This method is guarded to have no affect on any invocation but its first. <!-- begin-user-doc --> <!-- end-user-doc -->   * @generated   */  public void initializePackageContents(){    if (isInitialized)   return     isInitialized=true     setName(eNAME)     setNsPrefix(eNS_PREFIX)     setNsURI(eNS_URI)     BenchmarkPackage theBenchmarkPackage=(BenchmarkPackage)EPackage.Registry.INSTANCE.getEPackage(BenchmarkPackage.eNS_URI)     javaProjectEClass.getESuperTypes().add(this.getAbstractJavaProject())     javaProjectEClass.getESuperTypes().add(theBenchmarkPackage.getProject())     javaDiscoveredProjectEClass.getESuperTypes().add(this.getAbstractJavaProject())     javaDiscoveredProjectEClass.getESuperTypes().add(theBenchmarkPackage.getDiscoveredProject())     cdoDiscoveryEClass.getESuperTypes().add(this.getAbstractCDODiscovery())     cdoDiscoveryEClass.getESuperTypes().add(theBenchmarkPackage.getDiscovery())     cdoProjectDiscoveryEClass.getESuperTypes().add(this.getAbstractCDODiscovery())     cdoProjectDiscoveryEClass.getESuperTypes().add(theBenchmarkPackage.getProjectDiscovery())     initEClass(abstractCDODiscoveryEClass AbstractCDODiscovery.class "AbstractCDODiscovery" IS_ABSTRACT !IS_INTERFACE IS_GENERATED_INSTANCE_CLASS)     initEAttribute(getAbstractCDODiscovery_Version() ecorePackage.getEString() "version" null 0 1 AbstractCDODiscovery.class !IS_TRANSIENT !IS_VOLATILE IS_CHANGEABLE !IS_UNSETTABLE !IS_ID IS_UNIQUE !IS_DERIVED IS_ORDERED)     initEAttribute(getAbstractCDODiscovery_RevisedLruCapacity() ecorePackage.getEInt() "revisedLruCapacity" null 0 1 AbstractCDODiscovery.class !IS_TRANSIENT !IS_VOLATILE IS_CHANGEABLE !IS_UNSETTABLE !IS_ID IS_UNIQUE !IS_DERIVED IS_ORDERED)     initEAttribute(getAbstractCDODiscovery_CacheType() ecorePackage.getEString() "cacheType" null 0 1 AbstractCDODiscovery.class !IS_TRANSIENT !IS_VOLATILE IS_CHANGEABLE !IS_UNSETTABLE !IS_ID IS_UNIQUE !IS_DERIVED IS_ORDERED)     initEAttribute(getAbstractCDODiscovery_ServerDescription() ecorePackage.getEString() "serverDescription" null 0 1 AbstractCDODiscovery.class !IS_TRANSIENT !IS_VOLATILE IS_CHANGEABLE !IS_UNSETTABLE !IS_ID IS_UNIQUE !IS_DERIVED IS_ORDERED)     initEAttribute(getAbstractCDODiscovery_CurrentLruCapacity() ecorePackage.getEInt() "currentLruCapacity" null 0 1 AbstractCDODiscovery.class !IS_TRANSIENT !IS_VOLATILE IS_CHANGEABLE !IS_UNSETTABLE !IS_ID IS_UNIQUE !IS_DERIVED IS_ORDERED)     initEAttribute(getAbstractCDODiscovery_InitTimeInSeconds() ecorePackage.getEDouble() "initTimeInSeconds" null 0 1 AbstractCDODiscovery.class !IS_TRANSIENT !IS_VOLATILE IS_CHANGEABLE !IS_UNSETTABLE !IS_ID IS_UNIQUE !IS_DERIVED IS_ORDERED)     initEClass(abstractJavaProjectEClass AbstractJavaProject.class "AbstractJavaProject" IS_ABSTRACT !IS_INTERFACE IS_GENERATED_INSTANCE_CLASS)     initEAttribute(getAbstractJavaProject_AverageJavaClassesPerPackage() ecorePackage.getEDouble() "averageJavaClassesPerPackage" null 0 1 AbstractJavaProject.class IS_TRANSIENT IS_VOLATILE !IS_CHANGEABLE !IS_UNSETTABLE !IS_ID IS_UNIQUE IS_DERIVED IS_ORDERED)     initEClass(javaProjectEClass JavaProject.class "JavaProject" !IS_ABSTRACT !IS_INTERFACE IS_GENERATED_INSTANCE_CLASS)     initEClass(javaDiscoveredProjectEClass JavaDiscoveredProject.class "JavaDiscoveredProject" !IS_ABSTRACT !IS_INTERFACE IS_GENERATED_INSTANCE_CLASS)     initEClass(cdoDiscoveryEClass CDODiscovery.class "CDODiscovery" !IS_ABSTRACT !IS_INTERFACE IS_GENERATED_INSTANCE_CLASS)     initEClass(cdoProjectDiscoveryEClass CDOProjectDiscovery.class "CDOProjectDiscovery" !IS_ABSTRACT !IS_INTERFACE IS_GENERATED_INSTANCE_CLASS)     createResource(eNS_URI)   }    /**   * Returns the discovered project.   * @return the discovered project   */  public DiscoveredProject getDiscoveredProject() {    // TODO: implement method    return null   }
