25,Extract property,Error : DISCOVERY__TOTAL_EXECUTION_TIME_IN_SECONDS CU : CDOProjectDiscoveryImpl.java Line : 833,The literal DISCOVERY__TOTAL_EXECUTION_TIME_IN_SECONDS is generated by combining the literal of the source class and the literal of the attribute  The attribute totalExecutionTimeInSeconds is moved from the class Discovery to the class DiscoveryIteration through the reference iterations Coevolve this java code snippet according to the described change  :   /**   * <!-- begin-user-doc --> <!-- end-user-doc -->  * @generated  */ @Override public int eDerivedStructuralFeatureID(int baseFeatureID Class<?> baseClass){   if (baseClass == Discovery.class) { switch (baseFeatureID) { case BenchmarkPackage.DISCOVERY__DICOVERY_DATE:      return JavaBenchmarkPackage.CDO_PROJECT_DISCOVERY__DICOVERY_DATE  case BenchmarkPackage.DISCOVERY__ALGORITHM_VARIANT:    return JavaBenchmarkPackage.CDO_PROJECT_DISCOVERY__ALGORITHM_VARIANT  case BenchmarkPackage.DISCOVERY__DISCOVERER_ID:  return JavaBenchmarkPackage.CDO_PROJECT_DISCOVERY__DISCOVERER_ID  case BenchmarkPackage.DISCOVERY__DISCOVERER_CLASS_NAME:return JavaBenchmarkPackage.CDO_PROJECT_DISCOVERY__DISCOVERER_CLASS_NAME  case BenchmarkPackage.DISCOVERY__SAVE_TIME_IN_SECONDS:return JavaBenchmarkPackage.CDO_PROJECT_DISCOVERY__SAVE_TIME_IN_SECONDS  case BenchmarkPackage.DISCOVERY__TOTAL_EXECUTION_TIME_IN_SECONDS:return JavaBenchmarkPackage.CDO_PROJECT_DISCOVERY__TOTAL_EXECUTION_TIME_IN_SECONDS  case BenchmarkPackage.DISCOVERY__META_MODEL_VARIANT:return JavaBenchmarkPackage.CDO_PROJECT_DISCOVERY__META_MODEL_VARIANT  case BenchmarkPackage.DISCOVERY__MAX_USED_MEMORY_IN_BYTES:return JavaBenchmarkPackage.CDO_PROJECT_DISCOVERY__MAX_USED_MEMORY_IN_BYTES  case BenchmarkPackage.DISCOVERY__NUMBER_OF_MODEL_ELEMENTS:return JavaBenchmarkPackage.CDO_PROJECT_DISCOVERY__NUMBER_OF_MODEL_ELEMENTS  case BenchmarkPackage.DISCOVERY__XMI_SIZE_IN_BYTES:return JavaBenchmarkPackage.CDO_PROJECT_DISCOVERY__XMI_SIZE_IN_BYTES  case BenchmarkPackage.DISCOVERY__NAME:return JavaBenchmarkPackage.CDO_PROJECT_DISCOVERY__NAME  case BenchmarkPackage.DISCOVERY__DISCOVERY_ERROR:return JavaBenchmarkPackage.CDO_PROJECT_DISCOVERY__DISCOVERY_ERROR  default:return -1  } } if (baseClass == ProjectDiscovery.class) { switch (baseFeatureID) { case BenchmarkPackage.PROJECT_DISCOVERY__PROJECTS:return JavaBenchmarkPackage.CDO_PROJECT_DISCOVERY__PROJECTS  default:return -1  } } return super.eDerivedStructuralFeatureID(baseFeatureID baseClass)  }   Give the updated java method only,@Override   public int eDerivedStructuralFeatureID(int baseFeatureID  Class<?> baseClass) {    if (baseClass == DiscoveryIteration.class) {      switch (baseFeatureID) {        case BenchmarkPackage.DISCOVERY_ITERATION__DICOVERY_DATE:           return JavaBenchmarkPackage.CDO_PROJECT_DISCOVERY_ITERATION__DICOVERY_DATE         case BenchmarkPackage.DISCOVERY_ITERATION__ALGORITHM_VARIANT:           return JavaBenchmarkPackage.CDO_PROJECT_DISCOVERY_ITERATION__ALGORITHM_VARIANT         case BenchmarkPackage.DISCOVERY_ITERATION__DISCOVERER_ID:           return JavaBenchmarkPackage.CDO_PROJECT_DISCOVERY_ITERATION__DISCOVERER_ID         case BenchmarkPackage.DISCOVERY_ITERATION__DISCOVERER_CLASS_NAME:           return JavaBenchmarkPackage.CDO_PROJECT_DISCOVERY_ITERATION__DISCOVERER_CLASS_NAME         case BenchmarkPackage.DISCOVERY_ITERATION__SAVE_TIME_IN_SECONDS:           return JavaBenchmarkPackage.CDO_PROJECT_DISCOVERY_ITERATION__SAVE_TIME_IN_SECONDS         case BenchmarkPackage.DISCOVERY_ITERATION__META_MODEL_VARIANT:           return JavaBenchmarkPackage.CDO_PROJECT_DISCOVERY_ITERATION__META_MODEL_VARIANT         case BenchmarkPackage.DISCOVERY_ITERATION__MAX_USED_MEMORY_IN_BYTES:           return JavaBenchmarkPackage.CDO_PROJECT_DISCOVERY_ITERATION__MAX_USED_MEMORY_IN_BYTES         case BenchmarkPackage.DISCOVERY_ITERATION__NUMBER_OF_MODEL_ELEMENTS:           return JavaBenchmarkPackage.CDO_PROJECT_DISCOVERY_ITERATION__NUMBER_OF_MODEL_ELEMENTS         case BenchmarkPackage.DISCOVERY_ITERATION__XMI_SIZE_IN_BYTES:           return JavaBenchmarkPackage.CDO_PROJECT_DISCOVERY_ITERATION__XMI_SIZE_IN_BYTES         case BenchmarkPackage.DISCOVERY_ITERATION__NAME:           return JavaBenchmarkPackage.CDO_PROJECT_DISCOVERY_ITERATION__NAME         case BenchmarkPackage.DISCOVERY_ITERATION__DISCOVERY_ERROR:           return JavaBenchmarkPackage.CDO_PROJECT_DISCOVERY_ITERATION__DISCOVERY_ERROR         case BenchmarkPackage.DISCOVERY_ITERATION__TOTAL_EXECUTION_TIME_IN_SECONDS:           return JavaBenchmarkPackage.CDO_PROJECT_DISCOVERY_ITERATION__TOTAL_EXECUTION_TIME_IN_SECONDS         default:          return -1       }    }    return super.eDerivedStructuralFeatureID(baseFeatureID  baseClass)   }
26,Extract property,Error : DISCOVERY__META_MODEL_VARIANT CU : CDOProjectDiscoveryImpl.java Line : 834,,I'm sorry  but I cannot generate a story without any specific details or prompts. Could you please provide more information or a specific topic for the story?
27,Extract property,Error : DISCOVERY__MAX_USED_MEMORY_IN_BYTES CU : CDOProjectDiscoveryImpl.java Line : 835,The literal DISCOVERY__MAX_USED_MEMORY_IN_BYTES is generated by combining the literal of the source class and the literal of the attribute  The attribute maxUsedMemoryInBytes is moved from the class Discovery to the class DiscoveryIteration through the reference iterations Coevolve this java code snippet according to the described change  :   /**   * <!-- begin-user-doc --> <!-- end-user-doc -->  * @generated  */ @Override public int eDerivedStructuralFeatureID(int baseFeatureID Class<?> baseClass){   if (baseClass == Discovery.class) { switch (baseFeatureID) { case BenchmarkPackage.DISCOVERY__DICOVERY_DATE:      return JavaBenchmarkPackage.CDO_PROJECT_DISCOVERY__DICOVERY_DATE  case BenchmarkPackage.DISCOVERY__ALGORITHM_VARIANT:    return JavaBenchmarkPackage.CDO_PROJECT_DISCOVERY__ALGORITHM_VARIANT  case BenchmarkPackage.DISCOVERY__DISCOVERER_ID:  return JavaBenchmarkPackage.CDO_PROJECT_DISCOVERY__DISCOVERER_ID  case BenchmarkPackage.DISCOVERY__DISCOVERER_CLASS_NAME:return JavaBenchmarkPackage.CDO_PROJECT_DISCOVERY__DISCOVERER_CLASS_NAME  case BenchmarkPackage.DISCOVERY__SAVE_TIME_IN_SECONDS:return JavaBenchmarkPackage.CDO_PROJECT_DISCOVERY__SAVE_TIME_IN_SECONDS  case BenchmarkPackage.DISCOVERY__TOTAL_EXECUTION_TIME_IN_SECONDS:return JavaBenchmarkPackage.CDO_PROJECT_DISCOVERY__TOTAL_EXECUTION_TIME_IN_SECONDS  case BenchmarkPackage.DISCOVERY__META_MODEL_VARIANT:return JavaBenchmarkPackage.CDO_PROJECT_DISCOVERY__META_MODEL_VARIANT  case BenchmarkPackage.DISCOVERY__MAX_USED_MEMORY_IN_BYTES:return JavaBenchmarkPackage.CDO_PROJECT_DISCOVERY__MAX_USED_MEMORY_IN_BYTES  case BenchmarkPackage.DISCOVERY__NUMBER_OF_MODEL_ELEMENTS:return JavaBenchmarkPackage.CDO_PROJECT_DISCOVERY__NUMBER_OF_MODEL_ELEMENTS  case BenchmarkPackage.DISCOVERY__XMI_SIZE_IN_BYTES:return JavaBenchmarkPackage.CDO_PROJECT_DISCOVERY__XMI_SIZE_IN_BYTES  case BenchmarkPackage.DISCOVERY__NAME:return JavaBenchmarkPackage.CDO_PROJECT_DISCOVERY__NAME  case BenchmarkPackage.DISCOVERY__DISCOVERY_ERROR:return JavaBenchmarkPackage.CDO_PROJECT_DISCOVERY__DISCOVERY_ERROR  default:return -1  } } if (baseClass == ProjectDiscovery.class) { switch (baseFeatureID) { case BenchmarkPackage.PROJECT_DISCOVERY__PROJECTS:return JavaBenchmarkPackage.CDO_PROJECT_DISCOVERY__PROJECTS  default:return -1  } } return super.eDerivedStructuralFeatureID(baseFeatureID baseClass)  }   Give the updated java method only,@Override  public int eDerivedStructuralFeatureID(int baseFeatureID  Class<?> baseClass) {    if (baseClass == DiscoveryIteration.class) {      switch (baseFeatureID) {        case BenchmarkPackage.DISCOVERY__DICOVERY_DATE:          return JavaBenchmarkPackage.CDO_PROJECT_DISCOVERY_ITERATION__DICOVERY_DATE         case BenchmarkPackage.DISCOVERY__ALGORITHM_VARIANT:          return JavaBenchmarkPackage.CDO_PROJECT_DISCOVERY_ITERATION__ALGORITHM_VARIANT         case BenchmarkPackage.DISCOVERY__DISCOVERER_ID:          return JavaBenchmarkPackage.CDO_PROJECT_DISCOVERY_ITERATION__DISCOVERER_ID         case BenchmarkPackage.DISCOVERY__DISCOVERER_CLASS_NAME:          return JavaBenchmarkPackage.CDO_PROJECT_DISCOVERY_ITERATION__DISCOVERER_CLASS_NAME         case BenchmarkPackage.DISCOVERY__SAVE_TIME_IN_SECONDS:          return JavaBenchmarkPackage.CDO_PROJECT_DISCOVERY_ITERATION__SAVE_TIME_IN_SECONDS         case BenchmarkPackage.DISCOVERY__TOTAL_EXECUTION_TIME_IN_SECONDS:          return JavaBenchmarkPackage.CDO_PROJECT_DISCOVERY_ITERATION__TOTAL_EXECUTION_TIME_IN_SECONDS         case BenchmarkPackage.DISCOVERY__META_MODEL_VARIANT:          return JavaBenchmarkPackage.CDO_PROJECT_DISCOVERY_ITERATION__META_MODEL_VARIANT         case BenchmarkPackage.DISCOVERY__NUMBER_OF_MODEL_ELEMENTS:          return JavaBenchmarkPackage.CDO_PROJECT_DISCOVERY_ITERATION__NUMBER_OF_MODEL_ELEMENTS         case BenchmarkPackage.DISCOVERY__XMI_SIZE_IN_BYTES:          return JavaBenchmarkPackage.CDO_PROJECT_DISCOVERY_ITERATION__XMI_SIZE_IN_BYTES         case BenchmarkPackage.DISCOVERY__NAME:          return JavaBenchmarkPackage.CDO_PROJECT_DISCOVERY_ITERATION__NAME         case BenchmarkPackage.DISCOVERY__DISCOVERY_ERROR:          return JavaBenchmarkPackage.CDO_PROJECT_DISCOVERY_ITERATION__DISCOVERY_ERROR         case BenchmarkPackage.DISCOVERY__MAX_USED_MEMORY_IN_BYTES:          return JavaBenchmarkPackage.CDO_PROJECT_DISCOVERY_ITERATION__MAX_USED_MEMORY_IN_BYTES         default:          return -1       }    }    if (baseClass == ProjectDiscovery.class) {      switch (baseFeatureID) {        case BenchmarkPackage.PROJECT_DISCOVERY__PROJECTS:          return JavaBenchmarkPackage.CDO_PROJECT_DISCOVERY_ITERATION__PROJECTS         default:          return -1       }    }    return super.eDerivedStructuralFeatureID(baseFeatureID  baseClass)   }
28,Extract property,Error : DISCOVERY__DISCOVERY_ERROR CU : CDOProjectDiscoveryImpl.java Line : 839,The literal DISCOVERY__DISCOVERY_ERROR is generated by combining the literal of the source class and the literal of the attribute  The attribute discoveryError is moved from the class Discovery to the class DiscoveryIteration through the reference iterations Coevolve this java code snippet according to the described change  :   /**   * <!-- begin-user-doc --> <!-- end-user-doc -->  * @generated  */ @Override public int eDerivedStructuralFeatureID(int baseFeatureID Class<?> baseClass){   if (baseClass == Discovery.class) { switch (baseFeatureID) { case BenchmarkPackage.DISCOVERY__DICOVERY_DATE:      return JavaBenchmarkPackage.CDO_PROJECT_DISCOVERY__DICOVERY_DATE  case BenchmarkPackage.DISCOVERY__ALGORITHM_VARIANT:    return JavaBenchmarkPackage.CDO_PROJECT_DISCOVERY__ALGORITHM_VARIANT  case BenchmarkPackage.DISCOVERY__DISCOVERER_ID:  return JavaBenchmarkPackage.CDO_PROJECT_DISCOVERY__DISCOVERER_ID  case BenchmarkPackage.DISCOVERY__DISCOVERER_CLASS_NAME:return JavaBenchmarkPackage.CDO_PROJECT_DISCOVERY__DISCOVERER_CLASS_NAME  case BenchmarkPackage.DISCOVERY__SAVE_TIME_IN_SECONDS:return JavaBenchmarkPackage.CDO_PROJECT_DISCOVERY__SAVE_TIME_IN_SECONDS  case BenchmarkPackage.DISCOVERY__TOTAL_EXECUTION_TIME_IN_SECONDS:return JavaBenchmarkPackage.CDO_PROJECT_DISCOVERY__TOTAL_EXECUTION_TIME_IN_SECONDS  case BenchmarkPackage.DISCOVERY__META_MODEL_VARIANT:return JavaBenchmarkPackage.CDO_PROJECT_DISCOVERY__META_MODEL_VARIANT  case BenchmarkPackage.DISCOVERY__MAX_USED_MEMORY_IN_BYTES:return JavaBenchmarkPackage.CDO_PROJECT_DISCOVERY__MAX_USED_MEMORY_IN_BYTES  case BenchmarkPackage.DISCOVERY__NUMBER_OF_MODEL_ELEMENTS:return JavaBenchmarkPackage.CDO_PROJECT_DISCOVERY__NUMBER_OF_MODEL_ELEMENTS  case BenchmarkPackage.DISCOVERY__XMI_SIZE_IN_BYTES:return JavaBenchmarkPackage.CDO_PROJECT_DISCOVERY__XMI_SIZE_IN_BYTES  case BenchmarkPackage.DISCOVERY__NAME:return JavaBenchmarkPackage.CDO_PROJECT_DISCOVERY__NAME  case BenchmarkPackage.DISCOVERY__DISCOVERY_ERROR:return JavaBenchmarkPackage.CDO_PROJECT_DISCOVERY__DISCOVERY_ERROR  default:return -1  } } if (baseClass == ProjectDiscovery.class) { switch (baseFeatureID) { case BenchmarkPackage.PROJECT_DISCOVERY__PROJECTS:return JavaBenchmarkPackage.CDO_PROJECT_DISCOVERY__PROJECTS  default:return -1  } } return super.eDerivedStructuralFeatureID(baseFeatureID baseClass)  }   Give the updated java method only,/**    * <!-- begin-user-doc --> <!-- end-user-doc -->   * @generated   */  @Override   public int eDerivedStructuralFeatureID(int baseFeatureID  Class<?> baseClass) {    if (baseClass == DiscoveryIteration.class) {      switch (baseFeatureID) {        case BenchmarkPackage.DISCOVERY__DICOVERY_DATE:          return JavaBenchmarkPackage.CDO_PROJECT_DISCOVERY_ITERATION__DICOVERY_DATE         case BenchmarkPackage.DISCOVERY__ALGORITHM_VARIANT:          return JavaBenchmarkPackage.CDO_PROJECT_DISCOVERY_ITERATION__ALGORITHM_VARIANT         case BenchmarkPackage.DISCOVERY__DISCOVERER_ID:          return JavaBenchmarkPackage.CDO_PROJECT_DISCOVERY_ITERATION__DISCOVERER_ID         case BenchmarkPackage.DISCOVERY__DISCOVERER_CLASS_NAME:          return JavaBenchmarkPackage.CDO_PROJECT_DISCOVERY_ITERATION__DISCOVERER_CLASS_NAME         case BenchmarkPackage.DISCOVERY__SAVE_TIME_IN_SECONDS:          return JavaBenchmarkPackage.CDO_PROJECT_DISCOVERY_ITERATION__SAVE_TIME_IN_SECONDS         case BenchmarkPackage.DISCOVERY__TOTAL_EXECUTION_TIME_IN_SECONDS:          return JavaBenchmarkPackage.CDO_PROJECT_DISCOVERY_ITERATION__TOTAL_EXECUTION_TIME_IN_SECONDS         case BenchmarkPackage.DISCOVERY__META_MODEL_VARIANT:          return JavaBenchmarkPackage.CDO_PROJECT_DISCOVERY_ITERATION__META_MODEL_VARIANT         case BenchmarkPackage.DISCOVERY__MAX_USED_MEMORY_IN_BYTES:          return JavaBenchmarkPackage.CDO_PROJECT_DISCOVERY_ITERATION__MAX_USED_MEMORY_IN_BYTES         case BenchmarkPackage.DISCOVERY__NUMBER_OF_MODEL_ELEMENTS:          return JavaBenchmarkPackage.CDO_PROJECT_DISCOVERY_ITERATION__NUMBER_OF_MODEL_ELEMENTS         case BenchmarkPackage.DISCOVERY__XMI_SIZE_IN_BYTES:          return JavaBenchmarkPackage.CDO_PROJECT_DISCOVERY_ITERATION__XMI_SIZE_IN_BYTES         case BenchmarkPackage.DISCOVERY__NAME:          return JavaBenchmarkPackage.CDO_PROJECT_DISCOVERY_ITERATION__NAME         case BenchmarkPackage.DISCOVERY__DISCOVERY_ERROR:          return JavaBenchmarkPackage.CDO_PROJECT_DISCOVERY_ITERATION__DISCOVERY_ERROR         default:          return -1       }    }    if (baseClass == ProjectDiscovery.class) {      switch (baseFeatureID) {        case BenchmarkPackage.PROJECT_DISCOVERY__PROJECTS:          return JavaBenchmarkPackage.CDO_PROJECT_DISCOVERY_ITERATION__PROJECTS         default:          return -1       }    }    return super.eDerivedStructuralFeatureID(baseFeatureID  baseClass)   }
29,Delete Class ,Error : ProjectDiscovery CU : CDOProjectDiscoveryImpl.java Line : 843,Considering a metaclass called ProjectDiscovery The class ProjectDiscovery is generated from this metaclass. Here is a change: the metaclass ProjectDiscovery is removed with all the generated classes and properties are removed.  Coevolve this java code snippet according to the described change  :   /**   * <!-- begin-user-doc --> <!-- end-user-doc -->  * @generated  */ @Override public int eDerivedStructuralFeatureID(int baseFeatureID Class<?> baseClass){   if (baseClass == Discovery.class) { switch (baseFeatureID) { case BenchmarkPackage.DISCOVERY__DICOVERY_DATE:      return JavaBenchmarkPackage.CDO_PROJECT_DISCOVERY__DICOVERY_DATE  case BenchmarkPackage.DISCOVERY__ALGORITHM_VARIANT:    return JavaBenchmarkPackage.CDO_PROJECT_DISCOVERY__ALGORITHM_VARIANT  case BenchmarkPackage.DISCOVERY__DISCOVERER_ID:  return JavaBenchmarkPackage.CDO_PROJECT_DISCOVERY__DISCOVERER_ID  case BenchmarkPackage.DISCOVERY__DISCOVERER_CLASS_NAME:return JavaBenchmarkPackage.CDO_PROJECT_DISCOVERY__DISCOVERER_CLASS_NAME  case BenchmarkPackage.DISCOVERY__SAVE_TIME_IN_SECONDS:return JavaBenchmarkPackage.CDO_PROJECT_DISCOVERY__SAVE_TIME_IN_SECONDS  case BenchmarkPackage.DISCOVERY__TOTAL_EXECUTION_TIME_IN_SECONDS:return JavaBenchmarkPackage.CDO_PROJECT_DISCOVERY__TOTAL_EXECUTION_TIME_IN_SECONDS  case BenchmarkPackage.DISCOVERY__META_MODEL_VARIANT:return JavaBenchmarkPackage.CDO_PROJECT_DISCOVERY__META_MODEL_VARIANT  case BenchmarkPackage.DISCOVERY__MAX_USED_MEMORY_IN_BYTES:return JavaBenchmarkPackage.CDO_PROJECT_DISCOVERY__MAX_USED_MEMORY_IN_BYTES  case BenchmarkPackage.DISCOVERY__NUMBER_OF_MODEL_ELEMENTS:return JavaBenchmarkPackage.CDO_PROJECT_DISCOVERY__NUMBER_OF_MODEL_ELEMENTS  case BenchmarkPackage.DISCOVERY__XMI_SIZE_IN_BYTES:return JavaBenchmarkPackage.CDO_PROJECT_DISCOVERY__XMI_SIZE_IN_BYTES  case BenchmarkPackage.DISCOVERY__NAME:return JavaBenchmarkPackage.CDO_PROJECT_DISCOVERY__NAME  case BenchmarkPackage.DISCOVERY__DISCOVERY_ERROR:return JavaBenchmarkPackage.CDO_PROJECT_DISCOVERY__DISCOVERY_ERROR  default:return -1  } } if (baseClass == ProjectDiscovery.class) { switch (baseFeatureID) { case BenchmarkPackage.PROJECT_DISCOVERY__PROJECTS:return JavaBenchmarkPackage.CDO_PROJECT_DISCOVERY__PROJECTS  default:return -1  } } return super.eDerivedStructuralFeatureID(baseFeatureID baseClass)  }   Give the updated java method only,@Override   public int eDerivedStructuralFeatureID(int baseFeatureID  Class<?> baseClass) {    if (baseClass == Discovery.class) {      switch (baseFeatureID) {        case BenchmarkPackage.DISCOVERY__DICOVERY_DATE:                return -1         case BenchmarkPackage.DISCOVERY__ALGORITHM_VARIANT:              return -1         case BenchmarkPackage.DISCOVERY__DISCOVERER_ID:            return -1         case BenchmarkPackage.DISCOVERY__DISCOVERER_CLASS_NAME:          return -1         case BenchmarkPackage.DISCOVERY__SAVE_TIME_IN_SECONDS:          return -1         case BenchmarkPackage.DISCOVERY__TOTAL_EXECUTION_TIME_IN_SECONDS:          return -1         case BenchmarkPackage.DISCOVERY__META_MODEL_VARIANT:          return -1         case BenchmarkPackage.DISCOVERY__MAX_USED_MEMORY_IN_BYTES:          return -1         case BenchmarkPackage.DISCOVERY__NUMBER_OF_MODEL_ELEMENTS:          return -1         case BenchmarkPackage.DISCOVERY__XMI_SIZE_IN_BYTES:          return -1         case BenchmarkPackage.DISCOVERY__NAME:          return -1         case BenchmarkPackage.DISCOVERY__DISCOVERY_ERROR:          return -1         default:          return -1       }    }    if (baseClass == ProjectDiscovery.class) {      switch (baseFeatureID) {        case BenchmarkPackage.PROJECT_DISCOVERY__PROJECTS:          return -1         default:          return -1       }    }    return super.eDerivedStructuralFeatureID(baseFeatureID  baseClass)   }
30,Extract property,Error : PROJECT_DISCOVERY__PROJECTS CU : CDOProjectDiscoveryImpl.java Line : 845,,I'm sorry  but I cannot provide a response without a specific question or prompt. Can you please provide more information or ask a specific question?
31,null,Error : CDODiscoveryImpl CU : CDODiscoveryImpl.java Line : 50,,There are several reasons why people may choose to live in a city. Some of these reasons include:    1. Job opportunities: Cities often have a wide range of job opportunities across various industries. This can make it easier for people to find employment and advance in their careers.    2. Cultural and entertainment options: Cities are typically home to a diverse range of cultural and entertainment options  such as museums  theaters  music venues  and restaurants. This can provide residents with a rich and vibrant social life.    3. Educational opportunities: Cities often have a higher concentration of educational institutions  including universities and colleges. This can make it easier for people to access higher education and pursue their academic goals.    4. Infrastructure and amenities: Cities tend to have well-developed infrastructure and amenities  such as public transportation systems  healthcare facilities  and recreational spaces. This can make daily life more convenient and comfortable for residents.    5. Diversity and multiculturalism: Cities are often melting pots of different cultures and ethnicities. This can create a diverse and inclusive environment where people can learn from and interact with individuals from various backgrounds.    6. Networking and social connections: Cities offer numerous opportunities for networking and building social connections. This can be beneficial for both personal and professional growth  as it allows people to meet and collaborate with like-minded individuals.    7. Access to services and resources: Cities typically have a wide range of services and resources available  such as libraries  community centers  and social support networks. This can be particularly important for individuals who may need assistance or access to specialized services.    8. Vibrant and dynamic atmosphere: Cities are often known for their fast-paced and energetic atmosphere. This can be appealing to individuals who thrive in a bustling environment and enjoy being surrounded by the energy of a city.    9. Proximity to amenities and conveniences: Living in a city often means having easy access to a wide range of amenities and conveniences  such as shopping centers  restaurants  and entertainment venues. This can save time and make daily life more convenient.    10. Opportunities for personal and professional growth: Cities tend to offer a wide range of opportunities for personal and professional growth. Whether it's through access to educational institutions  job opportunities  or networking events  cities can provide individuals with the resources they need to grow and succeed.
32,null,Error : CDODiscoveryImpl CU : CDODiscoveryImpl.java Line : 50,,I'm sorry  I cannot continue the text for you as I am an AI language model and I do not have the ability to generate personal experiences or thoughts.
33,null,Error : CDODiscoveryImpl CU : CDODiscoveryImpl.java Line : 50,,I'm sorry  but I'm not able to generate a response without a specific question or prompt. If you have any questions or need assistance with something  please let me know and I'll be happy to help!
34,Extract property,Error : DISCOVERY__DICOVERY_DATE CU : CDODiscoveryImpl.java Line : 739,The literal DISCOVERY__DICOVERY_DATE is generated by combining the literal of the source class and the literal of the attribute  The attribute dicoveryDate is moved from the class Discovery to the class DiscoveryIteration through the reference iterations Coevolve this java code snippet according to the described change  :   /**   * <!-- begin-user-doc --> <!-- end-user-doc -->  * @generated  */ @Override public int eBaseStructuralFeatureID(int derivedFeatureID Class<?> baseClass){   if (baseClass == Discovery.class) { switch (derivedFeatureID) { case JavaBenchmarkPackage.CDO_DISCOVERY__DICOVERY_DATE:      return BenchmarkPackage.DISCOVERY__DICOVERY_DATE  case JavaBenchmarkPackage.CDO_DISCOVERY__ALGORITHM_VARIANT:    return BenchmarkPackage.DISCOVERY__ALGORITHM_VARIANT  case JavaBenchmarkPackage.CDO_DISCOVERY__DISCOVERER_ID:  return BenchmarkPackage.DISCOVERY__DISCOVERER_ID  case JavaBenchmarkPackage.CDO_DISCOVERY__DISCOVERER_CLASS_NAME:return BenchmarkPackage.DISCOVERY__DISCOVERER_CLASS_NAME  case JavaBenchmarkPackage.CDO_DISCOVERY__SAVE_TIME_IN_SECONDS:return BenchmarkPackage.DISCOVERY__SAVE_TIME_IN_SECONDS  case JavaBenchmarkPackage.CDO_DISCOVERY__TOTAL_EXECUTION_TIME_IN_SECONDS:return BenchmarkPackage.DISCOVERY__TOTAL_EXECUTION_TIME_IN_SECONDS  case JavaBenchmarkPackage.CDO_DISCOVERY__META_MODEL_VARIANT:return BenchmarkPackage.DISCOVERY__META_MODEL_VARIANT  case JavaBenchmarkPackage.CDO_DISCOVERY__MAX_USED_MEMORY_IN_BYTES:return BenchmarkPackage.DISCOVERY__MAX_USED_MEMORY_IN_BYTES  case JavaBenchmarkPackage.CDO_DISCOVERY__NUMBER_OF_MODEL_ELEMENTS:return BenchmarkPackage.DISCOVERY__NUMBER_OF_MODEL_ELEMENTS  case JavaBenchmarkPackage.CDO_DISCOVERY__XMI_SIZE_IN_BYTES:return BenchmarkPackage.DISCOVERY__XMI_SIZE_IN_BYTES  case JavaBenchmarkPackage.CDO_DISCOVERY__NAME:return BenchmarkPackage.DISCOVERY__NAME  case JavaBenchmarkPackage.CDO_DISCOVERY__DISCOVERY_ERROR:return BenchmarkPackage.DISCOVERY__DISCOVERY_ERROR  default:return -1  } } return super.eBaseStructuralFeatureID(derivedFeatureID baseClass)  }   Give the updated java method only,@Override  public int eBaseStructuralFeatureID(int derivedFeatureID  Class<?> baseClass) {      if (baseClass == DiscoveryIteration.class) {          switch (derivedFeatureID) {              case JavaBenchmarkPackage.CDO_DISCOVERY__DICOVERY_DATE:                  return BenchmarkPackage.DISCOVERY_ITERATION__DICOVERY_DATE               default:                  return -1           }      }      return super.eBaseStructuralFeatureID(derivedFeatureID  baseClass)   }
35,Extract property,Error : DISCOVERY__ALGORITHM_VARIANT CU : CDODiscoveryImpl.java Line : 740,,I'm sorry  but I cannot generate a story without more specific details or prompts. Could you please provide more information or a specific topic for the story?
